FundacionEfrain;2017-07-04 16:38;0;0;"# Patriots 4 # Healthcarebill R U 1 @ SenWarren @SenKaineOffice @ lisamurkowski @ SenatorHassan @ SenatorTimScott @ SenKamalaHarris @ SenMikeLee";;@ @SenKaineOffice @ @ @ @ @;# #;"882337823109545984";https://twitter.com/FundacionEfrain/status/882337823109545984
FundacionEfrain;2017-07-04 13:15;0;0;"@ senorrinhatch @ SenWarren @ SenatorHassan @SenKaineOffice @ lisamurkowski # HealthcareBill # DeclarationOfIndependence from # Obamacare";;@ @ @ @SenKaineOffice @;# # #;"882286695126884354";https://twitter.com/FundacionEfrain/status/882286695126884354
pgarvey10;2017-07-04 13:09;1;3;"Thank u @ SenatorHassan for chatting with us about affordable healthcare today! # CFadvocacy # jra # CysticFibrosis # Happy4thofJulypic.twitter.com/MyANFhBTGh";;@;# # # #;"882285177900347393";https://twitter.com/pgarvey10/status/882285177900347393
FundacionEfrain;2017-07-04 08:35;0;0;"@ SenMurphyOffice @ senorrinhatch @ SenWarren @SenKaineOffice @ lisamurkowski @ SenatorHassan # HealthcareBill # American as # applepie";;@ @ @ @SenKaineOffice @ @;# # #;"882216304773672960";https://twitter.com/FundacionEfrain/status/882216304773672960
1hope42016;2017-07-03 23:11;0;0;"Senate Republicans apparently just sent two partisan healthcare options to the CBO. I again urge you to work on a bipartisan solution.";;;;"882074427760017408";https://twitter.com/1hope42016/status/882074427760017408
ReptoDem;2017-07-03 19:13;1;0;"We need to protect our citizens from losing affordable health care. What are you doing about that? # protectourcare # SaveMedicaid";;;# #;"882014410788618241";https://twitter.com/ReptoDem/status/882014410788618241
justicenojustus;2017-07-03 17:01;0;0;"I received a FB message from rob saying he care and he doesn't have a choice than to vote NO";;;;"881981226361516033";https://twitter.com/justicenojustus/status/881981226361516033
52novels;2017-07-03 16:47;0;2;"Where are your health care town halls. OH-09, 43606";;;;"881977839482019840";https://twitter.com/52novels/status/881977839482019840
kmeghan;2017-07-03 16:46;0;0;"Let's focus on a few things at a time maybe? Like healthcare? And # 25thAmmendmentNow";;;#;"881977356247805952";https://twitter.com/kmeghan/status/881977356247805952
SeanMcGurr;2017-07-03 16:25;0;1;"Glad to see you can work in a bipartisan fashion. Please do the same on healthcare by working with Dems to make the ACA better.";;;;"881972122851065857";https://twitter.com/SeanMcGurr/status/881972122851065857
CriminalFrog;2017-07-03 16:04;1;5;"Your tweets are offensive because they just show how you are looking the other way as we loose our healthcare and our environment";;;;"881967024032931845";https://twitter.com/CriminalFrog/status/881967024032931845
jonsthinkin;2017-07-03 08:34;0;0;"She then applied to Medicaid and was turned down because she earned too much. She can no longer work now and is under the care of my mother";;;;"881853673801953280";https://twitter.com/jonsthinkin/status/881853673801953280
djsav16;2017-07-02 16:34;0;0;"@ SenatorShaheen @ SenatorHassan Food for thought. Let the market heal healthcare. # RepealObamacare # NHpoliticshttps://twitter.com/cr/status/881573271011020801 …";;@ @;# #;"881612134899122176";https://twitter.com/djsav16/status/881612134899122176
Strickalator;2017-07-01 18:39;1;1;"I have no Justice yet, but there's evidence. I need a lawyer. A high profile one. I'm the LTQQI of # LGBTQIA a disabled woman seeking care!";;;#;"881281091335618561";https://twitter.com/Strickalator/status/881281091335618561
