amadeusmax;2017-07-19 20:11;0;0;"When millions lose healthcare, they will stay go to the hospital, becuz no one plans on it. That cost to those that can pay, and raises ins";;;;"887827185234563072";https://twitter.com/amadeusmax/status/887827185234563072
perfektst0rm;2017-07-19 19:40;0;1;"How about you write up legislation that gives citizens the healthcare you have?";;;;"887819557683036161";https://twitter.com/perfektst0rm/status/887819557683036161
DriveByPoster2;2017-07-19 19:17;0;0;"Spent the day contacting @ JimInhofe @ RepMullin @ SenatorLankford on NOT repealing healthcare. I feel my time was wasted.";;@ @ @;;"887813596473958400";https://twitter.com/DriveByPoster2/status/887813596473958400
sz1tkt;2017-07-19 18:47;0;0;"Stay in DC until the Senate gets healthcare done";;;;"887806051013283840";https://twitter.com/sz1tkt/status/887806051013283840
DriveByPoster2;2017-07-19 18:46;0;0;"@ SenatorLankford Don't vote to repeal health care for 32 million people many that support you. Fix what we have";;@;;"887805775841816579";https://twitter.com/DriveByPoster2/status/887805775841816579
3Sinnings;2017-07-19 18:36;0;0;"Handing US over to Russia. @ SenatorLankford @ JimInhofe while you guys try to take away healthcare. Stand. Up.https://twitter.com/thehill/status/887801246203228161 …";;@ @;;"887803440033931264";https://twitter.com/3Sinnings/status/887803440033931264
okieSNL;2017-07-19 18:27;0;2;"Senator, people of all income levels don't need help with healthcare. Your colleagues for instance.";;;;"887801118444703748";https://twitter.com/okieSNL/status/887801118444703748
FloatMP;2017-07-19 17:58;0;0;"Cutting standards of care for plans isn't it";;;;"887793837300731905";https://twitter.com/FloatMP/status/887793837300731905
BKing512;2017-07-19 17:27;0;0;"Go ahead and repeal. 32M off health care. $400B increased debt. Let that be your legacy. Own that. Be proud. You've earned it.";;;;"887785880445779969";https://twitter.com/BKing512/status/887785880445779969
nrobby86;2017-07-19 17:18;0;0;"Did I suggest taking away the right to vote? If Ok improved healthcare and education, those voters could be better informed on the issues";;;;"887783726662508544";https://twitter.com/nrobby86/status/887783726662508544
SherriRaney;2017-07-19 16:56;0;4;"You're right, Nicole! I'm not being sarcastic. We don't even know what good education or adequate health care look like!";;;;"887778198703964161";https://twitter.com/SherriRaney/status/887778198703964161
SherriRaney;2017-07-19 16:52;0;0;"Medicare for all!";;;;"887777217559900160";https://twitter.com/SherriRaney/status/887777217559900160
DanSnyderFOX25;2017-07-19 16:50;1;0;"JUST IN: Here's @ SenatorLankford's statement after today's # healthcare meeting w/ Pres. # Trump and # GOP Senators @ OKCFOXpic.twitter.com/ZGqLiI2Phn";;@ @;# # #;"887776588510765057";https://twitter.com/DanSnyderFOX25/status/887776588510765057
HostofGolden;2017-07-19 16:35;0;1;"Do you care about YOUR children's futures? Why do you want planet destroyed? My kids have to live here! You are selling their future.";;;;"887772832444407809";https://twitter.com/HostofGolden/status/887772832444407809
Streaksfriend;2017-07-19 16:15;0;0;"To say nothing of the family members I know with pre-existing conditions. Somehow it is "entitled" to need healthcare?";;;;"887767752139833345";https://twitter.com/Streaksfriend/status/887767752139833345
Streaksfriend;2017-07-19 16:10;0;0;"So many who offer nothing? Everyone I know works. Everyone I know needs access to healthcare.";;;;"887766729362993153";https://twitter.com/Streaksfriend/status/887766729362993153
oufenix;2017-07-19 15:58;1;4;"No, we just need to junk the government officials who could care less about the constituents who can't afford to pay them off.";;;;"887763544409853953";https://twitter.com/oufenix/status/887763544409853953
gentlemindmom;2017-07-19 15:52;0;1;"When you cut social services out like healthcare education social security and infrastructure with big military budget what are u protecting";;;;"887762093373632513";https://twitter.com/gentlemindmom/status/887762093373632513
bjolene85;2017-07-19 15:43;0;1;"@ SenatorLankford The state of Oklahoma can't figure out how to fund state services. It will kill support for health care. # SaveACA";;@;#;"887759860300992513";https://twitter.com/bjolene85/status/887759860300992513
bjolene85;2017-07-19 15:39;0;0;"@ SenatorLankford At your "Town Hall" in Norman, OK. Your rep is lacking in answers on health care. Please # noRepeal";;@;#;"887758877432983552";https://twitter.com/bjolene85/status/887758877432983552
Righttheewrong;2017-07-19 15:09;0;0;"Figure out why a20 year old pays the same if not more than someone in there 60's for health care. That's ridiculous.";;;;"887751375106359296";https://twitter.com/Righttheewrong/status/887751375106359296
ouachitaways;2017-07-19 14:55;0;2;"reduce costs 4 consumers reduce all subsidies 4 wealthy they don't need help increase subsidies 4 # ACA 4 all Americans # Healthcare4All";;;# #;"887747627709853700";https://twitter.com/ouachitaways/status/887747627709853700
ukudigada;2017-07-19 14:53;0;2;"Who runs his office? Oh yeah, other ex-preachers. Because, I know many career staffers who take their public service seriously.";;;;"887747343172481025";https://twitter.com/ukudigada/status/887747343172481025
jim_winter;2017-07-19 14:35;0;0;"Time to repeal and replace Obama care. I am watching what you do, Doing nothing is unacceptable. Do not leave town till it is done.";;;;"887742675067301888";https://twitter.com/jim_winter/status/887742675067301888
Teresa4052;2017-07-19 14:24;0;1;"Obamacare was a corrupt deal between Obama & the insurance companies to force millions to buy coverage they didn't need or want! REPEAL IT!";;;;"887739853085061120";https://twitter.com/Teresa4052/status/887739853085061120
childresspta;2017-07-19 13:47;0;0;"ACA was never about healthcare, it has always been about controlling people.";;;;"887730549279911936";https://twitter.com/childresspta/status/887730549279911936
mpowerednetwork;2017-07-19 13:01;0;8;"No repeal of Obamacare for me. Listen to your constituents for a change instead of the @ GOP";;@;;"887718945091964928";https://twitter.com/mpowerednetwork/status/887718945091964928
liberalchik;2017-07-19 12:54;1;3;". @ SenatorLankford oklahoma didn't accept the Medicaid expansion, they forced Obamacare not to work properly in their state. Stop lying.";;@;;"887717236168851456";https://twitter.com/liberalchik/status/887717236168851456
BobSchechter;2017-07-19 12:50;1;6;"You know, don't you, that the BCRA did not even pretend to have ANY cost-cutting measures in it? Just healthcare cutting.";;;;"887716384515534848";https://twitter.com/BobSchechter/status/887716384515534848
manfordou;2017-07-19 12:48;0;0;"Vaccines, Antibiotic Stewardship, and @ CDCDirector are worth more than they cost. Reforms are needed, open markets can work, but be careful!";;@;;"887715757366407168";https://twitter.com/manfordou/status/887715757366407168
clark_darko;2017-07-19 12:42;0;0;"Obama and Hillary did not carry one county in Oklahoma in the last three presidential elections. Guess where in Ok stands on Obamacare?";;;;"887714313963810820";https://twitter.com/clark_darko/status/887714313963810820
osubusmaj;2017-07-19 12:10;3;28;"Just once, I wish you were as excited to take away sec clearance for # Kushner as you are to take healthcare away from millions. # TrumpRussia";;;# #;"887706267090923520";https://twitter.com/osubusmaj/status/887706267090923520
lornaynay;2017-07-19 12:02;0;1;"Drive down healthcare cost by limiting HC CEO pay. They make 300x the worker. Used to be 20x. Look at all the $ that are wasted on them";;;;"887704144034844672";https://twitter.com/lornaynay/status/887704144034844672
cooterdwayne;2017-07-19 12:00;0;3;"Just fix Obamacare, do not repeal. Stop undermining it with your policy instability. Work with the Democrats. Stop the partisanship.";;;;"887703735518060544";https://twitter.com/cooterdwayne/status/887703735518060544
barrettnuzum;2017-07-19 11:59;3;22;"Or, y'know, we could just give people healthcare like every other civilized nation.";;;;"887703504026042368";https://twitter.com/barrettnuzum/status/887703504026042368
pennypru;2017-07-19 11:59;0;0;"# RepealObamacare Support @ realDonaldTrump";;@;#;"887703463785881600";https://twitter.com/pennypru/status/887703463785881600
DanSnyderFOX25;2017-07-19 11:55;0;0;"UPDATE: # Oklahoma @ SenatorLankford will attend meeting w/ Pres. # Trump and # GOP Senators to talk # healthcare # LiveDeskpic.twitter.com/vofMTK1JAk";;@;# # # # #;"887702383412867075";https://twitter.com/DanSnyderFOX25/status/887702383412867075
SenatorLankford;2017-07-19 11:53;29;182;"Heading to WH to discuss Obamacare repeal.We must find a path to lower # healthcare costs for people of all income levels & health conditions";;;#;"887702024434974720";https://twitter.com/SenatorLankford/status/887702024434974720
dustylmarsh;2017-07-19 11:45;0;1;"I thought about running for OK gov, I got some good ideas to fix education and a single payer healthcare that may work on the state level.";;;;"887700051446951937";https://twitter.com/dustylmarsh/status/887700051446951937
GreggHoush;2017-07-19 11:21;0;0;"@ SenatorLankford $765 billion per year lost in US healthcare system. Want to fix healthcare? Maybe start with this https://www.propublica.org/article/the-myth-of-drug-expiration-dates …";;@;;"887693783596486656";https://twitter.com/GreggHoush/status/887693783596486656
SenatorLankford;2017-07-19 10:54;3;13;"Talked to @ PC1170 this morning about # healthcare & # RepealAndReplace. Listen HERE →https://twitter.com/PC1170/status/887664565651206145 …";;@;# #;"887687084831645696";https://twitter.com/SenatorLankford/status/887687084831645696
LMSNCUS;2017-07-19 10:47;1;1;"# Healthcare # RepealAndReplaceCongresspic.twitter.com/8xxbXwHPpv";;;# #;"887685363074031616";https://twitter.com/LMSNCUS/status/887685363074031616
yayayates;2017-07-19 10:27;0;1;"7 yrs and no plan. We want hearings, bipartisan input and all options on table. 58 countries have universal health care. Stop the blame.";;;;"887680197386022913";https://twitter.com/yayayates/status/887680197386022913
Debra2562Vander;2017-07-19 10:11;0;0;"Come on Republican Senate!! I personally will fight for you to NOT be reelected if you can't repeal obcare! You who are fighting Trump!!";;;;"887676301594808320";https://twitter.com/Debra2562Vander/status/887676301594808320
Javier_e;2017-07-19 09:37;1;6;"James, you are wasting our time and our money. I don't care about what Clinton did but about what Trump is doing. Get a grip Senator.";;;;"887667667624226816";https://twitter.com/Javier_e/status/887667667624226816
Alyndriel;2017-07-19 09:25;1;6;"So frustrated that @ SenatorLankford has time for multiple meals at the WH but no time to speak directly w/ Okies re: Senate "health care",";;@;;"887664614170931200";https://twitter.com/Alyndriel/status/887664614170931200
peaceprotectus;2017-07-19 09:10;0;0;"Please repeal ocare it's destroying American taxpayers, patient care and small business";;;;"887660812990636038";https://twitter.com/peaceprotectus/status/887660812990636038
billylee1950;2017-07-19 08:53;0;0;"@ SenatorLankford Just give America the same health care that you as a Senator has. Is congress better than the voters? You pay 28% of cost!";;@;;"887656650257117185";https://twitter.com/billylee1950/status/887656650257117185
angelarenai;2017-07-19 08:48;0;0;"ACA is expensive in OK because Repubs didn't accept the Medicaid expansion, they forced Obamacare not to work properly in their state.";;;;"887655334965387264";https://twitter.com/angelarenai/status/887655334965387264
gentlemindmom;2017-07-19 08:42;0;0;"@ SenatorLankford http://www.rollcall.com/news/politics/meet-the-republicans-who-voted-no-on-the-health-care-bill … You lied..over and over.I guess all it takes is a steak dinner to change your vote? Christian, NOpic.twitter.com/Z1ACdBjFgw";;@;;"887653885841739776";https://twitter.com/gentlemindmom/status/887653885841739776
gentlemindmom;2017-07-19 08:40;0;3;"http://www.rollcall.com/news/politics/meet-the-republicans-who-voted-no-on-the-health-care-bill … you lied to us..you said you couldn't vote for a bill that wasn't bi partisan supported and yet you voted 4 trump.";;;;"887653414771068930";https://twitter.com/gentlemindmom/status/887653414771068930
plhuffy55;2017-07-19 06:59;0;0;"No we don't like Ocare!";;;;"887628034282586112";https://twitter.com/plhuffy55/status/887628034282586112
plhuffy55;2017-07-19 06:57;0;0;"We do not want mandated healthcare! We want free market choice. Stop ! Repeal and do not replace it.";;;;"887627452830416897";https://twitter.com/plhuffy55/status/887627452830416897
MonalisaClement;2017-07-19 06:06;0;0;"Stop obstructing healthcare. You are the reason your people are hurting.http://www.politico.com/story/2017/07/13/obamacare-markets-health-care-240487 …";;;;"887614518167207937";https://twitter.com/MonalisaClement/status/887614518167207937
RobHumbleIA;2017-07-19 02:22;0;0;". @ SenatorLankford and the @ SenateGOP should agree- the solution isn’t to take healthcare from millions. Start governing. Fix # Obamacare.https://twitter.com/senategop/status/887394413323984897 …";;@ @;#;"887558313407283200";https://twitter.com/RobHumbleIA/status/887558313407283200
foolsrushn;2017-07-19 01:59;1;0;"What an idiot! He wants to take healthcare away from the people in Oklahoma for tax breaks how considerate of him";;;;"887552514744176645";https://twitter.com/foolsrushn/status/887552514744176645
gaflyer;2017-07-19 01:09;0;0;"No, no, no. Cut GOP grandstanding and work with the only people who know how to pass a healthcare bill (Dems) to fix ACA";;;;"887539802526150656";https://twitter.com/gaflyer/status/887539802526150656
geoffholm;2017-07-19 00:09;0;0;"@ SenatorLankford Mr. Senator, if Trumpcare/GOPCare fails and ACA remains, will you advocate for Medicaid expansion in OK? Seems only right";;@;;"887524887602110464";https://twitter.com/geoffholm/status/887524887602110464
geoffholm;2017-07-19 00:03;0;0;"My son relies on Soonercare. How will he (who has a pre existing condition) be affected by a straight repeal (w/ replacement in 2 yrs)?";;;;"887523379045158913";https://twitter.com/geoffholm/status/887523379045158913
manufan1079;2017-07-18 23:39;0;0;"@ SenatorLankford Wow, what's it like to know your own party will try to ruin your career if you don't vote with them? Will be you next? https://twitter.com/thehill/status/887493213740838913 …";;@;;"887517241855574017";https://twitter.com/manufan1079/status/887517241855574017
CarlGugel74;2017-07-18 23:18;0;0;"All of you GOP incumbents are gonna loose your seats due to your inactions. # repealobamacare # draintheswamp. You had one job to do. Do it!";;;# #;"887512036292386816";https://twitter.com/CarlGugel74/status/887512036292386816
ruthreplogle;2017-07-18 22:58;0;0;"And there are also millions that have subsidized ACA policies in Medicaid expansion states that are now getting needed care.";;;;"887507002095616000";https://twitter.com/ruthreplogle/status/887507002095616000
Cuddlefudge;2017-07-18 22:54;0;0;"Why, why, do you want to take away health insurance from over 30 million Americans? Why? You DON'T have a better alternative. # healthcare";;;#;"887505992967237634";https://twitter.com/Cuddlefudge/status/887505992967237634
EJCB1976;2017-07-18 22:27;0;0;"You cant just throw people off Healthcare by repealing.";;;;"887499053373640705";https://twitter.com/EJCB1976/status/887499053373640705
lmgal11;2017-07-18 21:32;0;0;"All senators should admonish Lee, Paul, and Collins. They obviously want Obamacare.";;;;"887485172752560128";https://twitter.com/lmgal11/status/887485172752560128
RightOfRush;2017-07-18 21:12;0;0;"Healthcare a tangled web of paperwork not taking care of patients because of ACA. 54 mins on the phone for preauth for Cialis?";;;;"887480153642762240";https://twitter.com/RightOfRush/status/887480153642762240
langlotz1;2017-07-18 21:09;0;0;"Heriage had nothing to do with ACA, also known as Obamacare";;;;"887479585927028740";https://twitter.com/langlotz1/status/887479585927028740
randymelder;2017-07-18 20:56;0;0;"1) repeal ACA 2) open medicare to all 3) open interstate insurance 4) address costs of care It's not that difficult.";;;;"887476262226206721";https://twitter.com/randymelder/status/887476262226206721
schmooozin;2017-07-18 20:44;0;0;"No one said they did. But it's based on Romneycare & Republican ideas.";;;;"887473296371056647";https://twitter.com/schmooozin/status/887473296371056647
Alyndriel;2017-07-18 20:38;0;2;"@ SenatorLankford Yes, something has to be done. Health care needs to be fixed. Don't pass something just to pass something. It's dangerous.";;@;;"887471782529302528";https://twitter.com/Alyndriel/status/887471782529302528
CeePZee;2017-07-18 20:37;1;0;"The GOP is in the swamp. Why is it they exempt themselves from the healthcare bill they want to FORCE on us. There's our problem. Swamp gas!";;;;"887471311039156224";https://twitter.com/CeePZee/status/887471311039156224
LibertyUSA1776;2017-07-18 20:35;0;0;"Check the bankrupt states that did take the Obamacare bribe.";;;;"887470907538763778";https://twitter.com/LibertyUSA1776/status/887470907538763778
LibertyUSA1776;2017-07-18 20:34;22;17;"Any GOP senator that won't vote # RepealObamacare you're a liar & coward! Meet the new dem sens @ SenatorCollins @ SenCapito @ lisamurkowski";;@ @ @;#;"887470588037562368";https://twitter.com/LibertyUSA1776/status/887470588037562368
bearmenow;2017-07-18 20:28;0;0;"Don't let big Pharma or Insurance Companies rule your Healthcare!pic.twitter.com/tAzLf10CUY";;;;"887469157033422848";https://twitter.com/bearmenow/status/887469157033422848
greyrobedsr;2017-07-18 20:23;0;0;". @ SenatorLankford Why did United Healthcare pull out of state of Oklahoma?";;@;;"887467786473222144";https://twitter.com/greyrobedsr/status/887467786473222144
sissyraff;2017-07-18 20:05;0;0;"If all elected officials had to use the same healthcare that we do, I'm sure we'd have a great healthcare bill!";;;;"887463414435635201";https://twitter.com/sissyraff/status/887463414435635201
3Sinnings;2017-07-18 20:02;0;0;"Repeal Medicare as well. No reason to help the elderly, right? More money for me. :)";;;;"887462489792925697";https://twitter.com/3Sinnings/status/887462489792925697
goosebumps67;2017-07-18 19:57;0;0;"....make all health ins. co. have a cap on how much they can charge on premiums. its not Obamacare thats killing us its in. co.";;;;"887461448955318272";https://twitter.com/goosebumps67/status/887461448955318272
eluke007;2017-07-18 19:53;0;0;"Work on the root cause of the problem - High healthcare costs and poor quality. Quit working around a broken system.";;;;"887460305369944064";https://twitter.com/eluke007/status/887460305369944064
3Sinnings;2017-07-18 19:52;0;0;"If u want government out of healthcare, let's repeal Medicaid. Hell, dying in the streets is ok with Rs as long as their taxes are cheap?";;;;"887460188919406596";https://twitter.com/3Sinnings/status/887460188919406596
SamLaneWx;2017-07-18 19:49;0;0;"I agree...entitlement reform is desperately needed, Social Security and Medicare included.";;;;"887459348359806976";https://twitter.com/SamLaneWx/status/887459348359806976
danger_kittyyy;2017-07-18 19:47;0;0;"Repealing w/o replacing immediately is dangerous for the healthcare mkt. Healthcare is NOT a bullet point on the agenda. It truly matters!";;;;"887458872323190788";https://twitter.com/danger_kittyyy/status/887458872323190788
3Sinnings;2017-07-18 19:47;0;0;"If providing healthcare & keeping folks alive is a rat hole to you, I'm sorry. Can't converse with you.";;;;"887458735467229184";https://twitter.com/3Sinnings/status/887458735467229184
cindy541;2017-07-18 19:46;0;0;"Because you didn't expand Medicare! YOU let your people down!!";;;;"887458557494525953";https://twitter.com/cindy541/status/887458557494525953
3Sinnings;2017-07-18 19:45;0;0;"Ok. So cancel Medicare. Let's see how that works. (FYI, premiums were soaring due to lack of reg. See epipen.)";;;;"887458358202167296";https://twitter.com/3Sinnings/status/887458358202167296
kenrecoy;2017-07-18 19:40;0;0;"How about the GOP support improving Obamacare & helping families instead of repealing & leaving families without Insurance? Do what's right.";;;;"887457129262665728";https://twitter.com/kenrecoy/status/887457129262665728
MarkLaseau;2017-07-18 19:30;0;0;"At least they have insurance in Oklahoma. With your plan they're screwed. Fix Obamacare. The cost is negligible. # Obamacarerepeal";;;#;"887454524033695744";https://twitter.com/MarkLaseau/status/887454524033695744
voncile2016;2017-07-18 19:29;0;0;"BTW!! We don't want people living off the tit! We want affordable rates so we can buy, and pay for, our health care. Screw medicaid!!";;;;"887454381536407554";https://twitter.com/voncile2016/status/887454381536407554
stanford_david;2017-07-18 19:28;0;0;". Stop all the BS repeal Obama care and let it go back to the way it was before Obama messed it up";;;;"887454142410743808";https://twitter.com/stanford_david/status/887454142410743808
langlotz1;2017-07-18 19:19;0;1;"Of course we didn't get the best health care dealing w rep's! So, now we fix it.That's the best option,or Medicaid for all of us";;;;"887451782447865857";https://twitter.com/langlotz1/status/887451782447865857
Callimogua;2017-07-18 19:17;0;0;"Lol was that because OK reps wouldn't take funding for Medicare/Medicaid? Juuuust asking ;)";;;;"887451181848645633";https://twitter.com/Callimogua/status/887451181848645633
Insomniac228;2017-07-18 19:05;0;0;"Aren't our elected representatives supposed to care about ALL Americans?";;;;"887448267205824512";https://twitter.com/Insomniac228/status/887448267205824512
bobjunewelch;2017-07-18 18:51;0;0;"Get Obamacare repealed! Then let people price out their own Medical Ins.";;;;"887444749770272768";https://twitter.com/bobjunewelch/status/887444749770272768
KennethCrochet;2017-07-18 18:50;0;0;"@ SenatorLankford how about we vote to take away your taxpayer funded health care??";;@;;"887444387009101824";https://twitter.com/KennethCrochet/status/887444387009101824
wildatheart159;2017-07-18 18:37;0;0;"We beg you not to vote to repeal Obamacare!! Have some compassion for your constituents!! I beg you! Please!!";;;;"887441105507299330";https://twitter.com/wildatheart159/status/887441105507299330
schmooozin;2017-07-18 18:36;0;2;"Yes. Obamacare was based on Romneycare in Mass. which was written by the heritage foundation. Dems wanted single-payer. ACA was capitulation";;;;"887440865085599744";https://twitter.com/schmooozin/status/887440865085599744
IndivisibleNorm;2017-07-18 18:36;0;1;"@ SenatorLankford @ JimInhofe You claim to care about veterans. What do you have to say for yourselves?https://twitter.com/votevets/status/887431732789641217 …";;@ @;;"887440857569296386";https://twitter.com/IndivisibleNorm/status/887440857569296386
freedomfrompol1;2017-07-18 18:35;0;0;"Repeal Obamacare now or Republicans will be challenged by those who will, in the next election. Not a threat - A PROMISE!";;;;"887440826162434048";https://twitter.com/freedomfrompol1/status/887440826162434048
ApatheiaAphorme;2017-07-18 18:32;0;0;"Nothing "has" to be done. The majority of Americans want to keep Obamacare and see bipartisan congress work to fix flaws.";;;;"887439938144411653";https://twitter.com/ApatheiaAphorme/status/887439938144411653
goldbug70;2017-07-18 18:25;0;0;"You are a hypochristian. You care nothing about Oklahomans.";;;;"887438207180316673";https://twitter.com/goldbug70/status/887438207180316673
susan_suememaw7;2017-07-18 18:23;0;0;"They need to kill it and start over for a serious bill since the minority seems to want the GOV providing healthcare.";;;;"887437757240541188";https://twitter.com/susan_suememaw7/status/887437757240541188
langlotz1;2017-07-18 18:20;0;0;"No options? No options for health care period? Yep, in Fl. heart breaking! friends' bestie dropped dead @ work cleaning house 2 kids left";;@;;"887437035329523712";https://twitter.com/langlotz1/status/887437035329523712
GrantHermesKWTV;2017-07-18 18:15;2;0;"Here's @ SenatorLankford's office on the stalled Obamacare repeal. @ NEWS9pic.twitter.com/jdCyPzLO3G";;@ @;;"887435639494504449";https://twitter.com/GrantHermesKWTV/status/887435639494504449
langlotz1;2017-07-18 18:13;0;2;"I liveD in NoCa went from a few 2 1 avail plan.AWFUL$$ I'm disabled on Medicare, I pay 4 it, script plan& supplement cover $300. & meds!";;;;"887435166767042560";https://twitter.com/langlotz1/status/887435166767042560
PTDougan;2017-07-18 18:12;0;0;"And no health care is perfectly fine...";;;;"887434888084955137";https://twitter.com/PTDougan/status/887434888084955137
sallyray5;2017-07-18 18:12;0;1;"Just a reminder. @ SenatorLankford @ JimInhofe @ RepRussell @ JohnCornyn @ tedcruz http://www.politifact.com/punditfact/statements/2017/mar/26/hugh-hewitt/obamacare-death-spiral/ …";;@ @ @ @ @;;"887434875078311942";https://twitter.com/sallyray5/status/887434875078311942
wynntx1;2017-07-18 18:11;0;0;"Republicans trying to force Americans to except bad healthcare and Americans don't want bad healthcare. Medicare for All.";;;;"887434559884840960";https://twitter.com/wynntx1/status/887434559884840960
Powdersmok;2017-07-18 17:53;0;0;"Health Insurance company's CEOs undermining Obamacare to fail, all part of the plan. Special gifts promised to Republicans if end Obamacare";;;;"887430235427352577";https://twitter.com/Powdersmok/status/887430235427352577
ga_pen;2017-07-18 17:52;1;1;"Govt has NO business in the healthcare business. Get out of it now!";;;;"887429898196971524";https://twitter.com/ga_pen/status/887429898196971524
stinkingRose55;2017-07-18 17:39;0;0;"Oppose the repeal of ACA! Need bipartisan effort to lower healthcare costs, improve quality & provide affordable coverage to all Americans.";;;;"887426590132457473";https://twitter.com/stinkingRose55/status/887426590132457473
