DJBartosz;2017-07-24 19:55;0;0;"Every last one of you know that...and if you don't, God bless us all. You won't do anything b/c your next term is all you care about. Period";;;;"889635230956564481";https://twitter.com/DJBartosz/status/889635230956564481
DJBartosz;2017-07-24 19:53;0;0;"But you won't. You will let the games continue because you serve your masters not the citizens. Apply the law and healthcare COST drops 75%";;;;"889634717317955586";https://twitter.com/DJBartosz/status/889634717317955586
LouiseN91316;2017-07-24 19:47;0;0;"GOP Senators, Healthcare ≠ a game to score pts at expense of constituents' health. Shame! # CensureMcConnell Healthcare ≠ party loyalty oath";;;#;"889633273634271232";https://twitter.com/LouiseN91316/status/889633273634271232
LouiseN91316;2017-07-24 19:40;0;1;"# CensureMcConnell Legislators are to serve & protect public good. Good laws represent constituents. Healthcare should ≠loyalty oath. # FixACA";;;# #;"889631428341903361";https://twitter.com/LouiseN91316/status/889631428341903361
gjsd2001;2017-07-24 19:39;0;0;"actually dick, it's rip and replace barrycare.";;;;"889631146526552064";https://twitter.com/gjsd2001/status/889631146526552064
SenatorDurbin;2017-07-24 19:38;95;236;"Watch me live on Facebook talking @ SenateGOP's secret effort to rip health care from tens of millions of Americans: https://www.facebook.com/SenatorDurbin/";;@;;"889630891299016708";https://twitter.com/SenatorDurbin/status/889630891299016708
howard317;2017-07-24 19:23;0;0;"@ SenatorDurbin you need to read pgs 2006-09 of ACA then Cato Institute report are you Indian enough to avoid Obamacare mandate 1/3";;@;;"889627158599086081";https://twitter.com/howard317/status/889627158599086081
Lisahentschel1;2017-07-24 19:06;0;0;"27 off under Obamacare, Obamacare lite 22-24 mil GOP house plan no Obamacare 15 mil , repeal and no replace 17 mil off";;;;"889622918774345729";https://twitter.com/Lisahentschel1/status/889622918774345729
karlyncallahan;2017-07-24 19:03;0;0;"@ SenatorDurbin @ SenDuckworth There you go. # Obamacare is DEAD! REPEAL IThttps://twitter.com/realDonaldTrump/status/889599425458327552 …";;@ @;#;"889622185228328961";https://twitter.com/karlyncallahan/status/889622185228328961
attackcat52;2017-07-24 18:51;0;0;"@ SenatorDurbin Thank you for the fight you are waging to preserve the ACA. It is pure wrong to throw thousands of people off healthcare.";;@;;"889619123046682625";https://twitter.com/attackcat52/status/889619123046682625
jannichicago;2017-07-24 18:51;0;2;"@ SenatorDurbin Thank you for all you are doing to stop Trumpcare and to save DACA. You make me proud to be from Illinois.";;@;;"889618965760278528";https://twitter.com/jannichicago/status/889618965760278528
CindyZimni;2017-07-24 18:43;1;3;"Don't let us down! Vote NO on this healthcare bill. I called your office, I was told you were NOT for cuts to Medicaid, please don't lie!!";;;;"889617066675904519";https://twitter.com/CindyZimni/status/889617066675904519
MrRobertdark;2017-07-24 18:29;0;0;"Hey @ senmarcorubio are you seeing this?!? tRumpcare needs to be opposed. It is a travesty for the people of Florida. # dotherightthing";;@;#;"889613526154620929";https://twitter.com/MrRobertdark/status/889613526154620929
terrij68;2017-07-24 18:21;0;0;"They don't care, Obama gave it so they are hell bent on taking it away. No other reason. They are hateful, racist, lying morons";;;;"889611461634469889";https://twitter.com/terrij68/status/889611461634469889
DoodlingDev;2017-07-24 18:00;0;0;"@ SenDuckworth @ SenatorDurbin as a constituent, I hope that you're readying amendments to filibuster whatever "healthcare" bill is coming";;@ @;;"889606124382638082";https://twitter.com/DoodlingDev/status/889606124382638082
claudwal;2017-07-24 17:51;0;0;"@ SenatorDurbin Please vote NO on the healthcare bill tomorrow.";;@;;"889603860985204737";https://twitter.com/claudwal/status/889603860985204737
TellMyOwnTruth;2017-07-24 17:44;0;0;"Senator please tell me, because I don't understand, why does the @ SenateGOP want to screw America so badly with health care?";;@;;"889602264628772865";https://twitter.com/TellMyOwnTruth/status/889602264628772865
mucaluck;2017-07-24 17:43;0;1;"Sounds like govt healthcare doesn't work if after 30 years 25% of the population is now indigent. Govt doesn't have a successful business!";;;;"889602032360988672";https://twitter.com/mucaluck/status/889602032360988672
mucaluck;2017-07-24 17:41;0;0;"Govt is wasting healthcare $ on ppl w/unhealthy lifestyles Drug abusers & ppl w/ promiscuous sex habits Yet Christian counselors not allowed";;;;"889601401181143040";https://twitter.com/mucaluck/status/889601401181143040
pitterpatter4;2017-07-24 17:34;0;0;"@ SenateDems @ SenateGOP # singlepayer can deliver on health care promises.";;@ @;#;"889599671399829504";https://twitter.com/pitterpatter4/status/889599671399829504
heyaries1981;2017-07-24 17:25;0;0;"2-just don't care, or who don't think their vote matters. But I'm talking about those who are shut out by poverty, mostly.";;;;"889597522221596672";https://twitter.com/heyaries1981/status/889597522221596672
lchobody;2017-07-24 17:13;0;0;"# VoteNo on # Trumpcare.";;;# #;"889594475722543104";https://twitter.com/lchobody/status/889594475722543104
sandykaptain;2017-07-24 17:12;0;0;"@ SenatorDurbin Your constituents are depending on you! Vote 'no' on # Obamacare repeal. THANKS, & I am sure you would vote NO.";;@;#;"889594034901176322";https://twitter.com/sandykaptain/status/889594034901176322
BurgerDogBoy;2017-07-24 16:55;0;0;"@ SenDuckworth @ SenatorDurbin Healthcare landscape in America would be helped if pharma advertising to consumers was banned.";;@ @;;"889589986605096963";https://twitter.com/BurgerDogBoy/status/889589986605096963
Roxane_I_am;2017-07-24 16:46;0;2;"Who do you call when your senators @ SenDuckworth & @ SenatorDurbin are cool and don't want to take healthcare away from 22 million Americans?";;@ @;;"889587502931202048";https://twitter.com/Roxane_I_am/status/889587502931202048
erikadee;2017-07-24 16:44;0;0;"@ SenatorDurbin @ SenDuckworth - please stand strong against the healthcare bill coming up for a vote.";;@ @;;"889587068686540801";https://twitter.com/erikadee/status/889587068686540801
indivisible606;2017-07-24 16:37;6;21;"Delivering these postcards this afternoon. Ppl really want to keep their healthcare! Thanks @ SenatorDurbin & @ SenDuckworth for fighting!pic.twitter.com/Z4B3yyOcnx";;@ @;;"889585391405281280";https://twitter.com/indivisible606/status/889585391405281280
mj12207;2017-07-24 16:36;0;0;"And you think Obamacare is. Keep this up & you will lose for ground in governance. Slogans don't cut it Written proposals might";;;;"889585176073949184";https://twitter.com/mj12207/status/889585176073949184
nursiegal75;2017-07-24 16:29;0;0;"@ SenatorDurbin @ SenDuckworth # SaveMedicaid # SaveMedicare # SaveTheACA # SaveObamacare # KillTheBill # HealthcareMattersToMe # SaveSocialSecuritypic.twitter.com/9cF8mRFSvh";;@ @;# # # # # # #;"889583371294302208";https://twitter.com/nursiegal75/status/889583371294302208
LHaule;2017-07-24 16:22;0;0;"@ SenDuckworth @ SenatorDurbin Pls fight Sen healthcare poison pill/disaster bill & unworthy efforts to sell it to Repub Senators by any means";;@ @;;"889581523875250177";https://twitter.com/LHaule/status/889581523875250177
NBlard;2017-07-24 16:13;0;0;"@ SenatorDurbin Here are 95 true stories and reasons to say no to ACA repeal And Amdmts to make BCRA offer real care. http://bit.ly/95StoriesAm pic.twitter.com/1DRr0TNfoz";;@;;"889579414647975937";https://twitter.com/NBlard/status/889579414647975937
ColtsFan254;2017-07-24 16:09;0;0;"The federal government has no authourity in healthcare so there should be no hearings on the matter.";;;;"889578414109339648";https://twitter.com/ColtsFan254/status/889578414109339648
goodtime4all696;2017-07-24 15:57;0;0;"Well you should have read it before you passed Obamacare so it would not need fixed";;;;"889575161237733383";https://twitter.com/goodtime4all696/status/889575161237733383
newsburrow;2017-07-24 15:37;0;0;"@ SenatorDurbin on "A Better Deal": (Democrats) don't want to just be against something. We want to be for something...jobs, healthcare...";;@;;"889570295144734721";https://twitter.com/newsburrow/status/889570295144734721
CaffLibrarian;2017-07-24 15:24;0;0;"Please # SaveTheACA and vote NO on # Trumpcare";;;# #;"889567034228518915";https://twitter.com/CaffLibrarian/status/889567034228518915
josiahmicheals;2017-07-24 14:56;0;0;"Shut up. You made this mess with obamacare. So stop dragging your foot";;;;"889559907451752449";https://twitter.com/josiahmicheals/status/889559907451752449
JpwellerJim;2017-07-24 14:52;0;1;"Impossible for # Trump to read & know details of # healthcare bill when he spends all his time on # twitter & watching # Fox # News.";;;# # # # #;"889559026316570625";https://twitter.com/JpwellerJim/status/889559026316570625
billdaubs1;2017-07-24 14:48;0;0;"@ SenatorDurbin @ SenateGOP @ SistersofMercy @ SenateDems # HealthcareBill Looking at Repeal ObamaCare, shocking, it ends basic care, unethical.pic.twitter.com/e9vGcWXY1b";;@ @ @ @;#;"889557994874294272";https://twitter.com/billdaubs1/status/889557994874294272
eagles1937;2017-07-24 14:38;0;0;"ARTICLE V: , we're just not interested in public health care.";;;;"889555423476547585";https://twitter.com/eagles1937/status/889555423476547585
eagles1937;2017-07-24 14:38;0;0;"ARTICLE V: You do not have the right to free health care. That would be nice, but from the looks of public housing,";;;;"889555318866419715";https://twitter.com/eagles1937/status/889555318866419715
sslater1951;2017-07-24 14:31;0;0;"GOP doesn't care what passes as long as it "keeps their promise" to repeal & replace ACA. Biggest bunch of morons ever gathered in one place";;;;"889553701580533760";https://twitter.com/sslater1951/status/889553701580533760
KiloMick;2017-07-24 14:16;0;0;"We should ensure that only Americans vote in our elections. Why do you oppose this? Scared?";;;;"889549988694564865";https://twitter.com/KiloMick/status/889549988694564865
roybiker123;2017-07-24 14:15;0;0;"Senator Durban helped pass the ACA..how did that strengthen our healthcare system.";;;;"889549572296593409";https://twitter.com/roybiker123/status/889549572296593409
SenatorDurbin;2017-07-24 14:13;523;1183;"The Senate is holding 23 hearings this week. 0 of them are on strengthening our health care system. This is no way to govern, @ SenateGOP.";;@;;"889549064580280321";https://twitter.com/SenatorDurbin/status/889549064580280321
AdamHecktman;2017-07-24 13:34;3;3;"Going to give em hell in DC this week on healthcare and dreamers, says @ SenatorDurbin at @ MikvaChallenge Mass Action Day.pic.twitter.com/ZsPDIOGZrF";;@ @;;"889539304535576577";https://twitter.com/AdamHecktman/status/889539304535576577
taralynnesq;2017-07-24 13:25;0;1;"be detrimental to them. # KillTheBill # SaveOurHealthcare # MySistersDeserveProtections /2";;;# # #;"889537119068225536";https://twitter.com/taralynnesq/status/889537119068225536
Ruaudladoube;2017-07-24 13:18;0;0;"Thank you @ SenatorDurbin for standing up for your constituents and all Americans on healthcare. https://twitter.com/senatordurbin/status/889495652866109440 …";;@;;"889535224958394368";https://twitter.com/Ruaudladoube/status/889535224958394368
louise_q10;2017-07-24 12:22;0;1;"You are my Senator I remember the fist time I voted for you Thank you for fighting for healthcare";;;;"889521130029056000";https://twitter.com/louise_q10/status/889521130029056000
AlonzoHudkinsiv;2017-07-24 12:21;0;2;"Medicare for all, funded by one percent sales tax with $1 maximum tax limit per transaction, would work well.";;;;"889520876076638209";https://twitter.com/AlonzoHudkinsiv/status/889520876076638209
DoctorSadieL;2017-07-24 12:16;4;1;"1.5 million kids in Illinois rely on # Medicaid and CHIP for healthcare, including medically fragile children and those in foster care.";;;#;"889519748110839808";https://twitter.com/DoctorSadieL/status/889519748110839808
CCINDYT7;2017-07-24 12:15;0;0;"And healthcare for all!";;;;"889519493222813696";https://twitter.com/CCINDYT7/status/889519493222813696
jpgayes;2017-07-24 12:13;1;0;"Keep fighting for us @ SenatorDurbin Use all the tools. # KillTheBill # SaveHealthcare # NoCutsNoCapshttps://twitter.com/senatordurbin/status/889507803253137408 …";;@;# # #;"889518848420048896";https://twitter.com/jpgayes/status/889518848420048896
MootsaGootsa;2017-07-24 12:08;0;1;"Don't you trust your fellow workers? Too many suffer under Obamacare. Too many fined because they couldn't affird it, Repeal it now.";;;;"889517536504668160";https://twitter.com/MootsaGootsa/status/889517536504668160
pinaalmost56;2017-07-24 11:52;0;0;"@ SenatorDurbin @ CNNPolitics @ SenateGOP ~ Your healthcare repeal bill SHOULD NOT be a mystery!! Please show it to us NOW!https://twitter.com/senatordurbin/status/889507803253137408 …";;@ @ @;;"889513708728209408";https://twitter.com/pinaalmost56/status/889513708728209408
suzyqjinx;2017-07-24 11:51;0;0;"You're in England, so I don't care what you think of USA legislation. Your bad habits are you're own, so get over the need to justify them.";;;;"889513501965901824";https://twitter.com/suzyqjinx/status/889513501965901824
twp03;2017-07-24 11:45;0;2;"Does Congress even know what bill @ SenateMajLdr will bring for a vote? America deserves better, affordable healthcare. Fix, improve # ACA";;@;#;"889511779658862593";https://twitter.com/twp03/status/889511779658862593
LibTee;2017-07-24 11:37;0;0;"I wonder what you would advise? I agree; I'm just not sure what anyone can do. They also have to stop them from taking away health care.";;;;"889509967472058369";https://twitter.com/LibTee/status/889509967472058369
JooooDoooo;2017-07-24 11:35;0;0;"Repeal Obamacare it's garbage";;;;"889509282659667968";https://twitter.com/JooooDoooo/status/889509282659667968
SenatorDurbin;2017-07-24 11:29;249;450;"MORNING READ: The American people still don't know which health care repeal bill @ SenateGOP is going to vote on. Congressional malpractice.https://twitter.com/CNNPolitics/status/889418649517400065 …";;@;;"889507803253137408";https://twitter.com/SenatorDurbin/status/889507803253137408
NETWORKLobby;2017-07-24 11:29;3;9;". @ SenatorDurbin thank you for working to protect healthcare, 7,000 Catholic sisters agree we should NOT repeal # ACA http://www.networklobby.org/2017sistersletter …";;@;#;"889507718657998848";https://twitter.com/NETWORKLobby/status/889507718657998848
ColtsFan254;2017-07-24 11:06;0;0;"How would "Medicare for all" work?";;;;"889501945693696004";https://twitter.com/ColtsFan254/status/889501945693696004
mellomelsko;2017-07-24 11:01;0;0;"And the dems didn't care when they were in charge cuz ineligible voters overwhelmingly vote dem";;;;"889500871465336832";https://twitter.com/mellomelsko/status/889500871465336832
ChicagoLeah;2017-07-24 10:50;0;2;"After a slow start, I've been really impressed by @ SenatorDurbin regarding health care policy. https://twitter.com/SenatorDurbin/status/889495652866109440 …";;@;;"889498082320232450";https://twitter.com/ChicagoLeah/status/889498082320232450
Prof_Bruckner;2017-07-24 10:47;0;0;"You're operating on the assumption the GOP is trying to fix healthcare. Not sure that's right.";;;;"889497252909154304";https://twitter.com/Prof_Bruckner/status/889497252909154304
caschmitt;2017-07-24 10:46;0;0;"Call yr Senators today 202-225-3121. Vote NO on Trumpcare! Fix ACA instead";;;;"889497008326811654";https://twitter.com/caschmitt/status/889497008326811654
PROUDAM00187654;2017-07-24 10:44;0;0;"No to Trumpcare No to repeal Fix ACA or go to single payer Premiums based on income Negotiate drug prices";;;;"889496412110688256";https://twitter.com/PROUDAM00187654/status/889496412110688256
LadyLiberty_16;2017-07-24 10:43;1;2;"They do have a plan, but it's not for healthcare.Their plan is to give another tax cut to the rich and leave millions of Americans to die.";;;;"889496351372976130";https://twitter.com/LadyLiberty_16/status/889496351372976130
broggle12;2017-07-24 10:42;0;0;"Please support Medicare-for-All!";;;;"889495998296358912";https://twitter.com/broggle12/status/889495998296358912
SenatorDurbin;2017-07-24 10:41;130;267;". @ SenateGOP's measures to repeal the Affordable Care Act are all disastrous steps backwards in health care.http://www.chicagobusiness.com/article/20170724/OPINION/170729944/dick-durbin-gop-needs-help-fixing-health-care …";;@;;"889495652866109440";https://twitter.com/SenatorDurbin/status/889495652866109440
Debbie92398787;2017-07-24 10:38;0;0;"Democrats promised affordable health care for all! Except if YOU worked, made over threshold they increased PREMIUMS. Punish workers, bad";;;;"889495016816750593";https://twitter.com/Debbie92398787/status/889495016816750593
chriswyoillini;2017-07-24 10:29;0;0;"A view into the @ SenatorDurbin view of health care. Only the powerful and elected get good care.";;@;;"889492631537016833";https://twitter.com/chriswyoillini/status/889492631537016833
kfranz2;2017-07-24 10:28;0;0;"So Obamacare is broken?";;;;"889492538020724736";https://twitter.com/kfranz2/status/889492538020724736
donporter3825;2017-07-24 10:27;0;0;"If my Social Security and Medicare are cut I will die! Simple as that!";;;;"889492361692069888";https://twitter.com/donporter3825/status/889492361692069888
cassiechicago;2017-07-24 10:17;0;0;"OPINION: The first step in a problem=ask 4 help. @ SenatorDurbin sez GOP needs to make healthcare reform bipartisan https://www.chicagobusiness.com/article/20170724/OPINION/170729944/dick-durbin-gop-needs-help-fixing-health-care …";;@;;"889489803477229568";https://twitter.com/cassiechicago/status/889489803477229568
BillWalker14;2017-07-24 10:09;0;0;"@ SenatorDurbin @ SenDuckworth We are counting on you to ensure # Trumpcare never leaves the Senate. # MedicareForAll # filibusteramendment";;@ @;# # #;"889487617070333952";https://twitter.com/BillWalker14/status/889487617070333952
CrainsChicago;2017-07-24 09:56;1;0;"It's time for the GOP to admit it needs help fixing health care, @ SenatorDurbin writes in Crain's: http://cra.in/mU1TNG9 # bcra # trumpcarepic.twitter.com/kkCHkVfu3S";;@;# #;"889484468452569089";https://twitter.com/CrainsChicago/status/889484468452569089
NoVa_BourBunny;2017-07-24 09:40;0;5;"Oh silly Senator! He didn't know the difference btwn Medicaid & Medicare! How could he possibly be expected to keep that promise?";;;;"889480411356778497";https://twitter.com/NoVa_BourBunny/status/889480411356778497
mlederer;2017-07-24 09:21;0;1;"Dick Durbin: GOP needs help fixing health care https://shar.es/1TcJfB @ crainschicago @ MATTERhealth @ SenatorDurbin";;@ @ @;;"889475573537550339";https://twitter.com/mlederer/status/889475573537550339
ChanceAustin;2017-07-24 08:45;0;0;"Put it in Writing how u'll fix Obamacare-U all Sign it-just like GOP Contract with America @ CoryBooker @ timkaine @ SenatorDurbin @ PattyMurraypic.twitter.com/Aks7q9ZbwT";;@ @ @ @;;"889466453564567553";https://twitter.com/ChanceAustin/status/889466453564567553
Practicadealist;2017-07-24 06:48;0;0;"Also, in a society, people work together and help each other out. Healthcare is a basic right, so yeah, you should be willing to help out.";;;;"889437197828583424";https://twitter.com/Practicadealist/status/889437197828583424
gardengirl625;2017-07-24 06:39;0;0;"I think that happened under 0bama. Using IRS as a weapon, spying on Americans, corrupt DOJ, killing Vets at VA, lying abt 0care, Iran deal.";;;;"889434789111050240";https://twitter.com/gardengirl625/status/889434789111050240
StephenButler55;2017-07-24 03:36;0;0;"So you want the rest of us to pay for your care? Why would that be fair?";;;;"889388847041191936";https://twitter.com/StephenButler55/status/889388847041191936
WhiteFox4USA;2017-07-23 23:38;1;5;"Having ID hasn't interfered with your supporters getting food stamps and free healthcare why would voter ID stop them from voting?";;;;"889328816891584512";https://twitter.com/WhiteFox4USA/status/889328816891584512
maagdalene17;2017-07-23 23:08;0;0;"EVERY RALLY should be a VOTING ORGANIZING event.. spread out from there.. hardcore messaging of Repub fail on Healthcare/wages.";;;;"889321263524655104";https://twitter.com/maagdalene17/status/889321263524655104
HistoriaTrixie;2017-07-23 23:00;0;1;"Yep. Hence intellectual laziness. They're fine with being spoon fed what to think and care about.";;;;"889319412980908032";https://twitter.com/HistoriaTrixie/status/889319412980908032
cementmixer4u;2017-07-23 22:50;0;0;"They think he cares about them. I love it. Hilarity!!";;;;"889316944133935106";https://twitter.com/cementmixer4u/status/889316944133935106
HistoriaTrixie;2017-07-23 22:34;0;3;"I'm certain there are just as many dead folks on the R rolls as there are on the D. Difference is, Ds are smart enough not to care.";;;;"889312838422073344";https://twitter.com/HistoriaTrixie/status/889312838422073344
gymnat545;2017-07-23 22:23;0;0;"Trumps capacity to care for any of you trump voters ends w/ him and Ivanka ! Short of a log hitting your head EAKE UP don't be so gullible";;;;"889310151332823040";https://twitter.com/gymnat545/status/889310151332823040
1stStopStupid;2017-07-23 22:20;0;0;"Do you really know how many Americans can not afford under Obama care? Or is your party more important than us.";;;;"889309185468485632";https://twitter.com/1stStopStupid/status/889309185468485632
brianknewhouse;2017-07-23 22:12;0;0;"My entire Life working You signed up for Healthcare same day you signed your W2 If that has changed you can thank Obamacare & useless Dems";;;;"889307319112171521";https://twitter.com/brianknewhouse/status/889307319112171521
emoontx;2017-07-23 20:56;1;2;"True, and far too common for elderly to be denied voter-ID bc they don't drive, may live in assisted care, etc. Should not be this way.";;;;"889288087347527681";https://twitter.com/emoontx/status/889288087347527681
count_01;2017-07-23 19:29;0;0;"This is the argument that gets the snarkiest response from me. It is a declaration you don't care what a right is, and don't deserve them.";;;;"889266229223051265";https://twitter.com/count_01/status/889266229223051265
Nigel22222;2017-07-23 19:18;0;0;"LOL! Typical left wing lying hack. here is what he really is scared ofhttp://www.newsweek.com/thousands-colorado-democrats-and-independents-cancel-voter-registration-after-637996 …";;;;"889263388974514176";https://twitter.com/Nigel22222/status/889263388974514176
Jenlskelly;2017-07-23 19:16;0;0;"If you actually cared, you could've just googled it like I just did for you. Learn something. https://www.washingtonpost.com/politics/courts_law/getting-a-photo-id-so-you-can-vote-is-easy-unless-youre-poor-black-latino-or-elderly/2016/05/23/8d5474ec-20f0-11e6-8690-f14ca9de2972_story.html?utm_term=.eab15bb1e67a …";;;;"889262881698713601";https://twitter.com/Jenlskelly/status/889262881698713601
LowellFinson1;2017-07-23 19:06;0;1;"Voter suppression is perpetrated by vicious politicians who think that's the right thing to do, and perpetuated by those who don't care.";;;;"889260462025523200";https://twitter.com/LowellFinson1/status/889260462025523200
Dean64Gagliano;2017-07-23 18:48;0;0;"Lawmakers could care less about our children...the fact is, they never did care about them. They care only about their twisted ideology!";;;;"889255968411983873";https://twitter.com/Dean64Gagliano/status/889255968411983873
Michael53731190;2017-07-23 18:40;0;0;"@ SenatorDurbin Voter Fraud Commission should come to California DICK. I know of hundreds of ineligible voters voting, DICK. Scared DICK?";;@;;"889253968567615489";https://twitter.com/Michael53731190/status/889253968567615489
fooschamp95;2017-07-23 17:50;0;2;"ur argument doesnt hold water. Are you telling me all these ppl have never done anything in life that required ID? Why are dems so scared?";;;;"889241375790829568";https://twitter.com/fooschamp95/status/889241375790829568
RitchieJodi;2017-07-23 17:43;0;1;"So people of other ethnicities don't work, get healthcare, drive? Racist";;;;"889239535716007937";https://twitter.com/RitchieJodi/status/889239535716007937
JRyan1790;2017-07-23 17:06;0;0;"You're scared of this voter fraud investigation because that's how you continue to win. You should be thrown in jail for obstruction";;;;"889230146036740096";https://twitter.com/JRyan1790/status/889230146036740096
Hammerdownhanna;2017-07-23 16:53;0;1;"Wellll u guys like to say health care is a right, correct? Need an ID for that too.";;;;"889226929060139008";https://twitter.com/Hammerdownhanna/status/889226929060139008
RitchieJodi;2017-07-23 16:14;0;0;"I don't care what my economic status. I will assert my American rights";;;;"889217188657328130";https://twitter.com/RitchieJodi/status/889217188657328130
GK85867596;2017-07-23 16:09;0;0;"@ SenatorDurbin ok, Dick,this week7/24 is ur time to start debates on repeal/replace Obama mess health care. Grow a spine and work 4 America";;@;;"889215924259217408";https://twitter.com/GK85867596/status/889215924259217408
RitchieJodi;2017-07-23 15:34;0;0;"Depends on the career path. My white Brother with 2 degrees, and a 21 year old partier can't get a job either. He's 37 now";;;;"889207132381491201";https://twitter.com/RitchieJodi/status/889207132381491201
joshuasophy;2017-07-23 15:21;0;2;"Who cares what color she is? Pathetic race-baiter. You use dangerous, divisive language but pretend to be something else.";;;;"889203829551632384";https://twitter.com/joshuasophy/status/889203829551632384
tcsorr;2017-07-23 15:18;0;0;"@ SenatorDurbin why are @ TheDemocrats so scared of voter fraud commission?https://twitter.com/SenatorDurbin/status/889140243923951616 …";;@ @;;"889203135742398464";https://twitter.com/tcsorr/status/889203135742398464
RitchieJodi;2017-07-23 15:17;0;0;"It will as long as we speak up and DEMAND no career politicians in both parties";;;;"889202890199506948";https://twitter.com/RitchieJodi/status/889202890199506948
