jaxtell123;2017-07-16 16:36;0;0;"The # BCRA is NOT # healthcare. It is # wealthcare and will devastate rural OK. We NEED you to vote NO on this legislation! # wwjd";;;# # # #;"886685872250396672";https://twitter.com/jaxtell123/status/886685872250396672
sallyray5;2017-07-16 16:11;0;0;"Ideology not reality. @ SenatorLankford @ JimInhofe @ JohnCornyn @ tedcruz @ SenTedCruz # NoTrumpCare http://secondnexus.com/politics-and-economics/latest-analysis-confirms-actual-state-obamacare/?utm_content=inf_686_1164_2&tse_id=INF_245d2370665011e790011d41b85aaeb5 …";;@ @ @ @ @;#;"886679606853500929";https://twitter.com/sallyray5/status/886679606853500929
sallyray5;2017-07-16 16:06;0;0;"Why does she clearly understand this and you don't? @ SenatorLankford @ JimInhofe @ JohnCornyn @ tedcruz @ SenTedCruz Or do you just not care?https://twitter.com/abcpolitics/status/886578683250528257 …";;@ @ @ @ @;;"886678437397659648";https://twitter.com/sallyray5/status/886678437397659648
kimber405;2017-07-16 15:10;0;11;"Just curious, how are you voting on the heath care bill? An actual response would be nice.";;;;"886664459984547840";https://twitter.com/kimber405/status/886664459984547840
Lainashome;2017-07-16 15:10;0;0;"Consider your IMMORTAL SOUL when you vote to remove health care from millions, sir.";;;;"886664245605048321";https://twitter.com/Lainashome/status/886664245605048321
PatBintz;2017-07-16 15:08;1;0;"Why did MOC exempt themselves from Trumpcare? Is that fair? If you don't want Trumpcare, we don't either.";;;;"886663898090352640";https://twitter.com/PatBintz/status/886663898090352640
sallyray5;2017-07-16 14:55;0;0;"So 8-10 Rep senators haven't sold out their constituents for the party...yet. @ SenatorLankford @ JimInhofe http://www.reuters.com/article/us-usa-healthcare-collins-idUSKBN1A10LH?feedType=RSS&feedName=politicsNews&utm_source=feedburner&utm_medium=feed&utm_campaign=Feed%3A+Reuters%2FPoliticsNews+%28Reuters+Politics+News%29 …";;@ @;;"886660484644167681";https://twitter.com/sallyray5/status/886660484644167681
IndivisibleNorm;2017-07-16 14:45;0;0;"You guys don't care b/c you think everyone will forget about this when you're up for reelection. Fair warning: WE WILL NOT FORGET.";;;;"886657946616287232";https://twitter.com/IndivisibleNorm/status/886657946616287232
IndivisibleNorm;2017-07-16 14:43;0;0;". @ SenatorLankford . @ JimInhofe But hey, @ GovMaryFallin doesn't care! She's out of office soon & won't have 2 face consequences of HC failure!https://twitter.com/ASlavitt/status/886616469462712325 …";;@ @ @;;"886657675328663554";https://twitter.com/IndivisibleNorm/status/886657675328663554
IndivisibleNorm;2017-07-16 14:42;0;0;". @ SenatorLankford . @ JimInhofe OK will DEFINITELY choose to do the bare min for citizens when it comes to healthcare. Flexibility in OK=deathhttps://twitter.com/ASlavitt/status/886615849804738561 …";;@ @;;"886657306854916096";https://twitter.com/IndivisibleNorm/status/886657306854916096
MeganGC1983;2017-07-16 14:17;4;7;". @ SenatorLankford the newest healthcare bill is a joke with the insurance company bailouts as the punchline! VOTE NO & get a # FullRepeal";;@;#;"886651125201424384";https://twitter.com/MeganGC1983/status/886651125201424384
OKBlu_;2017-07-16 14:12;0;0;"@ SenatorLankford Stop lying to ppl who are sick ~ about their healthcare. You should be ashamed. Read the FB comments. Who do U work for? pic.twitter.com/KD5LkWboZm";;@;;"886649661175603201";https://twitter.com/OKBlu_/status/886649661175603201
IndivisibleNorm;2017-07-16 13:00;8;8;"Also here's an interesting read: "This is a problem of their own creation that is largely confined to red states." http://www.latimes.com/opinion/op-ed/la-oe-baker-obamacare-red-state-20170713-story.html …";;;;"886631613144203264";https://twitter.com/IndivisibleNorm/status/886631613144203264
scungilli1;2017-07-16 12:59;0;1;"# BRCA just makes the ACA worse by gutting Medicaid and making healthcare unaffordable for more people. Single-payer now!";;;#;"886631280443568128";https://twitter.com/scungilli1/status/886631280443568128
SusanPippin;2017-07-16 12:54;0;3;"The BRCA isn't going to fix them. # BCRAproblems will leave 22 million without health care, what kind of fix is that?";;;#;"886630196773781504";https://twitter.com/SusanPippin/status/886630196773781504
pixievixen3000;2017-07-16 12:52;0;0;"If 45,000 people dying every year due to lack of healthcare is cool with you, get ready for the bodies to REALLY pile up. Babies & kids too";;;;"886629604831764480";https://twitter.com/pixievixen3000/status/886629604831764480
IndivisibleNorm;2017-07-16 12:51;0;4;"Healthcare and pharmaceutical expenses are high because there is virtually no regulation on those industries, which also happen to provide";;;;"886629250782068737";https://twitter.com/IndivisibleNorm/status/886629250782068737
orMaybe_No;2017-07-16 12:49;0;0;"@ SenatorLankford MUST be nice not having 2 worry about healthcare 4 U& UR loved ones.SEEMS like a CHRISTIAN,FAM VALUES thing 2 have 4 all!! https://twitter.com/JohnFugelsang/status/886425424510689280 …";;@;;"886628940856659970";https://twitter.com/orMaybe_No/status/886628940856659970
IndivisibleNorm;2017-07-16 12:47;1;7;"Agreed. But # BCRA is NOT going to improve matters. Work with your colleagues to FIX the # ACA, don't destroy our entire healthcare system";;;# #;"886628462986919938";https://twitter.com/IndivisibleNorm/status/886628462986919938
pixievixen3000;2017-07-16 12:43;1;2;"Don't take things out of context, include the part where # Bernie says # SinglePayerHealthcare costs less and covers EVERYONE # BCRAproblems";;;# # #;"886627469175947264";https://twitter.com/pixievixen3000/status/886627469175947264
sallyray5;2017-07-16 12:36;0;0;"So. Tax increases for the poor to give tax cuts to the wealthy. Nice. @ SenatorLankford @ JimInhofe # NoTrumpCare http://www.epi.org/blog/healthcares-biggest-losers-part-deux-how-the-senates-trumpcare-bill-can-increase-your-state-taxes/ …";;@ @;#;"886625707195076609";https://twitter.com/sallyray5/status/886625707195076609
greyrobedsr;2017-07-16 12:16;0;1;". @ SenatorLankford http://newsok.com/as-congress-debates-obamacare-repeal-the-areas-most-vulnerable-watch-nervously/article/5556523?articleBar=1 …";;@;;"886620614135513088";https://twitter.com/greyrobedsr/status/886620614135513088
billylee1950;2017-07-16 11:45;0;0;"@ SenatorLankford We demand the same health care that CONGRESS!";;@;;"886612867327418368";https://twitter.com/billylee1950/status/886612867327418368
gentlemindmom;2017-07-16 11:27;0;0;"Hope you get well soon also..Considering your using the healthcare you are trying to take away from us..and so is Scalise. You voted 2 keep.";;;;"886608149532336128";https://twitter.com/gentlemindmom/status/886608149532336128
WLMholdings;2017-07-16 10:39;0;0;"Even Ins-co's have come out against the # bettercare in it's current state. https://www.forbes.com/sites/brucejapsen/2017/07/12/insurers-rip-ted-cruzs-trumpcare-amendment/#3d70da052825 …";;;# #3d70da052825;"886596227479031809";https://twitter.com/WLMholdings/status/886596227479031809
BryanFrance1;2017-07-16 10:10;0;0;"Oklahoma is already in a healthcare crisis. This bill will make it worse. Vote for what is best for Oklahoma.";;;;"886588805846904832";https://twitter.com/BryanFrance1/status/886588805846904832
AmyS3478;2017-07-16 09:24;0;5;"I wish him a speedy recovery, as well, and for all Americans to have the same good healthcare. Please don't vote for the replacement bill.";;;;"886577176472154112";https://twitter.com/AmyS3478/status/886577176472154112
orMaybe_No;2017-07-16 02:39;0;0;"The Kodiak Kickback: quiet payoff 4 AK SEN n Sen health bill https://www.vox.com/policy-and-politics/2017/7/15/15971642/alaska-republicans-health-care?utm_campaign=vox&utm_content=entry&utm_medium=social&utm_source=twitter … @ SenatorLankford WILL U vote 4 bill that BUYS a Sen?";;@;;"886475439803424768";https://twitter.com/orMaybe_No/status/886475439803424768
DoreeGraham;2017-07-16 02:22;0;2;"Fix.Don't throw baby out with bath water. Pls find solutions. Healthcare should be a right.Don't give tax break to 1% on backs of vulnerable";;;;"886471069611290624";https://twitter.com/DoreeGraham/status/886471069611290624
DoreeGraham;2017-07-16 02:17;0;2;"Agreed. Bernie solution single payer. I saw report ins. co pulled out bec profit drop from 60% to 40%. Healthcare shouldn't be for profit.";;;;"886469734211997697";https://twitter.com/DoreeGraham/status/886469734211997697
beth_run;2017-07-16 01:01;0;2;"I do believe Inhofe's retiring, thus not running for re-election. I suspect he cares not an iota about what happens to his constituents.";;;;"886450760262799360";https://twitter.com/beth_run/status/886450760262799360
garybehle;2017-07-16 00:41;0;1;"But would you like to hear from the hospital groups, the insurance companies, AARP, or even from us? # Healthcare # healthcare";;;# #;"886445762749640704";https://twitter.com/garybehle/status/886445762749640704
Thestructureman;2017-07-15 21:48;0;0;"Idiotic reasoning. The costs in heslthcare are not Obama care, but rather state health insurance money managers incomes.";;;;"886402007359262720";https://twitter.com/Thestructureman/status/886402007359262720
Thestructureman;2017-07-15 21:46;0;0;"Just as my comment about you being red haired as nothing to with your intelligence, your arguement on Affordable healthcare act has the same";;;;"886401738785402880";https://twitter.com/Thestructureman/status/886401738785402880
Thestructureman;2017-07-15 21:45;0;0;"@ SenatorLankford Even though you are red haired, you dont make any sense in your healthcare problems.";;@;;"886401428507328512";https://twitter.com/Thestructureman/status/886401428507328512
mvermi;2017-07-15 21:43;0;0;". @ SenatorLankford @ InhofePress @ JimInhofe support the Cruz-Lee Amendment to opt out of # Obamacare # OptMeOut # teaparty";;@ @ @;# # #;"886400836808699904";https://twitter.com/mvermi/status/886400836808699904
sallyray5;2017-07-15 21:38;0;0;"Ripping care from children. Where is that in the Bible? @ SenatorLankford @ JimInhofe @ tedcruz @ JohnCornyn # WWJD # GOPLies # NoTrumpCarehttps://twitter.com/kamalaharris/status/885517176928686080 …";;@ @ @ @;# # #;"886399619042824192";https://twitter.com/sallyray5/status/886399619042824192
Andy1008;2017-07-15 21:18;1;3;"In my view, we need to guarantee health care to everyone a right, not throw millions of Americans off of health insurance. Bernie 7/14/2017";;;;"886394496077967364";https://twitter.com/Andy1008/status/886394496077967364
Wellness4You13;2017-07-15 19:39;0;0;"@ SenatorLankford how many of YOUR constituents will YOU STEAL healthcare from?? # KILLTHEBILL";;@;#;"886369755120193536";https://twitter.com/Wellness4You13/status/886369755120193536
okc_larry;2017-07-15 19:03;0;0;"If anyone wants to opt out of Obamacare rules, regulations, and mandates they should be free to do so # OptMeOut";;;#;"886360646065016832";https://twitter.com/okc_larry/status/886360646065016832
annamarieyl;2017-07-15 18:50;0;0;"@ SenatorLankford @ JimInhofe @ RepMullin I'm real, live in Oklahoma, & care deeply that our pres & staff conspired w/Russia 2 hijack democracyhttps://twitter.com/JonahNRO/status/885828004001329154 …";;@ @ @;;"886357286570033153";https://twitter.com/annamarieyl/status/886357286570033153
TheRealCorson;2017-07-15 18:42;0;0;"@ SenatorLankford I hope we can count on your No vote on the Deny America Healthcare Bill.";;@;;"886355403239559178";https://twitter.com/TheRealCorson/status/886355403239559178
catsbat;2017-07-15 17:59;0;1;"It still beats Trumpcare. Vote against it please'";;;;"886344372073181184";https://twitter.com/catsbat/status/886344372073181184
KatyKayZee;2017-07-15 17:40;0;0;"Hmm-- made me look it up. After all, even Nancy Pelosi had to wait for it to pass, so she'd find what was in ithttps://www.google.com/amp/www.ajc.com/news/national-govt--politics/politifact-did-obamacare-pass-with-republican-input/xCU3lpUUWS8HOk20lUpyyL/amp.html …";;;;"886339637962305536";https://twitter.com/KatyKayZee/status/886339637962305536
momssewingroom;2017-07-15 17:35;0;0;"To make sure the constitution is followed. No healthcare mentioned in my constitution. To keep Americans safe. No terrorist allowed in USA";;;;"886338346829717508";https://twitter.com/momssewingroom/status/886338346829717508
garty;2017-07-15 17:23;0;0;"The problem is government isnt involved enough in healthcare.";;;;"886335333192880129";https://twitter.com/garty/status/886335333192880129
KatyKayZee;2017-07-15 17:10;0;0;"Why?-- it wasn't bipartisan in 2009-10; Dems didn't care for yr opinion; if we wanted bipartisan, we would be 1-Party system. REPEAL";;;;"886332229768679424";https://twitter.com/KatyKayZee/status/886332229768679424
sallyray5;2017-07-15 16:38;0;0;"How can you be unclear or undecided about such evil cruelty? # WWJD @ SenatorLankford @ JimInhofe # GOPLies # NoTrumpCare https://www.nytimes.com/interactive/2017/07/13/us/politics/senate-revised-health-care-whip-count.html?smid=tw-share …";;@ @;# # #;"886324231906131971";https://twitter.com/sallyray5/status/886324231906131971
erniemax;2017-07-15 15:58;0;0;"You cannot claim to follow Jesus and then openly flout his commandment to care for the sick and vulnerable. @ SenatorLankford";;@;;"886314094407667712";https://twitter.com/erniemax/status/886314094407667712
AnneDeon1;2017-07-15 15:57;0;0;"@ SenatorLankford @ HoaglandForOhio Pls vote NO on trumpcare. It's death sentence for poor-seriously ill-old-young. It's GREED. Be honest";;@ @;;"886313673307951104";https://twitter.com/AnneDeon1/status/886313673307951104
MidwestWendy;2017-07-15 14:40;0;0;"@ SenatorLankford If the healthcare bill is so great why this http://www.gq.com/story/senate-health-care-bill-exemption … # HealthcareBill";;@;#;"886294504344621056";https://twitter.com/MidwestWendy/status/886294504344621056
momssewingroom;2017-07-15 14:25;0;0;"Need government out. REPEAL and leave us Okies alone. No socialist healthcare. Ridiculous to even think about! REPEAL Obamacare and move on";;;;"886290575464550400";https://twitter.com/momssewingroom/status/886290575464550400
pasturprime;2017-07-15 14:19;1;6;"Vote NO to cuts to Medicaid - devastating to rural OK kids, disabled, poor, & rural health care jobs. WWJD Senator? Vote your values.";;;;"886289028710092800";https://twitter.com/pasturprime/status/886289028710092800
The_Amazing_Lee;2017-07-15 14:01;0;1;"Then why is the bill being passed under budget reconciliation? Be honest senator, you don't care about debate. Party over country, right?";;;;"886284531078230016";https://twitter.com/The_Amazing_Lee/status/886284531078230016
greyrobedsr;2017-07-15 13:48;0;0;". @ SenatorLankford broken promises https://www.americanprogress.org/issues/poverty/news/2017/06/27/435169/impact-senate-health-care-bill-veterans-state-state-breakdown/ …";;@;;"886281266819203073";https://twitter.com/greyrobedsr/status/886281266819203073
cnbjr;2017-07-15 13:13;0;1;"It must also include taking care of the elderly and the children who are in economic need not cutting or increasing cost to them.";;;;"886272494432342016";https://twitter.com/cnbjr/status/886272494432342016
dtcollier54;2017-07-15 12:48;0;0;"Would have never happened with single-payer national healthcare.";;;;"886266107581038592";https://twitter.com/dtcollier54/status/886266107581038592
Magick11h;2017-07-15 12:31;0;0;"No Trumpcare. Fix ACA.";;;;"886261845727875072";https://twitter.com/Magick11h/status/886261845727875072
LazyCircles;2017-07-15 12:26;0;0;"Federal court intervention is a last resort already. Fed $ for schools, roads, prisons, healthcare, SSA are 2 maintain a minimum standard.";;;;"886260645498421249";https://twitter.com/LazyCircles/status/886260645498421249
BeckyD918;2017-07-15 12:19;1;0;"@ SenatorLankford @ senJamesInhofe @ SenateGOP @ SenMajLdr THIS is the real healthcare issue. Start by capping profit on pharm and med costs...https://twitter.com/schomj/status/884497252512870400 …";;@ @ @ @;;"886258850311155713";https://twitter.com/BeckyD918/status/886258850311155713
billylee1950;2017-07-15 12:17;0;0;"@ SenatorLankford GOP health care is a caustic bill that won't protect the people that voted for you! PAK money can't vote. Fire trump!";;@;;"886258380196769792";https://twitter.com/billylee1950/status/886258380196769792
sallyray5;2017-07-15 12:16;1;0;"How can OK afford this? @ SenatorLankford @ JimInhofe say NO! # NoTrumpCare http://www.politico.com/story/2017/07/15/medicaid-funding-drop-obamacare-repeal-240588 …";;@ @;#;"886258155616915456";https://twitter.com/sallyray5/status/886258155616915456
momssewingroom;2017-07-15 12:14;0;0;"Where were you when Obamacare kicked me off my insurance. When Obamacare started we lost our company total pay policy. BECAUSE OF OBAMA";;;;"886257585808080897";https://twitter.com/momssewingroom/status/886257585808080897
jackboyte;2017-07-15 12:00;0;0;". @ SenatorLankford Give us your "elevator pitch". Trump's 'dying in the streets' line vs. health care reality: https://apnews.com/7439d3ac1c25483bb764b3e78a059c9c …";;@;;"886254253567823873";https://twitter.com/jackboyte/status/886254253567823873
smartlyjoan;2017-07-15 12:00;0;0;"# BRCA pays for 58% of a patients healthcare while # ACA pays for 70%... AND ALSO caps payments @$1M... IOW, # TrumpCare is # NOcare";;@;# # # #;"886254159594434565";https://twitter.com/smartlyjoan/status/886254159594434565
witty_wittyd;2017-07-15 11:53;0;0;"Do you @ SenatorLankford think you know better than these health care experts? This is bad for America. https://twitter.com/topherspiro/status/886015376173268992 …";;@;;"886252470468562944";https://twitter.com/witty_wittyd/status/886252470468562944
BatMuzzy1;2017-07-15 11:53;0;0;"@ SenatorLankford OK DHS has a $30M budget shortfall. A 39% decrease in Fed funding for Medicaid would hurt Oklahoma badly. Think carefully.";;@;;"886252266092711936";https://twitter.com/BatMuzzy1/status/886252266092711936
osubusmaj;2017-07-15 11:46;4;5;"I wish @ SenatorLankford & @ JimInhofe were this passionate about protecting healthcare services. But they care more abt # GOP than Oklahomans.https://twitter.com/nowthisnews/status/885703671509536768 …";;@ @;#;"886250525183889413";https://twitter.com/osubusmaj/status/886250525183889413
smartlyjoan;2017-07-15 11:44;1;3;"Universal # SinglePayer Healthcare SAVES equal to ALL taxes collected from those earning $500,000! @ DavidCayJ lead the IRS, he'd know.pic.twitter.com/QTonTFjnR4";;@;#;"886250111977889794";https://twitter.com/smartlyjoan/status/886250111977889794
osubusmaj;2017-07-15 11:39;0;1;"Guys. @ SenatorLankford wants us to be respectful when debating the # BRCA. He's been so nice abt taking healthcare away, so it's only fair.pic.twitter.com/TEiBF65ZIP";;@;#;"886248762716368897";https://twitter.com/osubusmaj/status/886248762716368897
AliSoonerGirl;2017-07-15 11:34;0;12;"Pls be mindful that we are living, breathing ppl who need our healthcare. This isn't D or R. It's human. Many of us feel expendable to D.C.";;;;"886247695601602561";https://twitter.com/AliSoonerGirl/status/886247695601602561
jenseverywhere;2017-07-15 11:30;0;0;"What has changed in the newest version of this bill that makes it better for American people? # Healthcare";;;#;"886246513575424001";https://twitter.com/jenseverywhere/status/886246513575424001
LRobert1951;2017-07-15 11:23;0;0;"We do not need Gov. involvement in health care! Look what you have already done! Its dispicable. Gov. has ruined our private healthcare!";;;;"886244937758408704";https://twitter.com/LRobert1951/status/886244937758408704
Jlozsplash;2017-07-15 11:22;0;0;"https://www.nytimes.com/2017/07/14/us/politics/governors-oppose-senate-affordable-care-act-repeal.html …";;;;"886244615967449089";https://twitter.com/Jlozsplash/status/886244615967449089
smartlyjoan;2017-07-15 11:06;0;2;"So why pass # Trumpcare, a law that will INCREASE COSTS BY 73%?";;;#;"886240511639662593";https://twitter.com/smartlyjoan/status/886240511639662593
wrighta18;2017-07-15 10:31;0;0;"We've been debating healthcare for 7 years think it's time for congress house and senate to pass something. 7 years! Get it DONE!";;;;"886231645518516227";https://twitter.com/wrighta18/status/886231645518516227
BEnnis80;2017-07-15 10:29;0;0;"https://www.google.com/amp/s/www.consumeraffairs.com/amp/news/health-insurance-industry-rakes-in-billions-while-blaming-obamacare-for-losses-110116.html …";;;;"886231319130382336";https://twitter.com/BEnnis80/status/886231319130382336
MDresk;2017-07-15 10:27;0;9;"I am a primary care physician, I remember the pre-ACA days. Doctors, especially in primary care, are horrified to see us go backwards.";;;;"886230871597998081";https://twitter.com/MDresk/status/886230871597998081
MDresk;2017-07-15 10:24;0;6;"I agree. Thank you. Am a primary care physician. Stripping essential health benefit will lead to progression preventable problems for many.";;;;"886230096385720320";https://twitter.com/MDresk/status/886230096385720320
funky5mab;2017-07-15 10:14;0;9;"All the medical organizations I belong to are against the Senate # healthcare bill as well as two large insurance advocacy groups. # VoteNo";;;# #;"886227450094604288";https://twitter.com/funky5mab/status/886227450094604288
Kath120354;2017-07-15 09:53;4;1;"Hey @ SenJimInhofe @ SenatorLankford @ SenateMajLdr are you listening? No one wants your vindictive, harmful, retaliatory healthcare bill! https://twitter.com/TopherSpiro/status/886015376173268992 …";;@ @ @;;"886222208531660800";https://twitter.com/Kath120354/status/886222208531660800
karrotfaye;2017-07-15 09:41;0;5;"BCRA is so much worse for nearly everyone who isn't a member of congress. Please just fix the # ACA, don't destroy healthcare as we know it";;;#;"886219174376333313";https://twitter.com/karrotfaye/status/886219174376333313
wildatheart159;2017-07-15 09:23;0;0;"Read your stmt on Healthcare bill. You are quite the spin Dr. Your political career will be defined by the way you screw over Constituents";;;;"886214532007374849";https://twitter.com/wildatheart159/status/886214532007374849
avoiceforothers;2017-07-15 09:19;0;0;"I dont believe you will ever pass any healhcareif you depened on Dems. Period.";;;;"886213750134636546";https://twitter.com/avoiceforothers/status/886213750134636546
eileen_granfors;2017-07-15 09:15;0;1;"How many Missourians will qualify for these experimental programs under # Trumpcare? Vote no. Come up with a real medical plan for everyone.";;;#;"886212648525733888";https://twitter.com/eileen_granfors/status/886212648525733888
dtcollier54;2017-07-15 09:13;1;8;""If" you kick thousands of Oklahomans off of affordable access to healthcare, we will not forget. We will find a candidate to defeat you.";;;;"886212024719618048";https://twitter.com/dtcollier54/status/886212024719618048
SenatorLankford;2017-07-15 09:03;36;189;"If the Senate moves forward w/ # healthcare reform, it must include an open bipartisan debate & amendment process. http://www.facebook.com/SenatorLankford/posts/1521960167866300 …";;;#;"886209557009190913";https://twitter.com/SenatorLankford/status/886209557009190913
ricopie;2017-07-15 08:48;0;0;"The question is, will @ JimInhofe and @ SenatorLankford go down in history as stripping # Healthcare from millions for their own gain?https://twitter.com/upshotnyt/status/886193862548520960 …";;@ @;#;"886205913354440704";https://twitter.com/ricopie/status/886205913354440704
gentlemindmom;2017-07-15 08:27;0;1;"If it's so bad how come you all voted to keep it for yourselves and try to impose deathcare on us..Not going to appease me with a Bernie";;;;"886200492870782976";https://twitter.com/gentlemindmom/status/886200492870782976
gentlemindmom;2017-07-15 08:26;0;0;"http://www.rollcall.com/news/politics/republicans-exempted-insurance-obamacare-rollback#sthash.8z4ydmi3.uxfs …";;;#sthash;"886200180348989441";https://twitter.com/gentlemindmom/status/886200180348989441
mpowerednetwork;2017-07-15 07:56;0;1;"You talk the Christian talk. How 'bout following the scripture? It's simple. What would Jesus do? Vote NO on Wealthcare.";;;;"886192643306385409";https://twitter.com/mpowerednetwork/status/886192643306385409
gentlemindmom;2017-07-15 07:49;0;1;"# healthcare not a @ wealthcare @ GOP turns a blind eye and fills their pockets!!pic.twitter.com/gm2cKzWYtn";;@ @;#;"886190872852914176";https://twitter.com/gentlemindmom/status/886190872852914176
gentlemindmom;2017-07-15 07:47;0;1;"As You Lose Your Coverage, Insurance Companies Will Get A $145 Billion Tax Cut From Trumpcare # healthcare not # wealthcare its a # Deathtaxpic.twitter.com/0uWv5gRyiv";;;# # #;"886190588533637121";https://twitter.com/gentlemindmom/status/886190588533637121
gentlemindmom;2017-07-15 07:27;0;0;"That will kill thousands..for what? Because your a racist and it was called Obamacare and not the ACA? A black man helped millions? smh";;;;"886185512079429632";https://twitter.com/gentlemindmom/status/886185512079429632
gentlemindmom;2017-07-15 07:23;0;5;"To be clear: new # Trumpcare deems maternity care, mental health treatment and Rx drugs as essential for Congress but not rest of Americans.";;;#;"886184449561546752";https://twitter.com/gentlemindmom/status/886184449561546752
stormyokla;2017-07-15 06:40;0;4;"If you won't listen to us, would you at least listen to the healthcare groups speaking out against this bill? Even insurance groups opposed.";;;;"886173744963760128";https://twitter.com/stormyokla/status/886173744963760128
Galotangani;2017-07-15 05:54;0;0;"Problems can be fixed. You don't quit a marriage that has problems, you work it out...why not applying the same principle with healthcare?!";;;;"886161992112799744";https://twitter.com/Galotangani/status/886161992112799744
LeakeVictor;2017-07-15 05:19;0;0;"No end it, get government out of health care.";;;;"886153174784122880";https://twitter.com/LeakeVictor/status/886153174784122880
