isjohnsgi;2017-07-18 07:22;0;0;"@ SenatorDurbin Fight Hard against ACA repeal! It would cause suffering, loss of jobs in healthcare, failing Hospital, anger at Congress!";;@;;"887271478294663168";https://twitter.com/isjohnsgi/status/887271478294663168
hammer30084;2017-07-18 07:16;0;0;"Should if supported it then when it fails the only thing left would of been Universal Healthcare. Now they will pass a full repeal.";;;;"887269932794249216";https://twitter.com/hammer30084/status/887269932794249216
hammer30084;2017-07-18 07:15;0;0;"It's not the voices that keept GOP from getting a Healthcare Bill passed. You and your party are idiots.";;;;"887269623200186368";https://twitter.com/hammer30084/status/887269623200186368
CindyInChicago;2017-07-18 04:02;0;0;"SO proud IL senators are @ SenatorDurbin and @ SenDuckworth -- always voting for health care for ALL!https://twitter.com/Kris_Sacrebleu/status/887153116331692033 …";;@ @;;"887220948222521344";https://twitter.com/CindyInChicago/status/887220948222521344
ChezAprilKern;2017-07-18 02:11;2;1;"This IL resident is in favor of a clean repeal of Obamacare. Vote YES to repeal. @ SenatorDurbin @ SenDuckworth @ RepLaHood # RepealObamacare";;@ @ @;#;"887193034122768384";https://twitter.com/ChezAprilKern/status/887193034122768384
rick_bossen;2017-07-18 01:50;0;0;"As long as healthcare slows price increases by shifting costs to patients in an effort to raise taxes it will NEVER work. Americans. Say NO!";;;;"887187927373156352";https://twitter.com/rick_bossen/status/887187927373156352
Jeden13;2017-07-18 01:38;0;0;"I have no subsidies as I was forced on to medicare. I had good insurance till the government got involved";;;;"887184747050532865";https://twitter.com/Jeden13/status/887184747050532865
twp03;2017-07-18 01:23;0;0;"If # healthcare for all is Marxist and improves many lives, bring it on!!";;;#;"887181101759959041";https://twitter.com/twp03/status/887181101759959041
twp03;2017-07-18 01:16;0;0;"When will the # GOP stop banging it's head against the healthcare wall? After 8 yrs, you think they might learn wants healthcare.";;;#;"887179167971856385";https://twitter.com/twp03/status/887179167971856385
RealGravitas;2017-07-18 01:12;0;3;"This is a massive victory for the people. We're not done, but it shows what we can do when we care enough.";;;;"887178308630093826";https://twitter.com/RealGravitas/status/887178308630093826
AmericasTeamTJ;2017-07-18 00:13;0;0;"Exactly! Let's get this thing repealed. We need the govt out of healthcare NOW!";;;;"887163418888867841";https://twitter.com/AmericasTeamTJ/status/887163418888867841
another_guy74;2017-07-18 00:05;0;0;"@ SenateMajLdr @ SenatorDurbin @ SpeakerRyan @ Foster4Congress @ SenDuckworth keep # ObamaCare Vote # NO on # repealobamacare";;@ @ @ @ @;# # #;"887161284885708800";https://twitter.com/another_guy74/status/887161284885708800
Denise_L_;2017-07-18 00:02;0;1;"Healthcare should not be a for-profit business, but in the US it is. So when minimum coverage requirements were imposed,";;;;"887160613180493826";https://twitter.com/Denise_L_/status/887160613180493826
Denise_L_;2017-07-17 23:56;0;0;"Healthcare is not a service, it's a basic necessity, like food and water!";;;;"887159132897374208";https://twitter.com/Denise_L_/status/887159132897374208
AuthorKimberley;2017-07-17 23:37;20;31;". @ TheDemocrats have a fantastic opportunity to lead on # healthcare now. @NancyPelosi @ SenSchumer @ SenFranken @ SenatorDurbin @WhipHoyer https://twitter.com/bobcesca_go/status/887116425952874496 …";;@ @NancyPelosi @ @ @ @WhipHoyer;#;"887154229743296513";https://twitter.com/AuthorKimberley/status/887154229743296513
jennvb2608;2017-07-17 23:32;0;0;"@ SenatorDurbin Thank You Senator for fighting for the ACA. I'm a single, small business owner and the ACA is my only option for health care.";;@;;"887152967035617280";https://twitter.com/jennvb2608/status/887152967035617280
amyflano;2017-07-17 22:46;0;1;"Thank you, Senator Durbin! Appreciate you standing against Trumpcare and working towards improving healthcare access for all Americans";;;;"887141582289371139";https://twitter.com/amyflano/status/887141582289371139
CarynB_Chicago;2017-07-17 22:28;0;0;"yes stop thinking of voters as objects All voters are actually humans regardless of wht state they live Healthcare 4 ALL";;;;"887136890914299904";https://twitter.com/CarynB_Chicago/status/887136890914299904
_Habuce;2017-07-17 22:25;0;0;"Thank you @ SenatorDurbin for helping us keep our healthcare.";;@;;"887136253833084928";https://twitter.com/_Habuce/status/887136253833084928
Sew_In_a_Stew;2017-07-17 22:21;0;0;"Time for our Senate leaders to reach out for bipartisan solution to healthcare in America. I am from Illinois @ SenatorDurbin and I trust you https://twitter.com/SenatorDurbin/status/887133246236000256 …";;@;;"887135331308457985";https://twitter.com/Sew_In_a_Stew/status/887135331308457985
pinaalmost56;2017-07-17 22:18;0;0;"@ SenatorDurbin @ nytimes ~ Thanks to Senators Moran and Lee for putting the American people's healthcare before party!https://twitter.com/SenatorDurbin/status/887132964106235904 …";;@ @;;"887134428681486336";https://twitter.com/pinaalmost56/status/887134428681486336
WindyCityFunk;2017-07-17 22:16;1;3;"Let's Fix Obamacare The President's Signature Legislation A Good one which can be fixed";;;;"887133990225883139";https://twitter.com/WindyCityFunk/status/887133990225883139
jimmy_two_hands;2017-07-17 21:51;0;1;"How about single payer Medicare for all, guy?";;;;"887127638367772672";https://twitter.com/jimmy_two_hands/status/887127638367772672
ssscott23;2017-07-17 21:40;0;0;"@ ChrisMurphyCT @ SenDuckworth @ SenSchumer @ SenatorDurbin Will Dems be ready with help w/healthcare? It would be a huge relief to many.";;@ @ @ @;;"887124953363042305";https://twitter.com/ssscott23/status/887124953363042305
Ray21959505;2017-07-17 21:23;0;0;"But it's not as bad as # Obamacare. Thanks Dick, over 2 years haven't seen a doctor. I'd rather pay my mortgage. You really screwed us.";;;#;"887120671951773696";https://twitter.com/Ray21959505/status/887120671951773696
bzsigns;2017-07-17 21:17;0;2;"Thank you for being my Senator!!! Thank you for working to defeat the @ GOP horrible Healthcare bill. I need my Medicaid, I'm a Diabetic.";;@;;"887119054955270144";https://twitter.com/bzsigns/status/887119054955270144
stephenwhiteMSN;2017-07-17 19:43;0;1;"Elected officials making decisions about healthcare policy while ignoring the appeals of the AMA & ANA is just bad politics. # N545rn @ pcjefa";;@;#;"887095345909334016";https://twitter.com/stephenwhiteMSN/status/887095345909334016
Seeleyfan;2017-07-17 19:15;1;1;"So let's fix it rather than taking healthcare coverage away from 20+ million Americans.";;;;"887088380357554177";https://twitter.com/Seeleyfan/status/887088380357554177
gtrich1;2017-07-17 19:14;0;0;"Go move to one of the counties and then come back and say that... Ppl travel here from around the globe for our medical care...";;;;"887088210337304576";https://twitter.com/gtrich1/status/887088210337304576
gtrich1;2017-07-17 19:12;0;0;"guess you have short memory or just plain dumb that we are in the position thanks to Obamacare imploding before our very eyes. Unreal!";;;;"887087726155227136";https://twitter.com/gtrich1/status/887087726155227136
gtrich1;2017-07-17 19:10;0;0;"Well well well..nice job Sen. getting the American citizens into this mess to start with..did not take Obama care but a few years to implode";;;;"887087018378964992";https://twitter.com/gtrich1/status/887087018378964992
Conscience_Abe;2017-07-17 19:06;0;0;"The only fatal flaw in this discussion is Obamacare. You know, the bill you faught so hard for..and lied to us in passing..";;;;"887086013293764608";https://twitter.com/Conscience_Abe/status/887086013293764608
KimberlyWestco2;2017-07-17 18:54;0;0;"@ SenatorDurbin & Collinsville IL we fight for our Healthcare & Resist. We stand firm w/ fixing ACA Not repeal & replacing.Thx Senator.";;@;;"887083045773357059";https://twitter.com/KimberlyWestco2/status/887083045773357059
SenatorDurbin;2017-07-17 18:49;47;107;"Discussed the fatally flawed Senate Republican health care repeal bill with @ Thresholdsctrs and heard powerful stories of ACA’s importance.pic.twitter.com/L9K9hHy10k";;@;;"887081734541647874";https://twitter.com/SenatorDurbin/status/887081734541647874
SolomonEnid;2017-07-17 18:07;1;1;"Say YES to universal healthcare. if other countries can provide for their people so can we # cantkeepquiet # raiseyourvoice";;;# #;"887071354217840640";https://twitter.com/SolomonEnid/status/887071354217840640
ghosthunter_lol;2017-07-17 17:40;0;0;"@ GOP @ SenatorDurbin Wanna be a Man of Principle or a Man of Power Mr Durbin help The President be another Hero lets do away Tax & Obamacare https://twitter.com/ghosthunter_lol/status/887060644712861696 …";;@ @;;"887064477794959361";https://twitter.com/ghosthunter_lol/status/887064477794959361
KimMBarnes2;2017-07-17 17:14;0;0;"Yes, under the guise that senate would squash it.Which they did 1st time.Nothing like passing the buck.At least he is thinking now or scared";;;;"887057872500162560";https://twitter.com/KimMBarnes2/status/887057872500162560
KimMBarnes2;2017-07-17 17:07;0;1;"Yes & Republicans Killed the Child Victims act again. But what does that have to do with healthcare?";;;;"887056296394051584";https://twitter.com/KimMBarnes2/status/887056296394051584
saintchuck;2017-07-17 17:07;0;0;"He's the one that got that Healthcare bill passed with the help of his parties majority in both houses of Congress, right?";;;;"887056256007102465";https://twitter.com/saintchuck/status/887056256007102465
tn_tennessee;2017-07-17 17:07;0;0;"Unfortunately the American people don't scare them. Only Fox News and conservative talk radio scare @ SenateGOPpic.twitter.com/jlxEU2TPe1";;@;;"887056222247170048";https://twitter.com/tn_tennessee/status/887056222247170048
KimMBarnes2;2017-07-17 17:02;0;1;"What does that have anything 2 do with healthcare.When u have no response that seems to be the go to.Believe me we all know who POTUS is.";;;;"887055006465224707";https://twitter.com/KimMBarnes2/status/887055006465224707
QuorumCall;2017-07-17 16:53;1;0;"# Senate GOP's Obamacare repeal can't stand the light of day: Durbin http://dlvr.it/PWHYG1 @ SenatorDurbin";;@;#;"887052719067774977";https://twitter.com/QuorumCall/status/887052719067774977
gg122862;2017-07-17 16:33;0;0;"@ SenatorDurbin @ SenDuckworth From 2 voters n 60516 (IL), please follow our wishes & vote to # repealobamacare completely now. TY";;@ @;#;"887047589744574466";https://twitter.com/gg122862/status/887047589744574466
ericswerdlin;2017-07-17 16:20;0;0;"100% correct! Remember this anytime someone says "Dems need a message". There's # tech revolution coming, what's the plan? Healthcare & jobs.";;;#;"887044305180925955";https://twitter.com/ericswerdlin/status/887044305180925955
McMurphysMinion;2017-07-17 15:57;0;2;"Health care isn't a human right 2 u is it @ RodneyDavis? What about u @ SenMajLdr @ SenTedCruz? Thank u @ SenatorDurbin 4 standing 4 IL https://twitter.com/SenatorDurbin/status/886947692424949760 …";;@ @ @ @;;"887038480332804096";https://twitter.com/McMurphysMinion/status/887038480332804096
WKiraW;2017-07-17 15:30;0;0;"So who's going 2 pay my skyrocketing fees under the ACA for a policy with a $2k deductible? Still paying cash for health care & being taxed.";;;;"887031894944219138";https://twitter.com/WKiraW/status/887031894944219138
loubielou32;2017-07-17 15:04;0;1;"100% in the 21st century, in a 1st world country, you should be able to provide universal healthcare. No logical reason not to. Except greed";;;;"887025149161213952";https://twitter.com/loubielou32/status/887025149161213952
CAPAction;2017-07-17 14:54;3;8;"Thank you @ SenDuckworth & @ SenatorDurbin for working to # ProtectOurCare for people like Erin in Chicago:https://www.momsrising.org/blog/protectourcare-meet-erin-from-chicago-il …";;@ @;#;"887022709330280453";https://twitter.com/CAPAction/status/887022709330280453
RWVNY;2017-07-17 14:45;0;0;"We are thankful for @ SenDuckworth & @ SenatorDurbin for working to # ProtectOurCare for people like Erin in Chicago:https://www.momsrising.org/blog/protectourcare-meet-erin-from-chicago-il …";;@ @;#;"887020405671833603";https://twitter.com/RWVNY/status/887020405671833603
RWV4HealthCare;2017-07-17 14:45;0;0;"We are thankful for @ SenDuckworth & @ SenatorDurbin for working to # ProtectOurCare for people like Erin in Chicago: https://www.momsrising.org/blog/protectourcare-meet-erin-from-chicago-il …";;@ @;#;"887020401884352513";https://twitter.com/RWV4HealthCare/status/887020401884352513
02Cents0;2017-07-17 14:35;0;0;"MoveOn: Thank you SenDuckworth & SenatorDurbin for working to # ProtectOurCare for people like Erin in Chicago: https://www.momsrising.org/blog/protectourcare-meet-erin-from-chicago-il …";;;#;"887017933817487360";https://twitter.com/02Cents0/status/887017933817487360
MoveOn;2017-07-17 14:33;47;47;"Thank you @ SenDuckworth & @ SenatorDurbin for working to # ProtectOurCare for people like Erin in Chicago: https://www.momsrising.org/blog/protectourcare-meet-erin-from-chicago-il …";;@ @;#;"887017313224011776";https://twitter.com/MoveOn/status/887017313224011776
IAmForKids;2017-07-17 14:30;0;0;"Thank you @ SenDuckworth & @ SenatorDurbin for working to # ProtectOurCare for Erin in Chicago: # IAmForKids https://www.momsrising.org/blog/protectourcare-meet-erin-from-chicago-il …";;@ @;# #;"887016560031928320";https://twitter.com/IAmForKids/status/887016560031928320
Kids_Rising;2017-07-17 14:26;2;3;"Thank you @ SenDuckworth & @ SenatorDurbin for working to # ProtectOurCare for people like Erin in Chicago: https://www.momsrising.org/blog/protectourcare-meet-erin-from-chicago-il …";;@ @;#;"887015630582550531";https://twitter.com/Kids_Rising/status/887015630582550531
XochitlOseguera;2017-07-17 14:04;1;1;"Thank you @ SenDuckworth & @ SenatorDurbin for working to # ProtectOurCare for people like Erin in Chicago: https://www.momsrising.org/blog/protectourcare-meet-erin-from-chicago-il …";;@ @;#;"887010214351917062";https://twitter.com/XochitlOseguera/status/887010214351917062
MamasConPoder;2017-07-17 14:04;0;2;"Thank you @ SenDuckworth & @ SenatorDurbin for working to # ProtectOurCare for people like Erin in Chicago: https://www.momsrising.org/blog/protectourcare-meet-erin-from-chicago-il …";;@ @;#;"887010059443724289";https://twitter.com/MamasConPoder/status/887010059443724289
MomsRising;2017-07-17 14:03;34;98;"Thank you @ SenDuckworth & @ SenatorDurbin for working to # ProtectOurCare for people like Erin in Chicago:https://www.momsrising.org/blog/protectourcare-meet-erin-from-chicago-il …";;@ @;#;"887009804237103104";https://twitter.com/MomsRising/status/887009804237103104
shin_inouye;2017-07-17 14:02;0;0;"Thank you @ SenDuckworth & @ SenatorDurbin for working to # ProtectOurCare for people like Erin in Chicago: https://www.momsrising.org/blog/protectourcare-meet-erin-from-chicago-il …";;@ @;#;"887009507385122816";https://twitter.com/shin_inouye/status/887009507385122816
AnneBarasso;2017-07-17 12:26;0;0;"@ SenateGOP Healthcare not just for you wealthy guys! We need it just as much as you! @ JoeBiden @ SenatorDurbin @ SenWarren @ SenKamalaHarrishttps://twitter.com/washingtonpost/status/886930933508710400 …";;@ @ @ @ @;;"886985363906080768";https://twitter.com/AnneBarasso/status/886985363906080768
abby_said_so;2017-07-17 12:18;0;1;"The new "healthcare" bill should be called what it is. Wealthcare. @ JoeBiden and @ SenatorDurbin understand this # ProtectOurCarehttps://twitter.com/senatordurbin/status/886947692424949760 …";;@ @;#;"886983558916714497";https://twitter.com/abby_said_so/status/886983558916714497
JulianFDrake1;2017-07-17 12:04;0;0;"What did people do before Obamacare?";;;;"886979856034123780";https://twitter.com/JulianFDrake1/status/886979856034123780
ProtectILCare;2017-07-17 11:34;1;2;"@ SenatorDurbin: This GOP repeal bill is opposed by every health care group in America. # KillTheBill # ProtectOurCarepic.twitter.com/p2lSLC0Rno";;@;# #;"886972393608138752";https://twitter.com/ProtectILCare/status/886972393608138752
SchmidtVicki;2017-07-17 11:11;0;0;"People want healthcare. We want what politicians have. Good, decent, government sponsored health care. Like McConnell has.";;;;"886966634098937861";https://twitter.com/SchmidtVicki/status/886966634098937861
Ron65369957;2017-07-17 11:05;0;0;"Tax all churches, put a1/2 per cent on all Wall street transactions use collected money for health care";;;;"886965119262916609";https://twitter.com/Ron65369957/status/886965119262916609
Vivalanadia;2017-07-17 11:00;0;0;"Thank you @ SenDuckworth & @ SenatorDurbin for working to # ProtectOurCare for people like Erin in Chicago: https://www.momsrising.org/blog/protectourcare-meet-erin-from-chicago-il …";;@ @;#;"886963707875557376";https://twitter.com/Vivalanadia/status/886963707875557376
sfox8802;2017-07-17 10:59;0;0;"Democrats decided healthcare is for all and paid for by a few";;;;"886963667371208704";https://twitter.com/sfox8802/status/886963667371208704
sfox8802;2017-07-17 10:59;0;0;"Democrats decided healthcare is for all and paid for by a few.";;;;"886963516032389122";https://twitter.com/sfox8802/status/886963516032389122
sfox8802;2017-07-17 10:57;0;0;"Not what you Democrats did with Obamacare. Pelosi wouldn't let her own party read the bill";;;;"886963062963666946";https://twitter.com/sfox8802/status/886963062963666946
twp03;2017-07-17 10:28;0;2;"This bill does nothing to reign in costs. The so called healthcare market encourages over consumption and spiraling costs.";;;;"886955793953824768";https://twitter.com/twp03/status/886955793953824768
twp03;2017-07-17 10:24;2;4;"Senate bill is not healthcare reform. It is a back door tax cut for wealthy. # Congress can't pass tax cuts and transfer payments honestly";;;#;"886954841037209600";https://twitter.com/twp03/status/886954841037209600
josh24v15;2017-07-17 10:14;0;0;"Healthcare and health insurance are separate entities. Congress could have addressed the former without screwing up the latter.";;;;"886952213322620928";https://twitter.com/josh24v15/status/886952213322620928
TheRReport;2017-07-17 10:07;2;1;"Dick @ SenatorDurbin (D-IL) challenges # undemocratic @ GOP to hold hearings on healthcare bill during delay http://thehill.com/policy/healthcare/342304-top-dem-challenges-gop-to-hold-hearings-on-healthcare-bill-during-delay#.WWzEXuefeiQ.twitter …";;@ @;# #;"886950534510522370";https://twitter.com/TheRReport/status/886950534510522370
karlamoPA;2017-07-17 10:07;0;0;"Right, but we MUST also address the ever rising cost of healthcare: over 10K per person averaged out - and rising.";;;;"886950532107182082";https://twitter.com/karlamoPA/status/886950532107182082
Mr_Mantis;2017-07-17 10:07;0;1;"Couldn't agree more! Thank you for your efforts on this issue @ SenatorDurbin @ JoeBiden # DontRepeal # DontReplace # ACA # Obamacarehttps://twitter.com/senatordurbin/status/886947692424949760 …";;@ @;# # # #;"886950405577609220";https://twitter.com/Mr_Mantis/status/886950405577609220
MurielKuri;2017-07-17 10:00;0;1;"On Obamacare I was paying $1100.00 per month for my husband's coverage. I didn't go to doctors because of the copays and out of pocket exp.";;;;"886948641474326528";https://twitter.com/MurielKuri/status/886948641474326528
vets4bernie;2017-07-17 09:59;3;5;"We're glad @ JoeBiden and @ SenatorDurbin agree with @ BernieSanders that healthcare is a right of all people. Welcome aboard, gents!";;@ @ @;;"886948472775168000";https://twitter.com/vets4bernie/status/886948472775168000
biasviewcom;2017-07-17 09:57;0;3;"This is disingenuous. I'm not part of wealthy few, but have had health care my entire life. How we argue is as important as what we argue.";;;;"886948069559939073";https://twitter.com/biasviewcom/status/886948069559939073
SenatorDurbin;2017-07-17 09:56;243;607;"MORNING READ: @ JoeBiden's right. Health care should be a right for every American, not a privilege for wealthy few. https://www.washingtonpost.com/news/posteverything/wp/2017/07/17/joe-biden-as-a-nation-we-decided-that-health-care-is-for-all-republicans-want-to-roll-that-back/?utm_term=.e945fc13a760 …";;@;;"886947692424949760";https://twitter.com/SenatorDurbin/status/886947692424949760
buznbyu;2017-07-17 09:51;0;0;"Hopefully it will help him see the non health care plan will destroy seniors injured disabled and kids(&families). #1 issue of divorce debt";;;#1;"886946372884234241";https://twitter.com/buznbyu/status/886946372884234241
SeltsamAnders;2017-07-17 09:32;0;0;"That idea is probably a little too radical for @ SenateGOP. They might hear opinions they don't like, or even worse, facts. # BCRA # Healthcare";;@;# #;"886941712769306624";https://twitter.com/SeltsamAnders/status/886941712769306624
KeesRoosevelt;2017-07-17 09:08;0;0;"We, the public need to know how each senate republican voted on this new republican healthcare bill.";;;;"886935545624104960";https://twitter.com/KeesRoosevelt/status/886935545624104960
jamin0;2017-07-17 09:04;0;0;"Let the @ SenateGOP pass the bill. Lets the Trump voters get the Healthcare they deserve";;@;;"886934720541581313";https://twitter.com/jamin0/status/886934720541581313
PayLab1224;2017-07-17 08:55;0;0;". @ SenateGOP @ SenJeffMerkley @ SenatorDurbin @ SenatorCollins NO taxpayer $ for # HorseSlaughter # foodsafety Spend our monies on # Healthcarehttps://twitter.com/PayLab1224/status/886613239383158786 …";;@ @ @ @;# # #;"886932438697603073";https://twitter.com/PayLab1224/status/886932438697603073
kcupjunkie;2017-07-17 08:53;0;0;"Would be wise but never gonna happen. GOP doesn't want to stir up further attention to McConnell's carefully prepared pot of BS.";;;;"886931816317427712";https://twitter.com/kcupjunkie/status/886931816317427712
DJTsavesAmerica;2017-07-17 08:48;0;0;"REPLACE & REPEAL save time & taxpayers money 23 Million still don't have healthcare https://twitter.com/realdonaldtrump/status/886283456644251652 … Is this what you been told?";;;;"886930682810843137";https://twitter.com/DJTsavesAmerica/status/886930682810843137
RegAnew27;2017-07-17 08:18;1;1;"@ GOP remember your voted in by the very people your trying to take healthcare away from. Call CBO don't screw over your country for trump";;@;;"886923161178169344";https://twitter.com/RegAnew27/status/886923161178169344
SenatorDurbin;2017-07-17 08:00;671;1718;"Here's a radical idea @ SenateGOP: use the time that Sen. McCain is gone to hold a public hearing on your latest health care repeal bill";;@;;"886918567899353088";https://twitter.com/SenatorDurbin/status/886918567899353088
JaneDone15;2017-07-17 06:55;0;0;"@ maziehirono @ SenatorDurbin @SenBennetCO Americans deserve the same healthcare as @ SenatorJMcCain when health issues arise. # dumptrumpcare";;@ @ @SenBennetCO @;#;"886902102332669952";https://twitter.com/JaneDone15/status/886902102332669952
markwildman;2017-07-16 19:27;0;1;"I sure wish you were this persistent with HRC's actual reckless behaviors but since you didn't care, I don't care what Trump Jr did at all.";;;;"886729134390562816";https://twitter.com/markwildman/status/886729134390562816
BlnNews_com;2017-07-16 18:51;0;0;"Fake news, they didn't care when Clintons raked in money from Russians. All roads lead to dem collusion!";;;;"886720056570384384";https://twitter.com/BlnNews_com/status/886720056570384384
CaCaonyou;2017-07-16 18:48;0;0;"How much would it cost to have you support Medicare for all?";;;;"886719263490355200";https://twitter.com/CaCaonyou/status/886719263490355200
Seeleyfan;2017-07-16 18:42;0;0;"The Senator, the media, and tens of millions of Americans concerned about our democracy care. Curious why you don't.";;;;"886717819009847296";https://twitter.com/Seeleyfan/status/886717819009847296
HeidiJH1;2017-07-16 17:06;0;0;"@ GovRauner Adding my voice as an IL citizen: Please use your influence as a governor to protect us from Trumpcare. Thank you @ SenatorDurbin https://twitter.com/SenatorDurbin/status/886598116903968772 …";;@ @;;"886693529162051585";https://twitter.com/HeidiJH1/status/886693529162051585
twocents49;2017-07-16 15:32;0;0;"I bet senator McCain is glad he doesn't have the health care plan they're trying to pass";;;;"886669846070542336";https://twitter.com/twocents49/status/886669846070542336
feminist505;2017-07-16 15:16;0;0;"@ SenDuckworth @ SenatorDurbin # IStandWithPP Vote NO to defunding planned parenthood & save millions of womens healthcare";;@ @;#;"886665911129845762";https://twitter.com/feminist505/status/886665911129845762
zapher134;2017-07-16 14:56;0;0;"Alternatively, or additionally, @ MedicareGov could be allowed to offer prorated policies that save it money in the long run.";;@;;"886660911250853888";https://twitter.com/zapher134/status/886660911250853888
DeannaMarie208;2017-07-16 14:31;0;0;"Not even close to an accurate equivalence, since people's lives rely on access to health care";;;;"886654576597897218";https://twitter.com/DeannaMarie208/status/886654576597897218
vitali_kittle;2017-07-16 13:35;0;0;"They have broken the law, therefore I don't care, the far left disgusts me.";;;;"886640537549369348";https://twitter.com/vitali_kittle/status/886640537549369348
Donato3d;2017-07-16 13:09;0;1;"Dems have to put out a positive message on healthcare. Quit waiting for the GOP to implode. Tell us what you'll do. Stop the fail!!!!";;;;"886633952924053505";https://twitter.com/Donato3d/status/886633952924053505
khimmelfarts;2017-07-16 11:51;0;2;"Rauner is paying Koch to: Abolish Obamacare Deny climate change Privatize Social Security Create unfair taxespic.twitter.com/wyiOjmNogn";;;;"886614296012218368";https://twitter.com/khimmelfarts/status/886614296012218368
