d_l2lp;2017-07-21 16:37;0;0;"@ SenatorDurbin I am a constituent concerned about the future of my health care. Put http://patientsbeforepolitics.org  and vote NO.";;@;;"888498070136270850";https://twitter.com/d_l2lp/status/888498070136270850
Weishampel;2017-07-21 16:27;0;1;"you mean look up the one quote where he said that would be a temporary step toward medicare for all";;;;"888495684042620928";https://twitter.com/Weishampel/status/888495684042620928
the__real_shawn;2017-07-21 16:26;0;0;"Why is the government involved in health care. Government big enough to give you everything is big enough to take it away.";;;;"888495381818077184";https://twitter.com/the__real_shawn/status/888495381818077184
TiaCarra;2017-07-21 16:25;0;0;"@ Democrats are responsible for # Obamacare quagmire, Pelosi "You've got to pass it to see what's in it" - (Senators Perks & Tax Middle Class)pic.twitter.com/3gLkhWj6Ga";;@;#;"888495165349928960";https://twitter.com/TiaCarra/status/888495165349928960
Weishampel;2017-07-21 16:24;0;0;"Obamacare was without a doubt an improvement over the HC model at the time. Universal would be better but don't get it confused";;;;"888494990296567809";https://twitter.com/Weishampel/status/888494990296567809
TiaCarra;2017-07-21 16:24;0;0;"No matter how much # Democrats try to sugarcoat # Obamacare its a national disgrace, and failure.pic.twitter.com/8shifS7Qc8";;;# #;"888494914446675968";https://twitter.com/TiaCarra/status/888494914446675968
iam32Prosper;2017-07-21 16:23;0;0;"explain why congressionals coverage 10 times greater than the average tax payer. make aca congressionals health care coverage problem solved";;;;"888494556609630208";https://twitter.com/iam32Prosper/status/888494556609630208
TiaCarra;2017-07-21 16:22;0;0;"@ Democrats are responsible for # Obamacare quagmire, Pelosi "You've got to pass it to see what's in it" - (Senators Perks & Tax Middle Class)";;@;#;"888494308524826624";https://twitter.com/TiaCarra/status/888494308524826624
TiaCarra;2017-07-21 16:21;0;0;"@ Democrats are responsible for # Obamacare quagmire, Pelosi "You've got to pass it to see what's in it" - (Senators Perks & Tax Middle Class)";;@;#;"888494151787880448";https://twitter.com/TiaCarra/status/888494151787880448
Weishampel;2017-07-21 16:18;1;1;"Many are, but if even a handful of Dem senators were acting like Bernie and pushing for Medicare for all, that would be far better";;;;"888493298117091328";https://twitter.com/Weishampel/status/888493298117091328
Weishampel;2017-07-21 16:12;0;0;"Durbin doesn't, https://www.durbin.senate.gov/issues/health-care …";;;;"888491949639868422";https://twitter.com/Weishampel/status/888491949639868422
Kristoff_C_Kent;2017-07-21 16:03;0;0;"Should government provide healthcare in the first place?";;;;"888489665694543872";https://twitter.com/Kristoff_C_Kent/status/888489665694543872
kitzkatz72;2017-07-21 15:33;0;0;"You don't have to be American to see this is about Obama's legacy ACA! They are hurting people with each bill & they don't care if they die!";;;;"888482085752721408";https://twitter.com/kitzkatz72/status/888482085752721408
Weishampel;2017-07-21 15:31;2;6;"When are you going to face the number left uninsured under Obamacare? Do you agree the number should be 0?";;;;"888481659917676545";https://twitter.com/Weishampel/status/888481659917676545
mikemwallace;2017-07-21 15:30;0;0;"Dick, what will happen to medical care for war torn Chicago if Obamacare is repealed? Do not be a Dick.";;;;"888481327900745729";https://twitter.com/mikemwallace/status/888481327900745729
SenatorDurbin;2017-07-21 15:27;796;1084;"Republicans rip health care away from: bill 1: 24 million bill 2: 23 million bill 3: 22 million bill 4: 32 million bill 5: 22 millionhttps://twitter.com/nprpolitics/status/888157859652935681 …";;;;"888480583789182977";https://twitter.com/SenatorDurbin/status/888480583789182977
schasslerpl;2017-07-21 15:02;0;0;"Universal healthcare ! Healthcare isn't an entitlement.... large profits for big pharma and insurance companies are";;;;"888474389179768832";https://twitter.com/schasslerpl/status/888474389179768832
vernfiftyone;2017-07-21 14:20;0;0;"Dear Dick let's scrap Obamacare & go to the free market with no Gov interference. We can do better ourselves w/o all the mandates of O'care.pic.twitter.com/dolxTsw8Nm";;;;"888463753263685632";https://twitter.com/vernfiftyone/status/888463753263685632
kinescopeman;2017-07-21 14:06;0;0;"The Putin wannabe whose scared # TrumpRussia will reveal his finances Is saying the States have something to hide The FRAUD is the Commission";;;#;"888460268858089472";https://twitter.com/kinescopeman/status/888460268858089472
bearguy51p;2017-07-21 13:01;0;0;"I feel for you. Tell me, what do you see in Trumpcare (or total repeal ) that will make things better for you?";;;;"888443746244841473";https://twitter.com/bearguy51p/status/888443746244841473
tcsorr;2017-07-21 12:54;0;0;"Our family premiums are up 350%, our deductible went from 5K to 14 and we lost our doctor! Can't afford more @ TheDemocrats health care help";;@;;"888442166237900801";https://twitter.com/tcsorr/status/888442166237900801
SEIUhciimk;2017-07-21 12:47;2;0;". @ GovRauner says he expressed concern to IL Cong Delegation, but @ SenatorDurbin sent 4 letters about healthcare and got no response.";;@ @;;"888440230126247936";https://twitter.com/SEIUhciimk/status/888440230126247936
tcsorr;2017-07-21 12:23;0;1;"Dickie, Haven't the @ TheDemocrats done enough damage to our health care system?";;@;;"888434142656049154";https://twitter.com/tcsorr/status/888434142656049154
WindyCityFunk;2017-07-21 12:21;0;1;"To all the Advocates We stand for Families We will Not Stop Fighting for Families and Let Obamacare Fail";;;;"888433770482814976";https://twitter.com/WindyCityFunk/status/888433770482814976
JHahnsberg;2017-07-21 12:20;0;0;"The cost of not working together is senseless & exponentially greater than strategy of standing by and watching our health care system fail.";;;;"888433519785017344";https://twitter.com/JHahnsberg/status/888433519785017344
wiwa1953;2017-07-21 12:17;0;0;"My thoughts on that senator are that they really don't want to supply health care at all.That this was a planned attempt to destroy it 4 All";;;;"888432725094543362";https://twitter.com/wiwa1953/status/888432725094543362
WindyCityFunk;2017-07-21 12:15;0;1;"We need To work to Fix Obamacare";;;;"888432155092766724";https://twitter.com/WindyCityFunk/status/888432155092766724
MichelleBirnbau;2017-07-21 12:14;0;0;"It is simple they just don't care about the American people";;;;"888432106413727744";https://twitter.com/MichelleBirnbau/status/888432106413727744
SenatorDurbin;2017-07-21 12:13;586;574;"Don’t understand why @ SenateGOP wants to repeal & run — we should work together to strengthen our health care system. Retweet if you agree.pic.twitter.com/6YUHnzswCd";;@;;"888431694595973122";https://twitter.com/SenatorDurbin/status/888431694595973122
Seeleyfan;2017-07-21 12:09;0;0;"Except the 20+ million Americans who now have healthcare coverage, including some of my family.";;;;"888430684578164737";https://twitter.com/Seeleyfan/status/888430684578164737
ZooL5150;2017-07-21 11:50;0;0;". @ SenRobPortman, abandon repeal. Reject the administration's # Obamacare sabotage, & let's find bipartisan solutions. Work w/ @ senatordurbin";;@ @;#;"888425953625616384";https://twitter.com/ZooL5150/status/888425953625616384
Meandmybelt;2017-07-21 11:34;0;0;"Stop acting like you didn't realize these people don't care about poor people. This is stupid. The law works for money and we all know it.";;;;"888421821263077382";https://twitter.com/Meandmybelt/status/888421821263077382
CathyCh51148231;2017-07-21 11:23;1;2;"Thank you Senator Durbin for fighting to protect our health care!";;;;"888419109079310336";https://twitter.com/CathyCh51148231/status/888419109079310336
KristieAllen88;2017-07-21 11:23;4;47;"If you're interested in a conversation, don't divert. Repubs have yet to include Dems in any conversation about healthcare.";;;;"888419072421105664";https://twitter.com/KristieAllen88/status/888419072421105664
LEASH__WHITE;2017-07-21 11:16;0;0;"Thank you for doing your part in protecting us from unaffordable/unattainable health care @ TammyforIL and @ SenatorDurbin";;@ @;;"888417423896043520";https://twitter.com/LEASH__WHITE/status/888417423896043520
karlyncallahan;2017-07-21 10:59;0;0;"Good. Obamacare was forced on us. Is horrible and needs to go away. Govt should not be in our healthcare.";;;;"888413127993327616";https://twitter.com/karlyncallahan/status/888413127993327616
moostersfarm;2017-07-21 10:56;1;1;"@ Potus & @ GOP has made it IDONTCARE not healthcare or Obamacare. Please repair the ACA!";;@ @;;"888412289451339778";https://twitter.com/moostersfarm/status/888412289451339778
MooPersists;2017-07-21 10:35;19;27;"Punishing dissent? This must be yet another unprecedented move by a sitting *POTUS, destroying the people's healthcare to punish votes?";;;;"888407116456878085";https://twitter.com/MooPersists/status/888407116456878085
gtrich1;2017-07-21 10:27;0;0;"MORNING READ: Dick Durbin and party passed Obama Care & have cost tax payers millions of $ for a failed health care plan that nobody wanted";;;;"888404990104137728";https://twitter.com/gtrich1/status/888404990104137728
nearnormal20;2017-07-21 10:18;2;9;"A terrible time in history when the White House and @ GOP are on a mission to healthcare to enable tax cuts for wealthy. UnAmerican";;@;;"888402689570217984";https://twitter.com/nearnormal20/status/888402689570217984
vernfiftyone;2017-07-21 10:12;0;0;"Dear Dick false accusation. Gov needs to get out of private insurance market. Obamacare not healthcare & not insurance!";;;;"888401364484837376";https://twitter.com/vernfiftyone/status/888401364484837376
quingoings;2017-07-21 10:11;0;0;"WTF are you talking about? You applaud Trump sabotaging the healthcare people rely on??";;;;"888400953988329473";https://twitter.com/quingoings/status/888400953988329473
quingoings;2017-07-21 10:09;0;0;"Trump is sabotaging the American people! Perhaps someone will sue on behalf of Americans who depend upon healthcare...";;;;"888400429901635584";https://twitter.com/quingoings/status/888400429901635584
MicheleN1L;2017-07-21 10:06;1;5;"Obstruction of healthcare and then lie and say "Obamacare is failing" he's a hateful SOB and will pay BIGLY! # 25thAmendmentNow";;;#;"888399693285347329";https://twitter.com/MicheleN1L/status/888399693285347329
goodtime4all696;2017-07-21 10:05;0;0;"Trump won on the promise to repeal Obamacare. As Obama said, elections have consequences. Too bad the spineless Republicans will not pass it";;;;"888399460975431681";https://twitter.com/goodtime4all696/status/888399460975431681
chriswyoillini;2017-07-21 10:03;0;1;"Please be honest # Obamacare designed to fail so you could force single payer down our throats. You were half successful.";;;#;"888399022381297664";https://twitter.com/chriswyoillini/status/888399022381297664
goodtime4all696;2017-07-21 10:02;0;0;"You helped pass it, you own Obamacare. Don't be trying to blame Trump. He was elected after running on repealpic.twitter.com/v60TbrezhX";;;;"888398720672387072";https://twitter.com/goodtime4all696/status/888398720672387072
CitizenChump;2017-07-21 09:58;1;1;"Sorry you & every democrat who voted 4 Obamacare own this! You designed bill 2 fail so U could usher in single payor. Man up and tell truth!pic.twitter.com/rZNfNFU9kO";;;;"888397678383702020";https://twitter.com/CitizenChump/status/888397678383702020
SenatorDurbin;2017-07-21 09:55;3394;3447;"MORNING READ: "It's not letting the law fail, it's making the law fail." @ POTUS sabotaging health care—turning his back on American familieshttps://twitter.com/CrainsChicago/status/888118528292773902 …";;@;;"888397062093459457";https://twitter.com/SenatorDurbin/status/888397062093459457
usaforamericans;2017-07-21 03:12;0;0;"Repeal the unconstitutional forced health care! SCOTUS knows!";;;;"888295714962329605";https://twitter.com/usaforamericans/status/888295714962329605
V_Lady_V_;2017-07-21 00:20;0;5;"A RATIONAL one that will function at this day & age. We need to take care of our country. Letting in illegals just keeps putting us in debt";;;;"888252196386611201";https://twitter.com/V_Lady_V_/status/888252196386611201
GaryIdeatechv4;2017-07-21 00:04;0;0;"And what were you playing when you allowed a crap plan called Obamacare make the problem even worse for us. Quit acting like you care";;;;"888248239446675457";https://twitter.com/GaryIdeatechv4/status/888248239446675457
brainmechpa;2017-07-21 00:03;0;0;"And I don't care what you do with your butt.";;;;"888248128318701568";https://twitter.com/brainmechpa/status/888248128318701568
DNFine53;2017-07-20 23:51;0;0;"@ POTUS is withholding payments, yes, and there's this from sneaky Marco Rubio and friends, back in 2014:https://www.nytimes.com/2015/12/10/us/politics/marco-rubio-obamacare-affordable-care-act.html …";;@;;"888244950659411968";https://twitter.com/DNFine53/status/888244950659411968
LynnInTheHouse1;2017-07-20 23:49;0;0;"@ SenatorDurbin @ SenDuckworth Notice everything Raja is doing to protect democracy & fight Trump's corruption? What are you doing? I'm scaredhttps://twitter.com/LynnInTheHouse1/status/888242462220857344 …";;@ @;;"888244442687262721";https://twitter.com/LynnInTheHouse1/status/888244442687262721
jimmy_two_hands;2017-07-20 23:38;0;0;"That's news to the Medicare program and the Medicaid program and the VA";;;;"888241808223981568";https://twitter.com/jimmy_two_hands/status/888241808223981568
Hank75394538;2017-07-20 23:32;0;0;"If u keep obummercare u won't be able to get insurance at any price.....";;;;"888240122755375105";https://twitter.com/Hank75394538/status/888240122755375105
sid87Jr88;2017-07-20 22:16;0;1;"PLEASE explain $2400 thanks to Barry $11,000 why don't we get luxury health care like you # ObamaCareFailedMe @ POTUS @NancyPelosi @ tedlieupic.twitter.com/qMkvlZ6DaE";;@ @NancyPelosi @;#;"888221222676430848";https://twitter.com/sid87Jr88/status/888221222676430848
2scoopsCam;2017-07-20 22:10;0;0;"It sounds to me as if you're playing politics. @ POTUS wants this to be taken care of asap.";;@;;"888219662588289024";https://twitter.com/2scoopsCam/status/888219662588289024
tetxnu84967;2017-07-20 21:56;0;1;"@ Politco At least someone is! No one wants or can afford that healthcare-costs way too much and it covers nothing-Repeal it please!";;@;;"888216063615406080";https://twitter.com/tetxnu84967/status/888216063615406080
ColtsFan254;2017-07-20 21:55;0;0;"Healthcare and education are not enumerated rights of the federal government and are under state authourity. Butt out.";;;;"888215917473222657";https://twitter.com/ColtsFan254/status/888215917473222657
Dcoxboomer;2017-07-20 21:19;0;0;"It's Obamacare that's beyond repair.";;;;"888206760452001792";https://twitter.com/Dcoxboomer/status/888206760452001792
ColtsFan254;2017-07-20 21:02;1;1;"The federal government has zero authourity to spend money in health care.";;;;"888202431770841092";https://twitter.com/ColtsFan254/status/888202431770841092
ColtsFan254;2017-07-20 20:59;0;0;"Senator get out of my healthcare decisions. Americans want freedom not socialism.";;;;"888201788817637378";https://twitter.com/ColtsFan254/status/888201788817637378
luckyone6565;2017-07-20 20:41;1;2;"# GodBless & Thank God...... take care my friend, stay free!";;;#;"888197281077489665";https://twitter.com/luckyone6565/status/888197281077489665
dmasc;2017-07-20 20:32;0;0;"Or:can't keep your doc or your insurance,can't afford premiums,are fined if you don't need/want Obamacare. Nice!";;;;"888194858145374209";https://twitter.com/dmasc/status/888194858145374209
DebbieM47927655;2017-07-20 20:17;0;0;"Am from IL. Thanks for your continued leadership in protecting our healthcare. Keep up this critical work. # RESIST";;;#;"888191160388399104";https://twitter.com/DebbieM47927655/status/888191160388399104
DrYForCongress;2017-07-20 20:02;2;2;"With All Due Respect, # SenatorDurbin has # NOCLUEAboutHealthcare! # DurbinHasToGo! # PoliticalSpendthrift # DurbinHurtMiddleClass @ POTUS @ VPhttps://twitter.com/SenatorDurbin/status/888141658986094592 …";;@ @;# # # # #;"888187296197038080";https://twitter.com/DrYForCongress/status/888187296197038080
USAconsitution;2017-07-20 19:03;0;0;"How long will it take for # Obamacare to finish imploring?";;;#;"888172606465208321";https://twitter.com/USAconsitution/status/888172606465208321
chriswyoillini;2017-07-20 18:31;0;0;"Everybody that has health insurance pays taxes under # Obamacare please be honest enough to agree with that. # RepealObamacare tax cut 4 all.";;;# #;"888164363424714756";https://twitter.com/chriswyoillini/status/888164363424714756
DJBartosz;2017-07-20 18:24;2;4;"Hey...fellas...Surprise! YOU MADE THE MESS. Never ending war, massive debt, sky high taxes/healthcare, massive intrusive govt. etc. FIX IT!!";;;;"888162694246916098";https://twitter.com/DJBartosz/status/888162694246916098
MYHDSpringer;2017-07-20 18:12;1;2;"Make healthcare universal in America";;;;"888159665581940741";https://twitter.com/MYHDSpringer/status/888159665581940741
diana_deeoc64;2017-07-20 17:20;0;0;"Please do not allow a vote on a straight repeal!!! We need much work to be done in Health care. This is not the plan!";;;;"888146577214377984";https://twitter.com/diana_deeoc64/status/888146577214377984
riefsnyder;2017-07-20 17:18;0;1;"Ummm, the fact that we stopped him from destroying our healthcare and leaving millions of kids wo ins. That's what!";;;;"888146061629501440";https://twitter.com/riefsnyder/status/888146061629501440
OhSusieCue;2017-07-20 17:15;0;0;"As they should, they're citizens! I'm sorry, many do not get financial aid, work or better healthcare. You're very ignorant.";;;;"888145443502268418";https://twitter.com/OhSusieCue/status/888145443502268418
mmt98;2017-07-20 17:07;0;0;"What abt coming together 4 @ SenJohnMcCain on health care? He has shown us the way to bipartisanship @ SenatorDurbin @ SenWarren @ SenSchumer ?";;@ @ @ @;;"888143266117558272";https://twitter.com/mmt98/status/888143266117558272
SenatorDurbin;2017-07-20 17:00;23;97;"Talked health care and other issues important to Illinoisans at today’s Constituent Coffee with @ SenDuckworth.pic.twitter.com/2CNL2j3r2G";;@;;"888141658986094592";https://twitter.com/SenatorDurbin/status/888141658986094592
LorieBorealis;2017-07-20 16:56;0;0;"Dems should have a bipartisan health care leg. meeting with 50 or so extra seats and invite GOP";;;;"888140509356580864";https://twitter.com/LorieBorealis/status/888140509356580864
joey_a_pino;2017-07-20 16:41;0;0;"We need solutions to fix Obamacare? Consider national taxes on goods that cause heath issues, such as tobacco, alcohol and corn syrup.";;;;"888136769144840192";https://twitter.com/joey_a_pino/status/888136769144840192
smallnsassy1;2017-07-20 16:31;0;0;"They're illegal, I could care less what they ALL are. They're ALL breaking immigration laws and feeeloading ILLEGALLY in my country";;;;"888134303766388736";https://twitter.com/smallnsassy1/status/888134303766388736
CaniceDeanna;2017-07-20 16:06;0;0;"I think trumpets next move is to move on to the tax cuts for the rich Gutting the budget leaving nothing for healthcare period";;;;"888127912565760000";https://twitter.com/CaniceDeanna/status/888127912565760000
DNFine53;2017-07-20 15:51;0;1;"Please tweet out your plan to # FixACA , Obamacare works, but markets have to be stabilized. Have to keep mandate and taxes. What else?";;;#;"888124164527104000";https://twitter.com/DNFine53/status/888124164527104000
goodtime4all696;2017-07-20 15:40;0;0;"Too bad you don't care about taxpayers and their dreams. Stealing tax dollars and giving them to Illegals makes it had for them";;;;"888121450036514818";https://twitter.com/goodtime4all696/status/888121450036514818
RBTRARYautocrat;2017-07-20 15:39;0;0;"And that doesn't include the Cruz, hope you don't really need care for that six month waiting period, Amendment. # ConservativeEliteAgenda";;;#;"888121257127849984";https://twitter.com/RBTRARYautocrat/status/888121257127849984
SenatorDurbin;2017-07-20 15:35;148;219;"New bill, same story: 22 million lose health care, premiums skyrocket for seniors, Medicaid slashed & billions in tax cuts for big business.https://twitter.com/AP_Politics/status/888072635476828161 …";;;;"888120192730935298";https://twitter.com/SenatorDurbin/status/888120192730935298
KimMBarnes2;2017-07-20 15:22;0;0;"Ok dreamers act us all well and good but we deserve good healthcare! That is what is important right now.";;;;"888116840039305219";https://twitter.com/KimMBarnes2/status/888116840039305219
sheralann;2017-07-20 15:20;0;2;"You know they were children when they were brought here. Oh I forgot no one cares about the children only fetuses";;;;"888116358742802432";https://twitter.com/sheralann/status/888116358742802432
SpencerLeeMarsh;2017-07-20 15:10;0;0;"When are our veterans going to be allowed the same CHOICE in the care they EARNED the rest of America enjoys?";;;;"888113884388667396";https://twitter.com/SpencerLeeMarsh/status/888113884388667396
FairClaire00;2017-07-20 15:00;5;19;"1000s of documented US Citizens and legal permanent residents talk about their challenges, concerns, and hopes. But nobody cares. Stop # H1B.";;;#;"888111504137928704";https://twitter.com/FairClaire00/status/888111504137928704
UsaPolitics16;2017-07-20 15:00;1;0;"Proven fact that socialized medicine has cost citizens more money # RepealObamacare # freemarket # capitalism http://investmentwatchblog.com/free-market-capitalism-not-government-control-makes-healthcare-more-affordable-researchers-discover/ …";;;# # #;"888111417307549696";https://twitter.com/UsaPolitics16/status/888111417307549696
JudgeJanna;2017-07-20 14:47;2;0;"What abt the dreams of actual Americans? What is with liberals that you care more abt illegals than Americans?";;;;"888108155107852288";https://twitter.com/JudgeJanna/status/888108155107852288
joegewe;2017-07-20 13:52;0;1;"Ofailurecare was conceived to fail, and you're deceitful to assume otherwise";;;;"888094180769021952";https://twitter.com/joegewe/status/888094180769021952
sotnak;2017-07-20 13:41;0;1;"False.https://www.theatlantic.com/politics/archive/2015/07/the-real-story-of-obamacares-birth/397742/ …";;;;"888091587598798852";https://twitter.com/sotnak/status/888091587598798852
rebeccahockridg;2017-07-20 13:33;0;2;"News flash!! They already have! Are you daft? We aren't fooled by your scare tactics FYI";;;;"888089562966360065";https://twitter.com/rebeccahockridg/status/888089562966360065
FeistyMonk;2017-07-20 13:33;0;0;"Maybe care more about our homeless children, families, and veterans instead. They deserve a fair shot also. Do you even care?";;;;"888089411757494272";https://twitter.com/FeistyMonk/status/888089411757494272
riefsnyder;2017-07-20 13:20;0;2;"WTG @ LindseyGrahamSC !! Keep up the great work, don't repeal Obamacare, cross party lines to get s***t done!! # proudsouthcarolinan";;@;#;"888086298719911936";https://twitter.com/riefsnyder/status/888086298719911936
Sueazizi;2017-07-20 13:19;0;0;"Dems who want to win in 2018 will get on board with Medicare for all.";;;;"888085969106198528";https://twitter.com/Sueazizi/status/888085969106198528
UsaPolitics16;2017-07-20 13:18;2;2;"That is a complete lie and you know it. The free market would open and healthcare prices would decrease # RepealObamacare";;;#;"888085653254279170";https://twitter.com/UsaPolitics16/status/888085653254279170
Tina5545Tina;2017-07-20 13:16;0;0;"I wish they cared they don't. They only care about repealing something that may not be perfect but it is working";;;;"888085285698813952";https://twitter.com/Tina5545Tina/status/888085285698813952
pcaclubracer;2017-07-20 13:15;0;0;"Obamacare was and is a failure of the democrats. Own it Dick. Own it.";;;;"888085048234303488";https://twitter.com/pcaclubracer/status/888085048234303488
occupy_reason;2017-07-20 13:10;0;0;"So 100% increase in 9 years vs the 100% increase in 2 years under Obamacare? Sounds like a much better deal.";;;;"888083614830931968";https://twitter.com/occupy_reason/status/888083614830931968
Resist501;2017-07-20 13:03;0;0;"Dreamers have a better chance of pursuing the American dream when they aren't worried about their health, and having proper health care!!!";;;;"888081938933796864";https://twitter.com/Resist501/status/888081938933796864
AlientoAZ;2017-07-20 13:02;0;0;""We are trying to take care of the dreamers and border security" - @ SenatorDurbin # dreamact # dream2017 # dreamact2017";;@;# # #;"888081713112334336";https://twitter.com/AlientoAZ/status/888081713112334336
EdIra4;2017-07-20 12:56;0;0;"You want public option, go get VA care";;;;"888080232237985793";https://twitter.com/EdIra4/status/888080232237985793
CitizenActionIL;2017-07-20 12:53;7;7;"Who is @ GovRauner expressing his "concerns" about health care to? Not @ SenatorDurbin or @ SenDuckworth. STMT here:http://www.citizenaction-il.org/node/497";;@ @ @;;"888079381083676672";https://twitter.com/CitizenActionIL/status/888079381083676672
edutinker;2017-07-20 12:26;0;0;"We would like both healthcare and education and at minimum a strong public option for both, please and thank you.";;;;"888072618028519425";https://twitter.com/edutinker/status/888072618028519425
SenDuckworth;2017-07-20 12:08;32;151;"Joined @ SenatorDurbin at this morning’s Constituent Coffee to hear from Illinoisans on healthcare, education & other key issues pic.twitter.com/UtsRWRkoGz";;@;;"888068022170267648";https://twitter.com/SenDuckworth/status/888068022170267648
vernfiftyone;2017-07-20 12:01;0;0;"Dear Dick you Dems gave us Obamacare. You own it. You can't blame insurance conditions on anyone else. Obamacare has failed!pic.twitter.com/TiP977Jsi6";;;;"888066384944664576";https://twitter.com/vernfiftyone/status/888066384944664576
