frankh511;2017-07-10 16:52;0;0;"@ SenateMajLdr @ CoryBooker @ SenatorMenendez and @ SpeakerRyan time to get busy # RepealAndReplace # Obamacare";;@ @ @ @;# #;"884515600273473537";https://twitter.com/frankh511/status/884515600273473537
ETERNALCOACHMAN;2017-07-10 12:29;0;0;"@ SenatorMenendez Please support Republican attempts to do anything on healthcare. A constituent";;@;;"884449444204359680";https://twitter.com/ETERNALCOACHMAN/status/884449444204359680
maryjcharlton;2017-07-09 16:48;0;0;"Bob, stop pretending you care about NJ U have demonstrated u only care about yourself & wealthy friends # KnockItOff # VoteBobOut # Corruption";;;# # #;"884152348981035009";https://twitter.com/maryjcharlton/status/884152348981035009
lodellnj;2017-07-09 11:34;0;0;"@ SenatorMenendez Universal Healthcare. NOW!";;@;;"884073175893585921";https://twitter.com/lodellnj/status/884073175893585921
NewIndianSummer;2017-07-09 01:06;0;0;"Trump only cares about making $$$ for himself, kids and cronies. Screw Mother Earth and screw American people. Destroy the planet to make $$";;;;"883915347702763520";https://twitter.com/NewIndianSummer/status/883915347702763520
hillires2017;2017-07-08 22:35;0;0;"Graft by controlling which Nonprofits get healthcare funds. Stopping addiction is not a goal, it's increasing with their help. Prescribed by";;;;"883877124008005632";https://twitter.com/hillires2017/status/883877124008005632
shinyilin;2017-07-08 04:04;0;0;"Now, legislators want to further endanger maternal care in Obamacare repeal? This IS an essential benefit! @ CoryBooker @ SenatorMenendez/4";;@ @;;"883597689023287296";https://twitter.com/shinyilin/status/883597689023287296
zannhar;2017-07-07 21:48;0;0;"No... when obamacare is repealed ppl can afford their own insurance with private companies..";;;;"883502945588977664";https://twitter.com/zannhar/status/883502945588977664
NJHospitals;2017-07-07 18:10;1;1;"NJHA's Betsy Ryan, @ englewoodhosp ED Chief Hillary Cohen, @ SenatorMenendez & @ BillPascrell talked # BCRA & access to care concernspic.twitter.com/a0Dew4OnXk";;@ @ @;#;"883448085975793664";https://twitter.com/NJHospitals/status/883448085975793664
BJaminFrank;2017-07-07 17:41;0;0;"Even some Republican Governors are protesting again tRumpcare.";;;;"883440946528088065";https://twitter.com/BJaminFrank/status/883440946528088065
maryjcharlton;2017-07-07 17:00;0;0;"All NJ kids are insured by NJ kids care Paid for by taxpayers NOT Medicare";;;;"883430429096910848";https://twitter.com/maryjcharlton/status/883430429096910848
maysoonzayid;2017-07-07 14:15;2;2;"# notrumpcare @SenBookerOffice @ SenatorMenendez https://twitter.com/JStein_Vox/status/883032319136849920 …";;@SenBookerOffice @;#;"883389063146778624";https://twitter.com/maysoonzayid/status/883389063146778624
fragglerock313;2017-07-07 10:43;0;0;"Obamacare has no options! You Senators are absolutely useless! Not sure you can microwave a meal! Disgusting pathetic";;;;"883335769850617856";https://twitter.com/fragglerock313/status/883335769850617856
kevinopperman1;2017-07-07 10:16;0;0;"Support Ted Cruz bill, leaves Obama care in place, and allows we who are not on Medicare to pick our own plan seems fair enough to me";;;;"883328783134208001";https://twitter.com/kevinopperman1/status/883328783134208001
dyavorsk;2017-07-07 10:08;0;0;". @ RepLanceNJ7 .@SenBookerOffice . @ SenatorMenendez OPPOSE Ozone Standards Implementation Act S263/HR806. Air quality affects healthcare costs";;@ @SenBookerOffice @;;"883326936537329665";https://twitter.com/dyavorsk/status/883326936537329665
jamiebclarke;2017-07-07 09:22;0;0;"There's a third option, # Trumpcare is abominable. # ACA is working!";;;# #;"883315272710574080";https://twitter.com/jamiebclarke/status/883315272710574080
HandsOffNJ;2017-07-07 09:14;2;4;"Hands Off Healthcare NJ thanks @ SenatorMenendez and Senator @ CoryBooker @SenBookerOffice for your support & protecting @ HorizonBCBSNJ 3.8m!https://twitter.com/DJohnstonX/status/883312619263754241 …";;@ @ @SenBookerOffice @;;"883313335126687744";https://twitter.com/HandsOffNJ/status/883313335126687744
DJohnstonX;2017-07-07 09:11;0;2;"Thank you @ NJWFA for call w/ @ SenatorMenendez & Senator @ CoryBooker @ Analilia_Mejia heard great update + HOPE for healthcare! # Resistpic.twitter.com/CyB1vXIz06";;@ @ @ @;#;"883312619263754241";https://twitter.com/DJohnstonX/status/883312619263754241
VinceForNJ;2017-07-07 01:05;0;3;"We fight the # opioidcrisis at the source... # BigPharma. They caused this, and they should fund the care needed. https://www.drugabuse.gov/drugs-abuse/opioids/opioid-crisis …";;;# #;"883190298024783876";https://twitter.com/VinceForNJ/status/883190298024783876
maryjcharlton;2017-07-06 23:42;0;0;"You did not read the current Obama bill Stop pretending you care about NJians You are out of touch # Corruption # VoteBobOut";;;# #;"883169438392090624";https://twitter.com/maryjcharlton/status/883169438392090624
NurseRNKimberly;2017-07-06 23:39;1;1;"Only option any of us have..you want to change Obamacare then come up with a plan for all levels of ppl, all income. Do that first !!!";;;;"883168585379663880";https://twitter.com/NurseRNKimberly/status/883168585379663880
SenatorMenendez;2017-07-06 22:15;151;237;"In the middle of an # opioidcrisis, Republicans # HealthcareBill robs NJ of vital funding to fight # OpioidEpidemic.http://www.northjersey.com/story/news/2017/07/06/addiction-treatment-jeopardy-if-senate-health-bill-passes-nj-dems-say/454813001/ …";;;# # #;"883147491729969152";https://twitter.com/SenatorMenendez/status/883147491729969152
IanGard742017;2017-07-06 20:03;0;0;"Health care now sucks, democrats didn't involve any Republicans to help draft the bill. So what makes you think what they propose is worst.";;;;"883114261442043904";https://twitter.com/IanGard742017/status/883114261442043904
TerriGeiger;2017-07-06 19:48;0;0;"Please, Sir, refer to the legislation not the party. The partisan rhetoric is exhausting. AHCA is abysmal and harms the healthcare system";;;;"883110365814509568";https://twitter.com/TerriGeiger/status/883110365814509568
fragglerock313;2017-07-06 19:24;0;0;"Obamacare is a laughing stock! The only world superpower & cant get nothing done! You are all a embarrassment";;;;"883104320971059200";https://twitter.com/fragglerock313/status/883104320971059200
NJ08forProgress;2017-07-06 19:17;0;0;"Thnx @ WorkingFamilies @ CoryBooker & @ SenatorMenendez for leadership How can those who live in Dem-led districts influence GOP on # Healthcare";;@ @ @;#;"883102572625702913";https://twitter.com/NJ08forProgress/status/883102572625702913
mdeschpac;2017-07-06 19:16;0;0;"if it's too much to ask for to stop whining about a perfectly good health care plan";;;;"883102460512018437";https://twitter.com/mdeschpac/status/883102460512018437
NJ08forProgress;2017-07-06 19:05;0;0;"@ WorkingFamilies @ CoryBooker @ SenatorMenendez If we live in an all-Dem district like # NJ08 how can we influence GOP to protect # healthcare?>";;@ @ @;# #;"883099640408801280";https://twitter.com/NJ08forProgress/status/883099640408801280
thomas_chips;2017-07-06 19:01;0;1;"Keep ACA and fix it!!..if u don't save our healthcare & our budget ur OUT!!..at this point I'm not pleased with the past of u or booker!!";;;;"883098693464977409";https://twitter.com/thomas_chips/status/883098693464977409
LvilleGal1;2017-07-06 19:01;0;1;"Here's a good opinion piece on the Cruz amendment and GOP bill in general.http://www.latimes.com/opinion/opinion-la/la-ol-cruz-health-amendment-trumpcare-20170706-story.html …";;;;"883098570743853057";https://twitter.com/LvilleGal1/status/883098570743853057
flabbitbash;2017-07-06 18:01;0;0;"@ realDonaldTrump @ marcorubio @ SenatorMenendez @ RosLehtinen @ nikkihaley Time to move in Venezuela! Incarerate Maduro Cabello, @ tarekpsuv";;@ @ @ @ @ @;;"883083464341368832";https://twitter.com/flabbitbash/status/883083464341368832
SenatorMenendez;2017-07-06 17:42;28;58;"Republicans still want to say their # HealthcareBill is about giving ppl choices. But only options NJ will have are either bad or terriblepic.twitter.com/6Dw8Zc03ZP";;;#;"883078623342755840";https://twitter.com/SenatorMenendez/status/883078623342755840
SenatorMenendez;2017-07-06 17:30;35;82;"Before we can make our healthcare system better, we must stop Republicans in DC from making it worse. # VoteNo # BCRA # HealthcareBillpic.twitter.com/Rw0a9sXu4l";;;# # #;"883075758461267973";https://twitter.com/SenatorMenendez/status/883075758461267973
NOSSCRNews;2017-07-06 14:30;3;4;"Thank you@CoryBooker @SenatorMenendez@BillPascrell@RepJoshG 4 fighting 2 protect the health care of low-income families &ppl w/disabilities. pic.twitter.com/rvpHvEfaaZ";;@CoryBooker @SenatorMenendez @BillPascrell @RepJoshG;;"883030382383386624";https://twitter.com/NOSSCRNews/status/883030382383386624
SchellDebra;2017-07-06 13:51;0;0;"Medicare is what I have been paying in all my life. So it's my money and people need help.";;;;"883020568118923265";https://twitter.com/SchellDebra/status/883020568118923265
VinceForNJ;2017-07-06 13:48;0;0;"Medicare/Medicaid pay for these drugs, and then pays for rehab when overprescribed...all paid for by the taxpayers. See the real issue here?";;;;"883019763479433216";https://twitter.com/VinceForNJ/status/883019763479433216
RealWorld_1;2017-07-06 13:34;0;0;"A LOT of people hooked and died on opiods in last 8 years. Hmmm. Seems like Obamacare had a 'devastating' impact on it. Plus, open borders";;;;"883016345679429632";https://twitter.com/RealWorld_1/status/883016345679429632
LibsHurtWomen;2017-07-06 13:20;0;0;"People take advantage of any free healthcare cycling in and out rehabs at $10,000 a trip. AS, NA and freewill costs everyone $0.";;;;"883012707666071552";https://twitter.com/LibsHurtWomen/status/883012707666071552
SenatorMenendez;2017-07-06 12:56;69;75;"GOP # HealthcareBill slashes NJ health funding by $28 billion. All while # opioidcrisis tears families apart. Completely counterproductive.pic.twitter.com/o8elDr717z";;;# #;"883006689812893696";https://twitter.com/SenatorMenendez/status/883006689812893696
SenatorMenendez;2017-07-06 12:53;7;12;"In 2015, 25 NJ'ans died every week from the # opioidcrisis. Yet GOP # HealthcareBill robs us of vital funding to fight this epidemicpic.twitter.com/1UlLyLk8gk";;;# #;"883005913635979264";https://twitter.com/SenatorMenendez/status/883005913635979264
SenatorMenendez;2017-07-06 12:41;19;38;"While # opioidcrisis tears families apart, GOP # HealthcareBill slashes NJ health funding by $28 billion. It's completely counterproductive.pic.twitter.com/3lGjPZonsB";;;# #;"883003015606788097";https://twitter.com/SenatorMenendez/status/883003015606788097
SenBooker;2017-07-06 12:36;51;155;". @ CoryBooker joins @ SenatorMenendez @ BillPascrell @ JoshGottheimer to discuss devastating impact of # Trumpcare on opioid crisis in NJpic.twitter.com/Bvz6bxFPea";;@ @ @ @;#;"883001689485303810";https://twitter.com/SenBooker/status/883001689485303810
FundacionEfrain;2017-07-06 12:03;0;0;"@ SenSasse @ SenDeanHeller @ CatherineForNV @ SenatorShaheen @ SenatorMenendez @SenBookerOffice STOP gerryrigging # Obamacare #PASS#HealthcareBill";;@ @ @ @ @ @SenBookerOffice;# #PASS #HealthcareBill;"882993308003430401";https://twitter.com/FundacionEfrain/status/882993308003430401
PT_US_Congress;2017-07-06 11:46;1;0;"RT @ NJHospitals: NJHA's Betsy Ryan, @ englewoodhosp ED Chief Hillary Cohen, @ SenatorMenendez & @ BillPascrell talking # BCRA & access to care…";;@ @ @ @;#;"882989218036842496";https://twitter.com/PT_US_Congress/status/882989218036842496
viphires;2017-07-06 11:43;0;0;"With actual healthcare providers?";;;;"882988375220690944";https://twitter.com/viphires/status/882988375220690944
LibsHurtWomen;2017-07-06 11:42;0;1;"Millions have been uninsured for years because of Obamacare. You haven't been there for us.";;;;"882988065291206656";https://twitter.com/LibsHurtWomen/status/882988065291206656
SenatorMenendez;2017-07-06 11:26;14;34;"Is it too much to ask that a # HealthcareBill actually improve health care? We're LIVE at Englewood Hospitals https://www.facebook.com/senatormenendez/videos/10155434280131358/ …";;;#;"882984113619296256";https://twitter.com/SenatorMenendez/status/882984113619296256
SenatorMenendez;2017-07-06 11:22;44;114;"# healthcarebill takes 22% of NJ funding 4 substance abuse & addiction! Rallying w @ CoryBooker @ BillPascrell @ JoshGottheimer @ SenatorLorettaWpic.twitter.com/19Gq5xhsAV";;@ @ @ @;#;"882983081560428545";https://twitter.com/SenatorMenendez/status/882983081560428545
SenatorMenendez;2017-07-06 11:09;16;17;"Republican # HealthcareBill Medicaid cuts are a disaster for opioid treatment. We must # SaveMedicaid & stop this bill. # SaveMedicaidSaveLivespic.twitter.com/njqUh7EKkG";;;# # #;"882979747948572672";https://twitter.com/SenatorMenendez/status/882979747948572672
NJHospitals;2017-07-06 11:02;16;17;"NJHA's Betsy Ryan, @ englewoodhosp ED Chief Hillary Cohen, @ SenatorMenendez & @ BillPascrell talking # BCRA & access to care concerns this a.m.pic.twitter.com/5xDYzKhr39";;@ @ @;#;"882978032960626688";https://twitter.com/NJHospitals/status/882978032960626688
SenatorMenendez;2017-07-06 11:00;14;25;"GOP # HealthcareBill robs NJ of vital funding to fight # opioidcrisis. Spking to doctors today on how we prevent addiction in the first placepic.twitter.com/nMV9g5DvFb";;;# #;"882977451315527680";https://twitter.com/SenatorMenendez/status/882977451315527680
zambezi13;2017-07-05 23:21;1;1;". @ SenatorMenendez # Trumpcare is disastrous & cruel. Vote No! pic.twitter.com/nSlvGrX7Tf # IStandWithPP";;@;# #;"882801637349367809";https://twitter.com/zambezi13/status/882801637349367809
zambezi13;2017-07-05 23:21;0;0;". @ CoryBooker @ SenatorMenendez # Trumpcare is disastrous & cruel. Vote No! pic.twitter.com/nSlvGrX7Tf # IStandWithPP";;@ @;# #;"882801566486540288";https://twitter.com/zambezi13/status/882801566486540288
LibsHurtWomen;2017-07-05 21:32;0;0;"The government will decide on your care and whether you live or die.";;;;"882774209172320256";https://twitter.com/LibsHurtWomen/status/882774209172320256
fearsforbeers;2017-07-05 20:40;0;0;"@ SenatorMenendez @ CoryBooker Medicare for all might be a winning message for dems in 2018 and beyond.https://twitter.com/QuinnipiacPoll/status/880151743484633089 …";;@ @;;"882761025413632000";https://twitter.com/fearsforbeers/status/882761025413632000
HelpSustain;2017-07-05 19:42;1;1;"As shocking as # NorthKorea's bomb test is, Rs shouldn't use that as a distraction fr thr # Trumpcare bill.";;;# #;"882746570395004929";https://twitter.com/HelpSustain/status/882746570395004929
LvilleGal1;2017-07-05 19:37;0;0;"Full report found here: http://www.urban.org/research/publication/state-state-coverage-and-government-spending-implications-better-care-reconciliation-act#.WVZnRng_ORA.twitter …";;;#;"882745258643251200";https://twitter.com/LvilleGal1/status/882745258643251200
LvilleGal1;2017-07-05 19:26;0;1;". @ RepLanceNJ7 @ SenatorMenendez @SenBookerOffice NJ stands to lose in a VERY BIG WAY under the Senate healthcare bill. 2 all 3 MoCs: resist!! https://twitter.com/EdwinCBPP/status/882700650772963328 …";;@ @ @SenBookerOffice;;"882742398236991488";https://twitter.com/LvilleGal1/status/882742398236991488
ChangeSeats;2017-07-05 17:48;0;0;"RT @ SenatorMenendez: Republicans' healthcare repeal plan is # DelayedButNotDead. We need you to keep speaking out s… http://buff.ly/2ti5pbt";;@;#;"882717728146165761";https://twitter.com/ChangeSeats/status/882717728146165761
SenatorMenendez;2017-07-05 17:15;39;65;"Republicans' healthcare repeal plan is # DelayedButNotDead. We need you to keep speaking out so R's know you won't stand for their cruel billpic.twitter.com/9StXPbCx7i";;;#;"882709532056707072";https://twitter.com/SenatorMenendez/status/882709532056707072
sggpas;2017-07-05 15:38;0;1;"Or when ur insurer could go back thru ur files and find a minor condition, call it pre-existing and drop you in the middle of cancer care";;;;"882685095756353536";https://twitter.com/sggpas/status/882685095756353536
sggpas;2017-07-05 15:37;0;0;"Well rhe answer isnt what we had before, when we randomly chose 1/6 of the population & said no heakth care 4 u...";;;;"882684761365508096";https://twitter.com/sggpas/status/882684761365508096
sggpas;2017-07-05 15:32;0;1;"Sorry for some, but some of us have been helped much by O'care. So fix it! HOP doesn't care if u or I have access to health care";;;;"882683674617163776";https://twitter.com/sggpas/status/882683674617163776
MaryClaireMcG;2017-07-05 15:21;0;0;"@ SenatorMenendez Fight this terrible "healthcare" bill. Please. -a New Jersey constituent";;@;;"882680777892343808";https://twitter.com/MaryClaireMcG/status/882680777892343808
maryjcharlton;2017-07-05 15:18;0;0;"Not true! Stop the rhetoric Bob People can read the bill unlike U did when U passed Obamacare U also said we can keep out Drs # Shameful";;;#;"882680126709936128";https://twitter.com/maryjcharlton/status/882680126709936128
maryjcharlton;2017-07-05 15:08;0;0;"UR funny Bob U care less about middle class than anyone except @ CoryBooker Stop taking $ for Big Pharma & # CutSpending We need # TermLimits";;@;# #;"882677641060515841";https://twitter.com/maryjcharlton/status/882677641060515841
Thespaz17;2017-07-05 14:35;0;3;"Tell me how the Dems care about me? I'm a middle class, straight, white man with a job and family. Dems literally said i'm the problem.";;;;"882669185976868864";https://twitter.com/Thespaz17/status/882669185976868864
NaraMovak;2017-07-05 13:57;0;3;"NO to Trumpcare! The people of NJ are counting on you and @ CoryBooker. Do whatever it takes, we will support your actions.";;@;;"882659655176081408";https://twitter.com/NaraMovak/status/882659655176081408
FundacionEfrain;2017-07-05 13:54;0;0;"@ SenatorMenendez @SenBookerOffice @ MartinHeinrich @ SenatorTomUdall @ SenSchumer @SenTomTillis @ SenJohnHoeven End # Obamacare # 7yearsBadLuck";;@ @SenBookerOffice @ @ @ @SenTomTillis @;# #;"882659052559511552";https://twitter.com/FundacionEfrain/status/882659052559511552
IsraelKafka;2017-07-05 13:07;0;1;"Both. But neocon wars won't harm NJ population like Republican's wealth care plan would.";;;;"882647093239828480";https://twitter.com/IsraelKafka/status/882647093239828480
ChangeSeats;2017-07-05 12:54;0;0;"RT @ SenatorMenendez: Reminder that Senate GOP # HealthcareBill wld INCREASE premiums for middle class NJ'ans! And t… http://buff.ly/2sGe0pW";;@;#;"882643760466755584";https://twitter.com/ChangeSeats/status/882643760466755584
southjersy;2017-07-05 12:49;0;0;"Does this mean less of my tax $ are going to pay for some one else's health care and more of my $ can be used 4 my own healthcare? Good !!!";;;;"882642622342475777";https://twitter.com/southjersy/status/882642622342475777
Timster27;2017-07-05 12:39;0;0;"@ SenatorMenendez @SenBookerOffice No # Trumpcare Support # MedicareForAll # SinglePayerhttps://twitter.com/NJPolicy/status/882595188555866112 …";;@ @SenBookerOffice;# # #;"882639982011326464";https://twitter.com/Timster27/status/882639982011326464
OilFart1;2017-07-05 12:30;0;0;"You mean like what happened when Obamacare was hoisted upon all Americans";;;;"882637696514109440";https://twitter.com/OilFart1/status/882637696514109440
SenatorMenendez;2017-07-05 12:24;74;74;"Reminder that Senate GOP # HealthcareBill wld INCREASE premiums for middle class NJ'ans! And they'd be paying more for worse coverage...pic.twitter.com/wxl0aHEPDP";;;#;"882636297789198336";https://twitter.com/SenatorMenendez/status/882636297789198336
Singlepayer4NJ;2017-07-05 11:18;0;0;"Keep the pressure on-Urge # democraticparty senators to support # MedicareForAll!! https://actionnetwork.org/forms/pledge-to-take-action … @SenBookerOffice @ SenatorMenendez pic.twitter.com/RsVFee35R2";;@SenBookerOffice @;# #;"882619608808796161";https://twitter.com/Singlepayer4NJ/status/882619608808796161
glavenq;2017-07-05 08:35;0;0;"Just called both @SenBookerOffice & @ SenatorMenendez 2 encourage them not only 2 vote against # Trumpcare but lobby Rs 2do so 2. Every1-Call!";;@SenBookerOffice @;#;"882578592827179008";https://twitter.com/glavenq/status/882578592827179008
the_amphibian;2017-07-04 23:36;0;1;"Same. I hope we get more people to call about healthcare too. Good luck tomorrow!";;;;"882443154498228224";https://twitter.com/the_amphibian/status/882443154498228224
FundacionEfrain;2017-07-04 22:09;0;0;"# Patriots 4 # Healthcarebill R U @ SenDeanHeller @ CatherineForNV @ SenatorShaheen @ SenatorMenendez @SenBookerOffice @ MartinHeinrich @ SenSchumer";;@ @ @ @ @SenBookerOffice @ @;# #;"882421089141489665";https://twitter.com/FundacionEfrain/status/882421089141489665
AmandaE65207015;2017-07-04 20:52;0;0;"# SinglePayer # MedicareForAll";;;# #;"882401806424444929";https://twitter.com/AmandaE65207015/status/882401806424444929
FundacionEfrain;2017-07-04 13:49;0;0;"@ SenSasse @ SenDeanHeller @ CatherineForNV @ SenatorShaheen @ SenatorMenendez # HealthcareBill # DeclarationOfIndependence from # Obamacare";;@ @ @ @ @;# # #;"882295251918106624";https://twitter.com/FundacionEfrain/status/882295251918106624
PatrickDPoole;2017-07-04 12:04;0;2;"Happy # July4 to @ CoryBooker & @ SenatorMenendez Thank you for protecting my # healthcare. # NoAHCA # thiswasonlyround1";;@ @;# # # #;"882268990210535425";https://twitter.com/PatrickDPoole/status/882268990210535425
FundacionEfrain;2017-07-04 09:15;0;0;"@ CatherineForNV @ SenatorShaheen @ SenatorMenendez @SenBookerOffice @ MartinHeinrich @ SenatorTomUdall # HealthcareBill # American as # applepie";;@ @ @ @SenBookerOffice @ @;# # #;"882226443945730048";https://twitter.com/FundacionEfrain/status/882226443945730048
RussellAmigo;2017-07-03 21:05;0;0;"@ SenatorMenendez @SenBookerOffice WAR against America; Threaten BorderWall, Security, Healthcare, Stop Balance Budget @ seanhannity @ LouDobbs";;@ @SenBookerOffice @ @;;"882042747519066115";https://twitter.com/RussellAmigo/status/882042747519066115
CarolynSandidge;2017-07-03 17:25;0;0;"I'm all for every American receiving affordable healthcare without having to live in debt and or losing your home due to ill health.";;;;"881987283527680000";https://twitter.com/CarolynSandidge/status/881987283527680000
katecarozza;2017-07-03 17:24;0;1;"@USRepRodney @ SenatorMenendez @ CoryBooker @ nj11forchange We are worried re: health care & related jobs. This idea? # bipartisan answershttps://twitter.com/SenSanders/status/881882978061864960 …";;@USRepRodney @ @ @;#;"881987111854931968";https://twitter.com/katecarozza/status/881987111854931968
girliejeep;2017-07-03 16:38;0;0;"@ CoryBooker @ SenatorMenendez Thread re: Healthcare";;@ @;;"881975424192045057";https://twitter.com/girliejeep/status/881975424192045057
BeckyD918;2017-07-03 16:22;0;0;"I write my senators almost on a daily basis complaining about this. If they would fight to get fair healthcare rates the cost would go down.";;;;"881971483144331265";https://twitter.com/BeckyD918/status/881971483144331265
hasler_theresa;2017-07-03 14:22;0;1;"You hit the nail on the head. The life expectancy of Obamacare has fell flat on it's face the 10yrs are here";;;;"881941255311241216";https://twitter.com/hasler_theresa/status/881941255311241216
hasler_theresa;2017-07-03 14:13;0;0;"Because Obamacare is the worst ever. I have family members on it with a 6000.00 deductable. How is that affordable? Really!";;;;"881939011509661697";https://twitter.com/hasler_theresa/status/881939011509661697
EmmanuelUrhie;2017-07-03 14:08;0;0;"@ SenatorMenendez What r u doing 2 get EVRY1 2 create affordable health care plan 4 the poor, old, young, sick, & w/ pre-existing conditions?";;@;;"881937714249125888";https://twitter.com/EmmanuelUrhie/status/881937714249125888
hasler_theresa;2017-07-03 14:08;0;0;"We need everbody we can get to stand firm on getting us an affordable healthcare plan.";;;;"881937707739602944";https://twitter.com/hasler_theresa/status/881937707739602944
hasler_theresa;2017-07-03 14:04;0;0;"I agree with you. Whatever it takes to make healthcare affordable to all especially middle & poor class. We ard barely floating above water!";;;;"881936808656986112";https://twitter.com/hasler_theresa/status/881936808656986112
HADESLANDLORD;2017-07-03 13:41;0;0;"Bobby take care of the Santo Domingo teen girls health condition next time you go down there. You hypocritical preacher of lies.";;;;"881930975600619521";https://twitter.com/HADESLANDLORD/status/881930975600619521
VicSmith2011;2017-07-03 13:33;0;0;"Maybe your a federal employee that is getting the good health free care? Is that it?";;;;"881928947558232064";https://twitter.com/VicSmith2011/status/881928947558232064
VicSmith2011;2017-07-03 13:30;1;0;"Why are you soooo concerned the senators and representatives keep their free HC bought by Obama care? Not same as the peoples!";;;;"881928129115193345";https://twitter.com/VicSmith2011/status/881928129115193345
ChangeSeats;2017-07-03 13:12;0;0;"RT @ SenatorMenendez: Republicans' healthcare repeal plan is # DelayedButNotDead. We need you to keep speaking out s… http://buff.ly/2uD4eBn";;@;#;"881923533403824128";https://twitter.com/ChangeSeats/status/881923533403824128
ChewOnThis31;2017-07-03 12:57;0;0;"Dems only know how to lie when it comes to talking about Healthcare. Remember this?pic.twitter.com/4yKnEKmpqZ";;;;"881919900813578241";https://twitter.com/ChewOnThis31/status/881919900813578241
SenatorMenendez;2017-07-03 12:51;55;106;"Republicans' healthcare repeal plan is # DelayedButNotDead. We need you to keep speaking out so R's know you won't stand for their cruel billpic.twitter.com/PTYBX2QcoM";;;#;"881918245195980800";https://twitter.com/SenatorMenendez/status/881918245195980800
ChangeSeats;2017-07-03 12:42;0;0;"RT @ SenatorMenendez: # IHateToAskBut how is it Republicans think their # HealthcareBill bill is a good idea? http://buff.ly/2szdeLl";;@;# #;"881915945492590592";https://twitter.com/ChangeSeats/status/881915945492590592
