username;date;retweets;favorites;text;geo;mentions;hashtags;id;permalink
MC_Snitchy;2017-07-14 10:08;0;0;"pic.twitter.com/hXfTJO2DNz";;;;"885863496990240768";https://twitter.com/MC_Snitchy/status/885863496990240768
wolosky_debbie;2017-07-14 10:07;0;0;"We know this is a nightmare. What we don't know is how to stop it.";;;;"885863323945848833";https://twitter.com/wolosky_debbie/status/885863323945848833
SenatorMenendez;2017-07-14 10:06;34;52;"My friend @ ChrisCoons is right. The Cruz Amendment in new GOP bill guts consumer protections we fought so hard for. https://www.nytimes.com/2017/07/13/us/politics/senate-republican-health-care-bill.html?ref=todayspaper&_r=1 …pic.twitter.com/9XfaS4klE3";;@;;"885862980918927360";https://twitter.com/SenatorMenendez/status/885862980918927360
BlackFlagDE;2017-07-14 10:04;0;0;". @ UniteBlue . @ swingleft .@RepBRochester . @ ChrisCoons . @ SenatorCarper . @ EricaJong . @ Alyssa_Milano . @ ColinKahlhttps://twitter.com/kendilaniannbc/status/885595971572252672 …";;@ @ @RepBRochester @ @ @ @ @;;"885862588382359552";https://twitter.com/BlackFlagDE/status/885862588382359552
DavidWi94867995;2017-07-14 09:52;0;0;"Sir, do not vote for any bill which provides subsidies for healthcare. Not the federal governments responsibility!!!!!";;;;"885859582123405312";https://twitter.com/DavidWi94867995/status/885859582123405312
JazzLPcollector;2017-07-14 09:34;0;0;"@ SenFeinstein @ PatrickLeahy @ DickDurbin @ SenWhitehouse @ amyklobuchar @ SenFranken @ ChrisCoons @ SenBlumenthal http://www.philly.com/philly/columnists/will_bunch/the-key-to-the-trump-russia-scandal-follow-the-data-20170713.html …pic.twitter.com/uSvfDWgw6C";;@ @ @ @ @ @ @ @;;"885855123318099968";https://twitter.com/JazzLPcollector/status/885855123318099968
iva_burroughs;2017-07-14 08:58;0;0;"First rule of business....focus on RESOLVING the problem.";;;;"885845863003717632";https://twitter.com/iva_burroughs/status/885845863003717632
rokes52;2017-07-14 07:06;0;0;"I agree. Give concrete examples how it might improve to get skeptics on board.";;;;"885817891769266177";https://twitter.com/rokes52/status/885817891769266177
SecondContArmy;2017-07-14 07:00;0;0;"No, it's like allowing people to buy the car they want instead of making everyone buy passenger vans with lots of seats they will never use!";;;;"885816274399449090";https://twitter.com/SecondContArmy/status/885816274399449090
legaleagle574;2017-07-14 05:46;0;0;"Senate's revised so-called healthcare bill is a death warrant for the poor, elderly, and those w/ preexisting conditions. Do u support this?";;;;"885797570248937472";https://twitter.com/legaleagle574/status/885797570248937472
AnneSheldon;2017-07-14 03:26;0;0;"@ SenateDems @ SenFeinstein @ SenFranken @ ChrisCoons @ SenBlumenthal @ amyklobuchar @ DickDurbin How did this happen?https://twitter.com/realmuckmaker/status/885758952885170176 …";;@ @ @ @ @ @ @;;"885762420119146496";https://twitter.com/AnneSheldon/status/885762420119146496
VMVideos_com;2017-07-14 01:17;0;0;"Sen. Chris Coons take on White House under siege after Emails Bombshell. # ChrisCoons # Delaware - https://www.vm-videos.com/sen-chris-coons-take-on-white-house-under-siege-after-emails-bombshell-chriscoons-delaware_6af8e2122.html … # VMVideos";;;# # #;"885729883418009600";https://twitter.com/VMVideos_com/status/885729883418009600
VideoKron;2017-07-14 01:15;0;0;"Sen. Chris Coons take on White House under siege after Emails Bombshell. # ChrisCoons # Delaware - https://www.videokron.com/sen-chris-coons-take-on-white-house-under-siege-after-emails-bombshell-chriscoons-delaware_730d9805f.html …";;;# #;"885729493997953025";https://twitter.com/VideoKron/status/885729493997953025
AlburTube;2017-07-14 01:15;0;0;"Sen. Chris Coons take on White House under siege after Emails Bombshell. # ChrisCoons # Delaware: http://youtu.be/wbeXKPeZkB4?a  via @ YouTube";;@;# #;"885729323495206913";https://twitter.com/AlburTube/status/885729323495206913
gwendolbowling;2017-07-14 00:33;0;0;"EXCELLENCE!!! *<{]; D";;;;"885718763219279872";https://twitter.com/gwendolbowling/status/885718763219279872
mikenaiken45;2017-07-14 00:01;1;2;"We, the People were promised # FullRepeal! # KeepYourPromise # CongressDoYourJob Get the gov't. out of healthcare! # UnitedForFreedompic.twitter.com/tTeV1ilrk3";;;# # # #;"885710945900679168";https://twitter.com/mikenaiken45/status/885710945900679168
justask;2017-07-13 23:29;0;0;"Can you also make the 6 month window legislation for Medigap for SSDI null & void. We r sick and need time";;;;"885702812180590592";https://twitter.com/justask/status/885702812180590592
GallantStream;2017-07-13 23:09;0;0;"It's an outrage how Democrats attack the character of their opponents rather than argue the facts & issues. Always a non sequitur argument.";;;;"885697856606285825";https://twitter.com/GallantStream/status/885697856606285825
Johnep2266;2017-07-13 23:03;0;0;"I think he is doing well";;;;"885696301706489857";https://twitter.com/Johnep2266/status/885696301706489857
Johnep2266;2017-07-13 23:03;0;0;"I wish other democratic leaders displayed the class you do , our country would be much better off";;;;"885696147079213056";https://twitter.com/Johnep2266/status/885696147079213056
SandraMaz;2017-07-13 22:43;1;1;"Vote no on the Senate bill and work to improve existing health care.";;;;"885691163155550208";https://twitter.com/SandraMaz/status/885691163155550208
ACahMak;2017-07-13 22:30;0;0;"Vote NO on bills that undercut ESA, permanently delists wolves w/NO judicial review! @ ChrisCoons @ SenatorCarperpic.twitter.com/7Nx6ZoZYG7";;@ @;;"885687993696231426";https://twitter.com/ACahMak/status/885687993696231426
uriah1969;2017-07-13 22:12;0;0;"Senator,where was this rhetoric 2 the obama administration when they gave Iran billions of $.That was our best chance of Americans coming hm";;;;"885683343085285376";https://twitter.com/uriah1969/status/885683343085285376
SeaspiritEileen;2017-07-13 22:09;0;0;"Vote NO on bills that undercut ESA, permanently delists wolves w/NO judicial review! @ ChrisCoons @ SenatorCarperpic.twitter.com/NAGLXDl8y1";;@ @;;"885682740179464194";https://twitter.com/SeaspiritEileen/status/885682740179464194
socalscootergal;2017-07-13 22:04;0;0;"Really? @ SenFeinstein @ MarkWarner @ ChrisCoons @ SenBlumenthalhttps://twitter.com/politico/status/885680320913313793 …";;@ @ @ @;;"885681359569563648";https://twitter.com/socalscootergal/status/885681359569563648
SusieHaynie;2017-07-13 21:56;1;0;"Say NO to universal healthcare! NO to Marxism in the USA! Stand for the # FullRepeal as promised! Stand # UnitedForFreedom!";;;# #;"885679338733137920";https://twitter.com/SusieHaynie/status/885679338733137920
Bjsommer47;2017-07-13 21:47;0;0;"Your assessment of Trumpcare, your numbers and statistics are questionable. Your talent for critique is excessive. What are your solutions?";;;;"885677211344396288";https://twitter.com/Bjsommer47/status/885677211344396288
scruffdude;2017-07-13 21:47;0;0;"Good, now do you mean it? Maybe start with updating/adjusting the ACA. There are great parts like pre-existing condition coverage.";;;;"885677073754468353";https://twitter.com/scruffdude/status/885677073754468353
Bjsommer47;2017-07-13 21:33;0;0;"Be specific. Very swampy solution. Gator's are going to get you.";;;;"885673536593035264";https://twitter.com/Bjsommer47/status/885673536593035264
Bjsommer47;2017-07-13 21:31;0;0;"What are you fighting FOR?";;;;"885673132715114497";https://twitter.com/Bjsommer47/status/885673132715114497
Bjsommer47;2017-07-13 21:30;0;0;"What's your solution? Besides " wawawa!";;;;"885672867714781186";https://twitter.com/Bjsommer47/status/885672867714781186
esenteman;2017-07-13 21:29;0;0;"Vote NO on bills that undercut ESA, permanently delists wolves w/NO judicial review! @ ChrisCoons @ SenatorCarperpic.twitter.com/HzlaY4cop5";;@ @;;"885672594351026176";https://twitter.com/esenteman/status/885672594351026176
dfkenney7;2017-07-13 21:16;0;0;"Not funny lol";;;;"885669173623267333";https://twitter.com/dfkenney7/status/885669173623267333
dfkenney7;2017-07-13 21:14;0;1;"@ KatCapps Poor Analogy Senator. Their trying to sell us a car that doesn't run and expecting us to pay for it anyway";;@;;"885668852742279168";https://twitter.com/dfkenney7/status/885668852742279168
Eric21cent;2017-07-13 21:11;0;1;"@ RexDouglasStock Sssshhhhh! Don't give the GOP any ideas. # resist # resistance";;@;# #;"885667995091075074";https://twitter.com/Eric21cent/status/885667995091075074
Peeptweets420;2017-07-13 20:57;0;0;"Crippling how EXACTLY? On both counts. How big/small is your biz? Are you sure your Employees feel BCRA is better? Or just for you?";;;;"885664495829471232";https://twitter.com/Peeptweets420/status/885664495829471232
jandjm2;2017-07-13 20:43;0;0;"Please, please vote no on abominable bcra. I live in GA. Have crohns. This bill would destroy lives.";;;;"885660869903998976";https://twitter.com/jandjm2/status/885660869903998976
hurst_sohurst;2017-07-13 20:36;0;1;"You must be naive, he will not do anything to help President Trump. We elected you to assist Trump's policies.";;;;"885659318795849728";https://twitter.com/hurst_sohurst/status/885659318795849728
1MoralUniverse;2017-07-13 20:35;0;0;"Yes, but "access" and "choice" are what's important, so they say.";;;;"885659046962896896";https://twitter.com/1MoralUniverse/status/885659046962896896
JazzLPcollector;2017-07-13 20:31;0;0;"@ SenFeinstein @ PatrickLeahy @ DickDurbin @ SenWhitehouse @ amyklobuchar @ SenFranken @ ChrisCoons @ SenBlumenthal https://www.justsecurity.org/43009/media-questions-trump-jr-emails-meeting-russian-government-lawyer/ …pic.twitter.com/iiB5zlmMNU";;@ @ @ @ @ @ @ @;;"885657883651694592";https://twitter.com/JazzLPcollector/status/885657883651694592
ericdemamp;2017-07-13 20:29;0;0;"It's actually like buying Liability only if I don't need full coverage.";;;;"885657489617936384";https://twitter.com/ericdemamp/status/885657489617936384
jtwainright;2017-07-13 20:09;0;0;"What, should we continue to supplement healthcare the way the govt supplements Tesla cars @$10k a pop?";;@;;"885652492855517184";https://twitter.com/jtwainright/status/885652492855517184
greenleveen;2017-07-13 20:03;0;0;"read your email I sent on the Bloom Energy Bloomdoggle. Hope you find a good lawyer @ Tesla_X @ ChrisCoons @ SenatorCarper @ JohnCarneyDE";;@ @ @ @;;"885650907647442944";https://twitter.com/greenleveen/status/885650907647442944
PC_Ruffian;2017-07-13 19:34;0;0;"@ ChrisCoons Please pass a permanent net neutrality law! Protect citizens & eliminate T2 threat. https://cards.twitter.com/cards/kn0sh/4iq9v …";;@;;"885643523260899333";https://twitter.com/PC_Ruffian/status/885643523260899333
PeteClarkin;2017-07-13 19:33;0;1;"Or Fisker.";;;;"885643396861362176";https://twitter.com/PeteClarkin/status/885643396861362176
PeteClarkin;2017-07-13 19:33;0;0;"So Chevys basically";;;;"885643311960268801";https://twitter.com/PeteClarkin/status/885643311960268801
SuzJStein;2017-07-13 19:26;0;0;"@ ChrisCoons Support legislation to make net neutrality permanent & eliminate T2 threat to investment. https://cards.twitter.com/cards/kn0sh/4iq9q …";;@;;"885641577414234112";https://twitter.com/SuzJStein/status/885641577414234112
JazzLPcollector;2017-07-13 19:24;0;0;"@ SenFeinstein @ PatrickLeahy @ DickDurbin @ SenWhitehouse @ amyklobuchar @ SenFranken @ ChrisCoons @ SenBlumenthal https://www.propublica.org/article/marc-kasowitz-trump-lawyer-threat-emails-maddow …pic.twitter.com/BOhF5NEx9R";;@ @ @ @ @ @ @ @;;"885641095400407040";https://twitter.com/JazzLPcollector/status/885641095400407040
Margare04952873;2017-07-13 19:24;0;0;"Does anyone think that he will really tell the truth? Seriously?";;;;"885641042455920640";https://twitter.com/Margare04952873/status/885641042455920640
jnpeckenrode;2017-07-13 19:16;0;0;"I'd buy one of those vehicles today, if available";;;;"885639015457857539";https://twitter.com/jnpeckenrode/status/885639015457857539
mark_dillman;2017-07-13 19:14;0;0;"Why judiciary? What about intelligence committees?";;;;"885638635944419328";https://twitter.com/mark_dillman/status/885638635944419328
AnnPeretsky;2017-07-13 19:13;0;0;"Vote NO on bills that undercut ESA, permanently delists wolves w/NO judicial review! @ ChrisCoons @ SenatorCarperpic.twitter.com/DeckycbN7P";;@ @;;"885638294809214977";https://twitter.com/AnnPeretsky/status/885638294809214977
maurogp56;2017-07-13 19:11;0;0;"Universal healthcare for all";;;;"885637924062191616";https://twitter.com/maurogp56/status/885637924062191616
nikiconrad1982;2017-07-13 19:11;0;0;"Vote NO on bills that undercut ESA, permanently delists wolves w/NO judicial review! @ ChrisCoons @ SenatorCarperpic.twitter.com/ZJToLzX9j9";;@ @;;"885637873382244352";https://twitter.com/nikiconrad1982/status/885637873382244352
StevenMasterson;2017-07-13 18:58;0;0;"Opposing everything & offering nothing is n epic tragedy as well. Critiquing is one thing, just criticizing is shameful. # oneteamonedream";;;#;"885634507159851008";https://twitter.com/StevenMasterson/status/885634507159851008
historicallysam;2017-07-13 18:57;0;0;"@ ChrisCoons Please pass a permanent net neutrality law! Protect citizens & eliminate T2 threat. https://cards.twitter.com/cards/kn0sh/4iq9v …";;@;;"885634395922726912";https://twitter.com/historicallysam/status/885634395922726912
FlyerJl;2017-07-13 18:51;0;0;"@ ChrisCoons Support legislation to make net neutrality permanent & eliminate T2 threat to investment. https://cards.twitter.com/cards/kn0sh/4iq9u …";;@;;"885632774094413824";https://twitter.com/FlyerJl/status/885632774094413824
StevenMasterson;2017-07-13 18:48;0;2;"So what do you propose to make it better? I want to hear how you correct # Obamacare which is crippling my employees and business?";;;#;"885631990652973060";https://twitter.com/StevenMasterson/status/885631990652973060
countrygal21;2017-07-13 18:37;0;0;"@ ChrisCoons Cruz just won't quit with his ignorance!";;@;;"885629234559025152";https://twitter.com/countrygal21/status/885629234559025152
sharpetax;2017-07-13 18:36;1;1;"Shout out to Delaware. Good going. @ ChrisCoons @ SenatorCarper @ USAO_DEhttps://twitter.com/samswey/status/885627317241995264 …";;@ @ @;;"885628922817388545";https://twitter.com/sharpetax/status/885628922817388545
ConnieAThompson;2017-07-13 18:33;0;0;"You took time to vote for suppliers of oxygen & medical equipment so they don't close. Purdue didn't have time! You've been good to Ga";;;;"885628312327999489";https://twitter.com/ConnieAThompson/status/885628312327999489
sharpetax;2017-07-13 18:27;1;1;"@ ChrisCoons Support legislation to make net neutrality permanent & eliminate T2 threat to investment. https://cards.twitter.com/cards/kn0sh/4iq9u …";;@;;"885626682899673088";https://twitter.com/sharpetax/status/885626682899673088
Glodar66;2017-07-13 18:25;0;0;"@ ChrisCoons Support legislation to make net neutrality permanent & eliminate T2 threat to investment. https://cards.twitter.com/cards/kn0sh/4iq9q …";;@;;"885626194191929346";https://twitter.com/Glodar66/status/885626194191929346
phillysportsfan;2017-07-13 18:23;0;0;". @ ChrisCoons Please end sanctuary cities by supporting the House-passed H.R. 3003";;@;;"885625663461392385";https://twitter.com/phillysportsfan/status/885625663461392385
phillysportsfan;2017-07-13 18:20;0;0;". @ ChrisCoons, please do all you can to oppose # H-2B increases. These visas harm less-educated, lower-skilled # AmericanWorkers";;@;# #;"885625096391544834";https://twitter.com/phillysportsfan/status/885625096391544834
babygins;2017-07-13 18:19;0;0;"@ ChrisCoons Support legislation to make net neutrality permanent & eliminate T2 threat to investment. https://cards.twitter.com/cards/kn0sh/4iq9u …";;@;;"885624707688673280";https://twitter.com/babygins/status/885624707688673280
RobRich711;2017-07-13 18:15;0;0;"If Hillary was president the dems wouldn't work with you. Pull your head out of your butt";;;;"885623746605838336";https://twitter.com/RobRich711/status/885623746605838336
JuneFlavin;2017-07-13 18:07;0;0;"@ ChrisCoons Support legislation to make net neutrality permanent & eliminate T2 threat to investment. https://cards.twitter.com/cards/kn0sh/4iq9u …";;@;;"885621640629039104";https://twitter.com/JuneFlavin/status/885621640629039104
nonameatl;2017-07-13 18:03;1;1;"Please work across the aisle to dev a plan to HELP ppl, not just give tax cuts. We need healthcare NOT wealthcare";;;;"885620726983778304";https://twitter.com/nonameatl/status/885620726983778304
mikepatty41;2017-07-13 17:58;0;0;"We got all the airbags we could ever need with Dems like you. All air no action. Stop over dramatizing and do some real work.";;;;"885619372705894400";https://twitter.com/mikepatty41/status/885619372705894400
PlantPathSecret;2017-07-13 17:50;1;4;""Defending science starts with publicizing – not just publishing – the important work you do." - @ ChrisCoons # SciCommhttp://thehill.com/blogs/congress-blog/politics/341405-rd-is-essential-for-boosting-the-american-economy …";;@;#;"885617478470184961";https://twitter.com/PlantPathSecret/status/885617478470184961
NewarkFarmFresh;2017-07-13 17:47;0;0;"Thank you Senator Coons!";;;;"885616784044371968";https://twitter.com/NewarkFarmFresh/status/885616784044371968
rokes52;2017-07-13 17:46;0;0;"perfect analogy";;;;"885616363372515329";https://twitter.com/rokes52/status/885616363372515329
WalklateBarbara;2017-07-13 17:45;0;0;"Vote NO on bills that undercut ESA, permanently delists wolves w/NO judicial review! @ ChrisCoons @ SenatorCarperpic.twitter.com/zgncdSUdtG";;@ @;;"885616194614677504";https://twitter.com/WalklateBarbara/status/885616194614677504
amBackoff;2017-07-13 17:43;0;0;"My partner and I moved here 3 yrs ago and she has yet to find a doctor who will help her. Something needs to change! She is not a criminal.";;;;"885615766426570752";https://twitter.com/amBackoff/status/885615766426570752
amBackoff;2017-07-13 17:42;0;0;"Senator, something in Delaware has got to change. There needs to be a registry for people who legit need pain meds.";;;;"885615346975113217";https://twitter.com/amBackoff/status/885615346975113217
standsagreenoak;2017-07-13 17:41;0;0;"How about doing a favor for millions with chronic illness like my wife, @ AnyaSilverPoet , and working for bipartisanship on healthcare?";;@;;"885615131249573888";https://twitter.com/standsagreenoak/status/885615131249573888
amBackoff;2017-07-13 17:41;0;0;"Making patients who are in unrelenting pain go without pain meds because someone in our state died from a heroin overdose is the same thing!";;;;"885615101436461056";https://twitter.com/amBackoff/status/885615101436461056
Baconbits078;2017-07-13 17:33;0;2;"But it's better than being forced to buy a car with those "extras" (written in sarcasm font)";;;;"885613301174030337";https://twitter.com/Baconbits078/status/885613301174030337
EmmJay1545;2017-07-13 17:31;0;1;"pic.twitter.com/j4rwES7uiB";;;;"885612657725722624";https://twitter.com/EmmJay1545/status/885612657725722624
AmericanWow2017;2017-07-13 17:31;0;0;"The senate should of called for a special prosecutor but instead you chose party over law so corrupt for 8 yrs and still corrupt";;;;"885612556735442945";https://twitter.com/AmericanWow2017/status/885612556735442945
ChrisCoons;2017-07-13 17:25;10;38;"It might make the cars cheaper, but the cars are too dangerous to drive.";;;;"885611258363469825";https://twitter.com/ChrisCoons/status/885611258363469825
ChrisCoons;2017-07-13 17:24;115;227;"The new GOP bill w/ the Cruz amendment is like allowing car companies to sell cars without airbags, bumpers, or emergency brakes.";;;;"885611030969298944";https://twitter.com/ChrisCoons/status/885611030969298944
bloomonthetweet;2017-07-13 17:23;0;0;"# freedom";;;#;"885610548578050048";https://twitter.com/bloomonthetweet/status/885610548578050048
AmericanWow2017;2017-07-13 17:22;0;0;"Why didn't senate call a meeting with Comey after lynch meet On tarmac it was clear to the FBI that AG lynch is corrupt";;;;"885610473059733504";https://twitter.com/AmericanWow2017/status/885610473059733504
drspl5;2017-07-13 17:21;0;0;"@ ChrisCoons Support legislation to make net neutrality permanent & eliminate T2 threat to investment. https://cards.twitter.com/cards/kn0sh/4iq9u …";;@;;"885610182239301632";https://twitter.com/drspl5/status/885610182239301632
Hi_IQ_Trump;2017-07-13 17:19;0;0;"If you're against them, they must be incredible.";;;;"885609671087857664";https://twitter.com/Hi_IQ_Trump/status/885609671087857664
AmericanWow2017;2017-07-13 17:12;0;0;"Comey was / is so corrupt he may be a nice guy but not fit for the job";;;;"885607968741273600";https://twitter.com/AmericanWow2017/status/885607968741273600
JerzeyJohn71;2017-07-13 17:11;0;0;"@ ChrisCoons Support legislation to make net neutrality permanent & eliminate T2 threat to investment. https://cards.twitter.com/cards/kn0sh/4iq9u …";;@;;"885607761265995778";https://twitter.com/JerzeyJohn71/status/885607761265995778
dav34829;2017-07-13 17:10;1;4;"Every American should have the same health care plan as Congress members. Do not exempt yourselves!";;;;"885607312014049280";https://twitter.com/dav34829/status/885607312014049280
thomaskaine5;2017-07-13 17:10;0;0;"we need someone who isn't like Sessions";;;;"885607283501047809";https://twitter.com/thomaskaine5/status/885607283501047809
SharonMcGowanDC;2017-07-13 17:09;0;2;". @ LambdaLegal appreciates your continued leadership on this issue! Now we turn to getting the message to the rest of your colleagues.";;@;;"885607260214485000";https://twitter.com/SharonMcGowanDC/status/885607260214485000
dav34829;2017-07-13 17:08;1;1;"If you voted for or agree with not revoking Kushner's security clearance, that says you're OK w/ Russians running our country.";;;;"885606792964833280";https://twitter.com/dav34829/status/885606792964833280
horsecrazybean;2017-07-13 17:07;1;1;"Thank you. Very inappropriate nominees coming from this administration. Please fight for a neutral fair ethical judiciary. (Byw, Wray is RU)";;;;"885606572126339073";https://twitter.com/horsecrazybean/status/885606572126339073
AmericanWow2017;2017-07-13 17:05;0;0;"Where were you the last 8yrs so much corruption you didn't protect the people you put blinders on protected the dem party only";;;;"885606145796300800";https://twitter.com/AmericanWow2017/status/885606145796300800
ChrisCoons;2017-07-13 17:04;7;14;"I worry about their judgment & temperament. Is this the caliber of nominee we want to see on a federal bench?";;;;"885605889125867520";https://twitter.com/ChrisCoons/status/885605889125867520
ChrisCoons;2017-07-13 17:04;16;31;"Today, I voiced my concerns about John Bush & Damien Schiff, two of the nominees the Judiciary Cmte just voted out:https://www.youtube.com/watch?v=oXHdfPEHLsQ …";;;;"885605787946582020";https://twitter.com/ChrisCoons/status/885605787946582020
lesleyclark;2017-07-13 17:03;14;24;". @ ChrisCoons on @ tedcruz health care amendment: "Like allowing car companies to sell cars without airbags, bumpers, or emergency brakes”";;@ @;;"885605679481925632";https://twitter.com/lesleyclark/status/885605679481925632
takeitback55;2017-07-13 16:49;0;0;"@ ChrisCoons Please pass a permanent net neutrality law! Protect citizens & eliminate T2 threat. https://cards.twitter.com/cards/kn0sh/4iq9v …";;@;;"885602213204250626";https://twitter.com/takeitback55/status/885602213204250626
taverino;2017-07-13 16:40;0;0;"@ ChrisCoons Please pass a permanent net neutrality law! Protect citizens & eliminate T2 threat. https://cards.twitter.com/cards/kn0sh/4iq9v …";;@;;"885599859344101376";https://twitter.com/taverino/status/885599859344101376
JOak4all;2017-07-13 16:39;0;1;"How can you be bipartisan with people who hate America and its founding principles.";;;;"885599709770985474";https://twitter.com/JOak4all/status/885599709770985474
crwhudson;2017-07-13 16:28;0;0;"@ ChrisCoons Support legislation to make net neutrality permanent & eliminate T2 threat to investment. https://cards.twitter.com/cards/kn0sh/4iq9q …";;@;;"885596755240374272";https://twitter.com/crwhudson/status/885596755240374272
gleighgray;2017-07-13 16:27;1;2;"Kushner's security clearance needs to be taken away. # countryoverparty";;;#;"885596565079040004";https://twitter.com/gleighgray/status/885596565079040004
amynorthgeorgia;2017-07-13 16:26;0;0;"You once called your constituents 'the unwashed'. Why should we believe u when u hold such contempt for those un purport to represent?";;;;"885596441279901700";https://twitter.com/amynorthgeorgia/status/885596441279901700
trustme__;2017-07-13 16:19;1;0;"@ sendavidperdue has already pledged a maximum of 2 terms. How many terms have you served? 3.";;@;;"885594460243070977";https://twitter.com/trustme__/status/885594460243070977
trustme__;2017-07-13 16:16;1;3;"# TermLimits are a great way to encourage bipartisanship. Sorry, but you need to retire and make your legacy the introduction of term limits.";;;#;"885593823308656642";https://twitter.com/trustme__/status/885593823308656642
nickwyattsr;2017-07-13 16:15;0;0;"Isn't it time for you to retire! You have milked the Tax Payers while screwing us far long enough! # Trumpcare << Is is good enough for you?";;;#;"885593563962191872";https://twitter.com/nickwyattsr/status/885593563962191872
nickwyattsr;2017-07-13 16:13;0;0;"Bipartisanship? Dude, have you looked at your own voting record? I have! It's anything but bipartisan! Your just another lying # hypocrite!";;;#;"885592978961694720";https://twitter.com/nickwyattsr/status/885592978961694720
omgrishma;2017-07-13 16:11;1;6;"Talk the talk, walk the walk, Senator. Support a bipartisan approach to fixing the ACA, instead of voting to take away our healthcare.";;;;"885592641655668738";https://twitter.com/omgrishma/status/885592641655668738
SoFauxSoReal;2017-07-13 16:10;0;0;"Literally laughing out loud";;;;"885592408133701634";https://twitter.com/SoFauxSoReal/status/885592408133701634
