username;date;retweets;favorites;text;geo;mentions;hashtags;id;permalink
BookCd;2017-07-20 07:41;0;3;"No they're not...better. They are doing what the US govt has always done: welcoming Israeli interference in our politics.";;;;"888000801758732288";https://twitter.com/BookCd/status/888000801758732288
redsonic24;2017-07-20 07:33;0;0;""We'll tell you how you can't spend your $, but Charlie Hebdo - they can spew all the vile vitriol they want. 'Ya know, free speech and all"";;;;"887998929891143680";https://twitter.com/redsonic24/status/887998929891143680
dankmtl;2017-07-20 07:27;0;2;"I look forward to this guy criticizing trump for selling arms to Saudi Arabia!";;;;"887997393697992705";https://twitter.com/dankmtl/status/887997393697992705
dbeasley1;2017-07-20 06:56;0;2;"Retweeted David Beasley ( @ WFPChief): Working with @ ChrisCoons on # FightingFamine, a great guy who is passionate... http://fb.me/8LmWTJncd";;@ @;#;"887989598495834112";https://twitter.com/dbeasley1/status/887989598495834112
dbeasley1;2017-07-20 06:56;0;0;"Retweeted David Beasley ( @ WFPChief): I insisted to @ ChrisCoons that South Carolina beaches>Delaware beaches.... http://fb.me/YDBo8FjU";;@ @;;"887989593902940162";https://twitter.com/dbeasley1/status/887989593902940162
gmretseck;2017-07-20 05:18;1;1;"Pro-Trump TV pundit's took undisclosed payments from Trump campaign http://www.philly.com/philly/news/politics/presidential/Pro-Trump-TV-pundits-firm-took-undisclosed-payments-from-Trump-campaign.html … via @ phillydotcom @ ChrisCoons @ chelseahandler";;@ @ @;;"887964941466120192";https://twitter.com/gmretseck/status/887964941466120192
SeamusSaysThat;2017-07-20 02:56;0;0;"@ ChrisCoons What have you done to punish Russia? Pressure the GOP to pass sanctions today! Make DJT own Russia connect";;@;;"887929191454265344";https://twitter.com/SeamusSaysThat/status/887929191454265344
LKTuffaha;2017-07-20 02:23;0;0;"It's non-violent protest against illegal occupation.";;;;"887920988679057408";https://twitter.com/LKTuffaha/status/887920988679057408
GJP2011;2017-07-20 00:55;0;0;"You're better than cosponsoring a bill criminalizing free speech @ clairecmc @ RepTedLieu @ tedlieu @ SenGillibrand @ RepAdamSchiff @ ChrisCoons https://twitter.com/aclu/status/887344808288759810 …";;@ @ @ @ @ @;;"887898744233930755";https://twitter.com/GJP2011/status/887898744233930755
warrior4horses;2017-07-20 00:50;0;0;"Ban # horseslaughter. Yes2 # UdallGrahamAmendment @ SenJeffMerkley @ ChrisCoons @ SenatorLankford @ Watchdogsnifferpic.twitter.com/fxpOc3nqz8";;@ @ @ @;# #;"887897583900917760";https://twitter.com/warrior4horses/status/887897583900917760
warrior4horses;2017-07-20 00:50;0;0;"Ban # horseslaughter. Yes2 # UdallGrahamAmendment @ SenJeffMerkley @ ChrisCoons @ SenatorLankford @ Watchdogsnifferpic.twitter.com/fxpOc35Pay";;@ @ @ @;# #;"887897504972292097";https://twitter.com/warrior4horses/status/887897504972292097
LevySheila__;2017-07-19 23:35;0;0;"@ JoyAnnReid @ Alyssa_Milano @ ChrisCoons @ mmpadellan @ GalvanizeGA protect America, protect # democracy # MakeMuellerNotFireableByTrumphttps://twitter.com/funder/status/887870535836868614 …";;@ @ @ @ @;# #;"887878663517212679";https://twitter.com/LevySheila__/status/887878663517212679
schticknic;2017-07-19 23:29;0;2;"No they're not. But 4 morons on thread...econ boycott worked in SA apartheid & Israeli apartheid infinitely worse.https://www.democracynow.org/2015/5/6/ex_un_official_john_dugard_israel …";;;;"887877147854913536";https://twitter.com/schticknic/status/887877147854913536
SydAlexMom;2017-07-19 23:27;0;0;"Really? New info! https://twitter.com/JamesFourM/status/887852200780865536 … @ SenJohnKennedy @ tedcruz @ SenFeinstein @ SenFranken @ SenBlumenthal @ maziehirono @ ChrisCoons @ CNN";;@ @ @ @ @ @ @ @;;"887876713987710976";https://twitter.com/SydAlexMom/status/887876713987710976
ayylmaoism;2017-07-19 23:27;0;0;"Narrator voice: they are not";;;;"887876566704955392";https://twitter.com/ayylmaoism/status/887876566704955392
itsallgrey2me;2017-07-19 23:20;2;2;">80% of WE, THE PEOPLE, r opposed 2 horse slaughter! Please hear us! Don't let us betray those who helped us build this country. Please.";;;;"887874871849619457";https://twitter.com/itsallgrey2me/status/887874871849619457
eskinner;2017-07-19 23:07;0;1;"Definitely true! # SeabrookIsland";;;#;"887871642701099013";https://twitter.com/eskinner/status/887871642701099013
gr8danez3;2017-07-19 22:55;1;0;"Ban # horseslaughter. Yes2 # UdallGrahamAmendment @ SenJeffMerkley @ ChrisCoons @ SenatorLankford @ Watchdogsnifferpic.twitter.com/AcAX5AufJo";;@ @ @ @;# #;"887868492061392896";https://twitter.com/gr8danez3/status/887868492061392896
MLaura54;2017-07-19 22:53;0;0;"Ban # horseslaughter. Yes2 # UdallGrahamAmendment @ SenJeffMerkley @ ChrisCoons @ SenatorLankford @ Watchdogsnifferpic.twitter.com/6JJRqr5UBb";;@ @ @ @;# #;"887868096291188736";https://twitter.com/MLaura54/status/887868096291188736
lisakeichline;2017-07-19 22:48;0;0;"Hoping both sides will begin to put the people first and work together.";;;;"887866655094788098";https://twitter.com/lisakeichline/status/887866655094788098
ShortSkrtLngJkt;2017-07-19 22:33;0;0;"LETS HOPE MCCAIN HAS GOOD HEALTH INSURANCE. MOST OF US WOULD NOT BE ABLE TO AFFORD HEALTHCARE FOR CANCER.pic.twitter.com/PcIIi0Zv11";;;;"887862916556390404";https://twitter.com/ShortSkrtLngJkt/status/887862916556390404
nahmed666;2017-07-19 22:09;0;0;"Thank you Kal for shining a light on this.";;;;"887857034821062656";https://twitter.com/nahmed666/status/887857034821062656
EaglezFlyHi;2017-07-19 21:48;0;0;"This is beyond alarming. # ACA needs some work but it to clearly a better solution than 32 million being without";;;#;"887851723901075456";https://twitter.com/EaglezFlyHi/status/887851723901075456
JuliaJoyLife;2017-07-19 21:22;0;0;"Amen";;;;"887845030404272129";https://twitter.com/JuliaJoyLife/status/887845030404272129
ChrisCoons;2017-07-19 21:10;6;83;"I am praying for his full recovery and for the return of his forceful voice to the Senate.";;;;"887842160640438273";https://twitter.com/ChrisCoons/status/887842160640438273
ChrisCoons;2017-07-19 21:09;25;195;"Senator John McCain is a fighter, and I am hopeful he will once again beat the odds.";;;;"887841972203008000";https://twitter.com/ChrisCoons/status/887841972203008000
kelley_dan;2017-07-19 20:16;0;0;"@ ChrisCoons Letting Obamacare fail is 'heartless'? You Dems passed this monstrosity and now you say it is 'heartless' to let it die. Jeez!";;@;;"887828644072214528";https://twitter.com/kelley_dan/status/887828644072214528
JazzLPcollector;2017-07-19 20:13;0;0;"@ SenFeinstein @ PatrickLeahy @ DickDurbin @ SenWhitehouse @ amyklobuchar @ SenFranken @ ChrisCoons https://mobile.twitter.com/Spicerlies/status/887812939209732096/photo/1 … https://mobile.twitter.com/Spicerlies/status/887812939209732096/photo/2 …pic.twitter.com/8atsabm7Qk";;@ @ @ @ @ @ @;;"887827804863184896";https://twitter.com/JazzLPcollector/status/887827804863184896
Linelfer7;2017-07-19 20:01;0;0;"The whole Republican Dictatorial Russia-favorable hail-Mary approach these days is stunning and infuriating. Stop them please.";;;;"887824696137326592";https://twitter.com/Linelfer7/status/887824696137326592
irish6776;2017-07-19 20:01;0;0;"Well it is true so what r u gonna do about it? @ SenBobCorker @ SenJohnMcCain @ ChrisCoons @ RonWyden # TheResistancehttps://twitter.com/lindseygrahamsc/status/887781541719441412 …";;@ @ @ @;#;"887824670451544065";https://twitter.com/irish6776/status/887824670451544065
rainingktula;2017-07-19 19:50;0;0;"Absolutely, those should stop but settlement activities didn’t end during the relatively peaceful Oslo years.";;;;"887821857562304512";https://twitter.com/rainingktula/status/887821857562304512
rainingktula;2017-07-19 19:47;0;0;"And Rabin was supposed to be a “dove”!";;;;"887821218904023040";https://twitter.com/rainingktula/status/887821218904023040
rainingktula;2017-07-19 19:47;0;0;"Remember the Oslo peace agreement? What did it get the Palestinians? The largest increase in settler population happened during Rabin’s era.";;;;"887821143939272704";https://twitter.com/rainingktula/status/887821143939272704
donna_goodnight;2017-07-19 19:43;0;0;"Ban # horseslaughter. Yes2 # UdallGrahamAmendment @ SenJeffMerkley @ ChrisCoons @ SenatorLankford @ Watchdogsnifferpic.twitter.com/UHmaOnhMKZ";;@ @ @ @;# #;"887820154830295046";https://twitter.com/donna_goodnight/status/887820154830295046
rainingktula;2017-07-19 19:42;0;0;"I’m afraid at this moment, a 2-state solution is no longer possible, thanks to Israel’s decades of land-theft for settlement building.";;;;"887819921706467330";https://twitter.com/rainingktula/status/887819921706467330
JL00t;2017-07-19 19:39;0;1;"Thank you for speaking up on this.";;;;"887819324013953024";https://twitter.com/JL00t/status/887819324013953024
rainingktula;2017-07-19 19:32;0;0;"Then you should know real well that the so-called “generous offers” by Israel are just myths.";;;;"887817572535607296";https://twitter.com/rainingktula/status/887817572535607296
rainingktula;2017-07-19 19:29;0;0;"You really need to read from other non-hasbara sources for your information. https://electronicintifada.net/content/misrepresentation-baraks-offer-camp-david-generous-and-unprecedented/3991 …";;;;"887816774229475328";https://twitter.com/rainingktula/status/887816774229475328
ShaunMcGovern8;2017-07-19 19:13;0;0;"He needs to be impeached. He's a disgrace to the Presidency.";;;;"887812774881091584";https://twitter.com/ShaunMcGovern8/status/887812774881091584
WordSaladeater;2017-07-19 19:08;0;0;"It was the legal when these guys did it.pic.twitter.com/wpWUY2W16I";;;;"887811475754147840";https://twitter.com/WordSaladeater/status/887811475754147840
ShortSkrtLngJkt;2017-07-19 18:41;0;0;"# HEALTHCARE @ SenGillibrand @ SenatorCantwell @ Sen_JoeManchin @ ChrisCoons @ SenatorLeahy @ SenFeinstein @ LindseyGrahamSC @ SenJohnMcCainpic.twitter.com/LjgpJUMpj9";;@ @ @ @ @ @ @ @;#;"887804550253596672";https://twitter.com/ShortSkrtLngJkt/status/887804550253596672
rainingktula;2017-07-19 18:32;0;0;"Is it anti-semitic to oppose this “self determination” that’s based on expelling non-Jews from the land the latter had lived for centuries?";;;;"887802360386297856";https://twitter.com/rainingktula/status/887802360386297856
rainingktula;2017-07-19 18:30;0;0;"“Isolating an egalitarian democrat like Israel is anti-semitic”. You’re kidding right?";;;;"887801754623942656";https://twitter.com/rainingktula/status/887801754623942656
rainingktula;2017-07-19 18:27;0;13;"Is saying “China is occupying and colonizing Tibetan land….etc” explicitly implying that China should not exist & therefore anti-Chinese?";;;;"887801144440889345";https://twitter.com/rainingktula/status/887801144440889345
tammyguess59;2017-07-19 18:25;0;0;"Ban # horseslaughter. Yes2 # UdallGrahamAmendment @ SenJeffMerkley @ ChrisCoons @ SenatorLankford @ Watchdogsnifferpic.twitter.com/k0SU8DtTxb";;@ @ @ @;# #;"887800637735538692";https://twitter.com/tammyguess59/status/887800637735538692
Ms_Muphry;2017-07-19 18:25;0;0;"Pal media used pictures of Syrian war dead to libel Israel.";;;;"887800525986516992";https://twitter.com/Ms_Muphry/status/887800525986516992
Ms_Muphry;2017-07-19 18:24;0;0;"You are right. The blood libel will start in ...3 ... 2 ... 1.";;;;"887800375780155392";https://twitter.com/Ms_Muphry/status/887800375780155392
Ms_Muphry;2017-07-19 18:23;0;0;"If you think that is at all justifiable, you are an antisemite. Period.";;;;"887800145068163072";https://twitter.com/Ms_Muphry/status/887800145068163072
Ms_Muphry;2017-07-19 18:23;0;0;"Jews can't pray at the Temple Mount. Our holiest site. If Jews go there and their lips move, terrorists start stabbing Israelis.";;;;"887800038990069760";https://twitter.com/Ms_Muphry/status/887800038990069760
Ms_Muphry;2017-07-19 18:21;0;0;"That is, unless Judaism's holiest site crawled beneath the mosque. But the mosque was built by imperialists.";;;;"887799513510854656";https://twitter.com/Ms_Muphry/status/887799513510854656
Ms_Muphry;2017-07-19 18:20;0;0;"The Temple Mount has a mosque on top of it but Jews are treated as interlopers. That is pure antisemitism.";;;;"887799249940828160";https://twitter.com/Ms_Muphry/status/887799249940828160
ctyankee007;2017-07-19 18:19;0;0;"Good point thank you";;;;"887799182916030465";https://twitter.com/ctyankee007/status/887799182916030465
Ms_Muphry;2017-07-19 18:19;0;0;"Isolating an egalitarian democracy like Israel is antisemitic. Denying Jewish self determination is antisemitic, too.";;;;"887799066674970624";https://twitter.com/Ms_Muphry/status/887799066674970624
ctyankee007;2017-07-19 18:19;0;0;"Probably more effective If you inform the GOP senators they're most likely NOT democrats";;;;"887799007417860096";https://twitter.com/ctyankee007/status/887799007417860096
PamShumate;2017-07-19 18:18;0;0;"@ SenateDems @ ChrisCoons @ SenKamalaHarris @ ChrisMurphyCT PLEASE SCREAM about 17 MILLION loosing healthcare NEXT YEAR !";;@ @ @ @;;"887798827553615872";https://twitter.com/PamShumate/status/887798827553615872
Ms_Muphry;2017-07-19 18:17;0;0;"Boycotts aren't speech. Antisemitism isn't a value. BDS is antisemitic.";;;;"887798492126601217";https://twitter.com/Ms_Muphry/status/887798492126601217
PamShumate;2017-07-19 18:16;1;0;"The focus should be 17 MILLION next year......that happens LONG before the 32 million !";;;;"887798246185328642";https://twitter.com/PamShumate/status/887798246185328642
ChrisCoons;2017-07-19 18:15;10;25;"This isn’t about politics. This is about people. So again, let’s work TOGETHER to improve the # ACA";;;#;"887798037740998658";https://twitter.com/ChrisCoons/status/887798037740998658
ChrisCoons;2017-07-19 18:14;14;31;"That’s 32 million of your neighbors, your family members, and your friends. Real people.";;;;"887797711793254400";https://twitter.com/ChrisCoons/status/887797711793254400
ChrisCoons;2017-07-19 18:11;15;18;"President Trump’s plan to simply repeal the # ACA without a replacement would leave 32 million more Americans without insurance";;;#;"887797036044648448";https://twitter.com/ChrisCoons/status/887797036044648448
ChrisCoons;2017-07-19 18:06;43;46;"It’s no surprise that repealing the # ACA without a replacement would be a disaster, but this non-partisan CBO analysis is still stunninghttps://twitter.com/ap/status/887786428855353345 …";;;#;"887795840785539072";https://twitter.com/ChrisCoons/status/887795840785539072
sonjamfrey;2017-07-19 18:05;0;0;"me. this is an unconscionable statement by the man in the pres office.";;;;"887795553479819265";https://twitter.com/sonjamfrey/status/887795553479819265
Snowdns;2017-07-19 18:01;1;0;"@ ChrisCoons Please explain your sponsorship of this bill, which is clearly violative of the First Amendment: http://nymag.com/daily/intelligencer/2017/07/senate-bill-would-make-it-a-federal-crime-to-boycott-israel.html …";;@;;"887794575917670401";https://twitter.com/Snowdns/status/887794575917670401
rainingktula;2017-07-19 17:59;0;0;"I’m curious. Which part of the BDS ideology is anti-Semitic? https://bdsmovement.net/what-is-bds";;;;"887793953944109057";https://twitter.com/rainingktula/status/887793953944109057
WideAsleepNima;2017-07-19 17:48;3;2;"Anti-free speech crusaders @ SenatorCardin & @ ChrisCoons will do anything to defend Israeli apartheid. https://theintercept.com/2017/07/19/u-s-lawmakers-seek-to-criminally-outlaw-support-for-boycott-campaign-against-israel/ …";;@ @;;"887791322471571457";https://twitter.com/WideAsleepNima/status/887791322471571457
Delabt2791;2017-07-19 17:47;0;1;"When Dems refuse to compromise on a failing Obamacare, this is what hapoens. Now all Americans lose. Republicans no better. Come together!";;;;"887791019474989061";https://twitter.com/Delabt2791/status/887791019474989061
hashtagita;2017-07-19 17:39;1;1;"pic.twitter.com/WPnlDkjVVp";;;;"887789014408941569";https://twitter.com/hashtagita/status/887789014408941569
EDLesh;2017-07-19 17:31;17;18;"Here's @ JudiciaryDems champ, @ ChrisCoons speaking out against Trump judge pick John K. Bush on the Senate floor: # StopBush # NoHateInCourtpic.twitter.com/GNb5oBnGj7";;@ @;# #;"887787047808880640";https://twitter.com/EDLesh/status/887787047808880640
DarbyKathleen;2017-07-19 17:25;0;2;"Nope but even if it was, US entities and individuals are protected under the first amendment. foreign entities aren't.";;;;"887785399698903040";https://twitter.com/DarbyKathleen/status/887785399698903040
Lynnsmith63Lynn;2017-07-19 17:22;0;0;"Perfect this way u won't b able to lie about it";;;;"887784838639624192";https://twitter.com/Lynnsmith63Lynn/status/887784838639624192
DarbyKathleen;2017-07-19 17:19;8;16;"Ds who support this bill lose their right to call Trump an authoritarian. This bill is the most authoritarian legislation we've seen in yrs.";;;;"887784089335418880";https://twitter.com/DarbyKathleen/status/887784089335418880
eskinner;2017-07-19 17:13;0;2;"Yes he is! We love @ ChrisCoons! https://twitter.com/wfpchief/status/887687298384613378 …";;@;;"887782523681550336";https://twitter.com/eskinner/status/887782523681550336
kimdallas07;2017-07-19 17:13;0;1;"Exactly WTF this bill is, what part do you not get? # CommonSense";;;#;"887782459345174528";https://twitter.com/kimdallas07/status/887782459345174528
kimdallas07;2017-07-19 17:11;0;1;"Except they are NOT! Hating Trump is easy! Caring about # peopleoverprofit is lost on corp dems";;;#;"887781999578165248";https://twitter.com/kimdallas07/status/887781999578165248
dickius;2017-07-19 16:53;0;0;"Now that you agree the bill is unconstitutional, I think you owe ktula (and Kal) an apology.";;;;"887777460166819840";https://twitter.com/dickius/status/887777460166819840
Punctuarian;2017-07-19 16:47;0;1;"Are you OK with academics boycotting Israel? Or SJP threatening speakers? BDS is anti-semitic, full stop";;;;"887776035931959296";https://twitter.com/Punctuarian/status/887776035931959296
dickius;2017-07-19 16:44;0;0;"You went pretty quick from "not criminalizing free speech" to "unconstitutional."";;;;"887775087260291072";https://twitter.com/dickius/status/887775087260291072
kokoswatching;2017-07-19 16:39;0;0;"# unAmerican";;;#;"887773894718967808";https://twitter.com/kokoswatching/status/887773894718967808
dickius;2017-07-19 16:36;0;0;"I'm not afraid of that at all. I'm just a big supporter of the Constitution.";;;;"887773179749560320";https://twitter.com/dickius/status/887773179749560320
SharonMcGowanDC;2017-07-19 16:35;5;6;". @ ChrisCoons has just taken the floor as part of the effort to # StopBush & # ProtectOurCourts - thank you for speaking out!";;@;# #;"887773019942395905";https://twitter.com/SharonMcGowanDC/status/887773019942395905
dickius;2017-07-19 16:31;0;1;"Yes. This has been another episode of easy answers to stupid questions. Thanks for joining us!";;;;"887771938764017666";https://twitter.com/dickius/status/887771938764017666
dickius;2017-07-19 16:27;0;0;"I'm Jewish. On Board of directors of my synagogue. Big big supporter of Israel. I hate BDS. I think this bill is unconstitutional.";;;;"887771006382878721";https://twitter.com/dickius/status/887771006382878721
worldnuse;2017-07-19 16:26;0;0;"@ realdonaldtrump Obama & DOJ failed to protect constitution do justice in my NC 5:09cv375:FL case. @ potus under notice 2 intervene urgently!";;@ @;;"887770526994837505";https://twitter.com/worldnuse/status/887770526994837505
AlBiRumi;2017-07-19 16:18;0;0;"@ GerryConnolly @ SenSanders @ timkaine @ MarkWarner @ ChrisCoons @ SenFranken @ TheDemocrats must # DefendThe1st as much as Repubs defend the gunshttps://twitter.com/kalpenn/status/887736203025534976 …";;@ @ @ @ @ @ @;#;"887768710899003392";https://twitter.com/AlBiRumi/status/887768710899003392
outerurbancadet;2017-07-19 16:18;0;2;"They're not. Time to wake up.";;;;"887768507387129860";https://twitter.com/outerurbancadet/status/887768507387129860
MWitt100;2017-07-19 16:16;0;0;"@ SenGillibrand @ SenSanders @ ChrisCoons @ ChrisVanHollen Go to the republican meeting tonight and show the American people ur ideas for ACA";;@ @ @ @;;"887768143430639616";https://twitter.com/MWitt100/status/887768143430639616
DrKareemTannous;2017-07-19 16:13;0;0;"My grandparents didnt like zionism forced on them 100 yrs ago... # FreePalestine # EndTheOccupation";;;# #;"887767437214711808";https://twitter.com/DrKareemTannous/status/887767437214711808
ketagoesglobal;2017-07-19 16:10;0;1;"Is there is no middle ground? I love most Jewish people AND I have a big problem with many of the policies of the government of Israel.";;;;"887766584747474944";https://twitter.com/ketagoesglobal/status/887766584747474944
RevengeofNewton;2017-07-19 16:08;0;1;"I haven't seen a worse take. I am not a business. My buying choices are not "business practices."";;;;"887766137013805056";https://twitter.com/RevengeofNewton/status/887766137013805056
Bourgy;2017-07-19 16:07;0;1;"They are not better.";;;;"887765887545225220";https://twitter.com/Bourgy/status/887765887545225220
RevengeofNewton;2017-07-19 16:07;0;0;"Anti-Zionism is good and should be encouraged. :)";;;;"887765858726035456";https://twitter.com/RevengeofNewton/status/887765858726035456
xMOLONLABEx;2017-07-19 16:04;0;0;"So boycotting Muslim orgs and entities is ok then too, because of "free speech"??";;;;"887765094624526337";https://twitter.com/xMOLONLABEx/status/887765094624526337
BertoltMEHcht;2017-07-19 16:02;0;0;"(also, fwiw, my comrades are basically the reason that Hitler lost at all, so please say thank you to Leftism, Stalin, and the USSR)";;;;"887764549478346752";https://twitter.com/BertoltMEHcht/status/887764549478346752
BertoltMEHcht;2017-07-19 16:00;0;0;"lol nope";;;;"887764116559081473";https://twitter.com/BertoltMEHcht/status/887764116559081473
HinduAmericans;2017-07-19 16:00;1;5;"Arabs hate Hindus like you, but here you are defending them when they and their allies are literally killing, repressing Hindus in Asia.";;;;"887764020157181956";https://twitter.com/HinduAmericans/status/887764020157181956
make_ready;2017-07-19 16:00;0;1;"ran out of talking points i see. your time is running out and so is that of all the people making these disingenuous arguments. bye :)";;;;"887763996903919616";https://twitter.com/make_ready/status/887763996903919616
motherof3labs;2017-07-19 15:59;0;0;"Ban # horseslaughter. Yes2 # UdallGrahamAmendment @ SenJeffMerkley @ ChrisCoons @ SenatorLankford @ Watchdogsnifferpic.twitter.com/oQ9QVqESGk";;@ @ @ @;# #;"887763936795402240";https://twitter.com/motherof3labs/status/887763936795402240
HinduAmericans;2017-07-19 15:58;1;3;"Once again, Kal Penn acts as a slave of Arabs, Muslims. Another self-hating Indian-American Hindu. Why you quiet about repression of Hindus?";;;;"887763649418469376";https://twitter.com/HinduAmericans/status/887763649418469376
BetsyOShea;2017-07-19 15:56;0;1;"It I not anti Semetic to be against Netanyahu and see Palestines point of view. Jimmy Carter took that position";;;;"887763120059559936";https://twitter.com/BetsyOShea/status/887763120059559936
DrKareemTannous;2017-07-19 15:55;0;0;"AntiZionism is NOT AntiSemetism # FreePalestine # EndTheOccupation";;;# #;"887762873220567040";https://twitter.com/DrKareemTannous/status/887762873220567040
ModernSenseNow;2017-07-19 15:54;0;0;"How is this a cruel act when you can clearly correlate the European migrant crisis to the vast influxe of refugees?";;;;"887762490297389056";https://twitter.com/ModernSenseNow/status/887762490297389056
BertoltMEHcht;2017-07-19 15:52;0;0;"lol nope, but your conflation of the state of Israel and the religion of Judaism is illuminating wrt understanding Israeli apartheid.";;;;"887762138613395456";https://twitter.com/BertoltMEHcht/status/887762138613395456
RAWagman;2017-07-19 15:50;0;0;"BDS is definitely anti-semitic. Thankfully, hatred is a right.";;;;"887761626245419008";https://twitter.com/RAWagman/status/887761626245419008
BertoltMEHcht;2017-07-19 15:45;0;2;"Kal, they're not better than this.";;;;"887760334651621376";https://twitter.com/BertoltMEHcht/status/887760334651621376
BertoltMEHcht;2017-07-19 15:45;0;0;"it's not anti-semitic.";;;;"887760244067229698";https://twitter.com/BertoltMEHcht/status/887760244067229698
BertoltMEHcht;2017-07-19 15:44;0;1;"yes, it's okay. good and true, even. and also, before the inevitable response: not it's not "anti-semitic"";;;;"887760074378227714";https://twitter.com/BertoltMEHcht/status/887760074378227714
soopervillain;2017-07-19 15:42;0;5;"Fines = criminalization. And since SCOTUS ruled that money = speech, Kal is right. Doesn't matter, won't pass a court challenge";;;;"887759507279020033";https://twitter.com/soopervillain/status/887759507279020033
DrPhilKn0ws;2017-07-19 15:42;1;2;"I thought Obamacare was great & working as planned. So how @ ChrisCoons can it be @ POTUS fault for leaving it as is? http://www.breitbart.com/video/2017/07/18/dem-sen-coons-trump-saying-let-obamacare-fail-is-heartless-and-callous/ …";;@ @;;"887759503097294848";https://twitter.com/DrPhilKn0ws/status/887759503097294848
cgriordan;2017-07-19 15:40;0;2;"@ ChrisCoons kicks off Continuous Manufacturing panel in Senate. @ NIIMBL # Innovationpic.twitter.com/4OwT2EkWeN";;@ @;#;"887758946479616002";https://twitter.com/cgriordan/status/887758946479616002
RAWagman;2017-07-19 15:39;0;0;"BDS is a nonsense, bullshit, ~anti-semitic campaign, yes. But short of inciting violence/hatred, it is free speech and should be protected.";;;;"887758902724501504";https://twitter.com/RAWagman/status/887758902724501504
soopervillain;2017-07-19 15:38;0;0;"SCOTUS already ruled that money is speech. This won't pass a court test for shit.";;;;"887758520615129088";https://twitter.com/soopervillain/status/887758520615129088
soopervillain;2017-07-19 15:37;1;6;"ANY criticism of Israel is considered Anti-Semitic?";;;;"887758257045090304";https://twitter.com/soopervillain/status/887758257045090304
