username;date;retweets;favorites;text;geo;mentions;hashtags;id;permalink
grandoftwo;2017-07-23 18:29;0;0;"I'd vote for Drumpf before I would BERNIE! # RealTalk";;;#;"889251261366886402";https://twitter.com/grandoftwo/status/889251261366886402
WayneSisk1;2017-07-23 18:29;0;0;"Sessions threw himself on the truth so much "it made me nervous" he cried. Scared of the strong woman asking him questions. @ SenKamalaHarris https://twitter.com/4everNeverTrump/status/889225082928844800 …";;@;;"889251249228533760";https://twitter.com/WayneSisk1/status/889251249228533760
elvondrake;2017-07-23 18:28;0;0;"@ MarkWarner @ SenatorBurr @ SenKamalaHarris @ SenAngusKing @ SenatorCollins @ SenatorRisch @ RonWyden @ Sen_JoeManchin @ marcorubio @ MartinHeinrich";;@ @ @ @ @ @ @ @ @ @;;"889250967530725376";https://twitter.com/elvondrake/status/889250967530725376
RiverStreet1;2017-07-23 18:27;0;1;"Agreed. But that is us making concessions & leaving the past behind us. The other side has rhetoric that's in-differentiable from MAGA folks";;;;"889250722931453955";https://twitter.com/RiverStreet1/status/889250722931453955
SkelingtonBlack;2017-07-23 18:26;0;0;"The only thing trump sells is junk. Wait, no he also sells bullshit. Looks like you bought both products.";;;;"889250394169278469";https://twitter.com/SkelingtonBlack/status/889250394169278469
kellyawallace;2017-07-23 18:24;1;4;"Well, yeah. I'd vote for my dog over anyone on the right.";;;;"889249901384798211";https://twitter.com/kellyawallace/status/889249901384798211
Stevejayd;2017-07-23 18:22;0;0;"@ GOP @ SenKamalaHarris @ tedlieu anyone worried? Got to get rid of nutjob pres first";;@ @ @;;"889249371111301120";https://twitter.com/Stevejayd/status/889249371111301120
RosaleeAdams;2017-07-23 18:21;5;9;"U mean @ SenSchumer like @ SenKamalaHarris & other Dim-wits discussing in Hamptons about ...the unwashed uneducated **working class**?";;@ @;;"889249173907886080";https://twitter.com/RosaleeAdams/status/889249173907886080
SandyTomich;2017-07-23 18:20;1;1;"@vickscan @TruthEqualsFact @ JoyAnnReid @ SenSanders @ RepJoeKennedy @ SenKamalaHarris @ alfranken Joe Kennedy is the real deal!";;@vickscan @TruthEqualsFact @ @ @ @ @;;"889248973873131524";https://twitter.com/SandyTomich/status/889248973873131524
mexicanfoodfrea;2017-07-23 18:20;0;2;"Agreed. We should be looking 4 younger candidates. But a qualified older nominee w/ a qualified VP still gets my vote b4 Trump/Pence/GOP.";;;;"889248883427168256";https://twitter.com/mexicanfoodfrea/status/889248883427168256
BBwriterchick;2017-07-23 18:19;0;1;"If we could get him to stop, to join Dems & bring his people with him in support of a candidate like @ SenKamalaHarris it would be amazing";;@;;"889248683580989440";https://twitter.com/BBwriterchick/status/889248683580989440
kellyawallace;2017-07-23 18:16;1;5;"79 is kind of an unreasonable age to be asking for a potential 8 year term.";;;;"889247884448870401";https://twitter.com/kellyawallace/status/889247884448870401
JoeMonteCarlo77;2017-07-23 18:14;0;0;"Please come to Arkansas there's police corruption & cover ups illegal immigrants have committed suicide here and buried in poppers graves";;;;"889247471947272192";https://twitter.com/JoeMonteCarlo77/status/889247471947272192
lepton939;2017-07-23 18:14;0;0;"@ SenKamalaHarris this guy is a jerk; let him find another friend https://twitter.com/teapainusa/status/889138961377112065 …";;@;;"889247340984401921";https://twitter.com/lepton939/status/889247340984401921
alleblue;2017-07-23 18:10;0;0;"@ SenKamalaHarris we do not need her promises that she cannot keep. Elites need to fall.";;@;;"889246405142958080";https://twitter.com/alleblue/status/889246405142958080
JoeMonteCarlo77;2017-07-23 18:10;0;0;"Good for them...that's what showing true bi-partisanship is and making America greater";;;;"889246356031684608";https://twitter.com/JoeMonteCarlo77/status/889246356031684608
JoeMonteCarlo77;2017-07-23 18:08;0;0;"Good for them...that's what showing true bi-partisanship is and making America greater";;;;"889245811661340672";https://twitter.com/JoeMonteCarlo77/status/889245811661340672
YWCAUSA;2017-07-23 18:03;2;3;"Our justice system should be fair to all. # BailReform is a necessary part of that. TY @ SenKamalaHarris & @ RandPaul http://bit.ly/2uQDUaZ";;@ @;#;"889244481991483392";https://twitter.com/YWCAUSA/status/889244481991483392
JainySavlaMD;2017-07-23 18:02;0;1;"@ planetmoney did a great episode on this topic!";;@;;"889244272494510080";https://twitter.com/JainySavlaMD/status/889244272494510080
ShaneValar;2017-07-23 18:00;0;0;"@ SenSchumer have a seat Chuckles time for you to be replaced with @ SenKamalaHarris";;@ @;;"889243899839074305";https://twitter.com/ShaneValar/status/889243899839074305
jenna92821;2017-07-23 18:00;0;0;"@ MarkWarner @ SenKamalaHarris @ SenFeinstein @ RepAdamSchiff Grassley Pulling a Bait and Switch*His Plan To Save Trump From The Russia Scandalhttps://twitter.com/politicususa/status/888579794996264961 …";;@ @ @ @;;"889243732096069632";https://twitter.com/jenna92821/status/889243732096069632
sparks_randi;2017-07-23 17:58;0;0;"@ realDonaldTrump @ SenSanders @ SenWarren @ SenFranken @ SenKamalaHarris @ SenSchumer @ SenJohnMcCain @ SenSherrodBrown enjoyhttps://twitter.com/KeithWitherow/status/889178734007382017 …";;@ @ @ @ @ @ @ @;;"889243464436723716";https://twitter.com/sparks_randi/status/889243464436723716
MORON_in_WH;2017-07-23 17:58;0;0;"@ DNC @ GOP @ SenateDems @ SenateGOP @ SenKamalaHarris https://twitter.com/ziggy_daddy/status/888924931508936705 …";;@ @ @ @ @;;"889243419268096000";https://twitter.com/MORON_in_WH/status/889243419268096000
erikschoen1;2017-07-23 17:58;0;0;"@ RepAdamSchiff @ MaxineWalters @ jahimes @ RepSwalwell @ MarkWarner @ SenTomCotton @ SenKamalaHarris @ SenFeinstein @ TGowdySCpic.twitter.com/IBB1sgYzs2";;@ @ @ @ @ @ @ @ @;;"889243361605013505";https://twitter.com/erikschoen1/status/889243361605013505
Stevejayd;2017-07-23 17:57;0;1;"@ SenateGOP @ SenFeinstein @ SenKamalaHarris everyone take their time";;@ @ @;;"889243108998885377";https://twitter.com/Stevejayd/status/889243108998885377
interpol2046;2017-07-23 17:57;0;0;"Yes! People mess up, they make mistakes, and shouldn't be stopped by bail from turning their lives around.";;;;"889242979382083584";https://twitter.com/interpol2046/status/889242979382083584
tummycouch54;2017-07-23 17:54;0;0;"From Kenya?";;;;"889242320411000836";https://twitter.com/tummycouch54/status/889242320411000836
sincerecindy02;2017-07-23 17:53;0;0;"Check out Ezra Klein's podcast interview w Dr Nneke Jones Tapia (psychologist who helps run the Cook County Jail) . Brilliant and insightful";;;;"889242150973702145";https://twitter.com/sincerecindy02/status/889242150973702145
Luke1732Mullen;2017-07-23 17:52;1;1;"Here in # California there's a # RachelDolezal lookalike @ SenKamalaHarris trying to create buzz she'll lead instead of fauxchantas @ SenWarren";;@ @;# #;"889241722932391936";https://twitter.com/Luke1732Mullen/status/889241722932391936
Mamaknits3;2017-07-23 17:50;0;0;"You know.. we are on the same side here--IF the DNC's emails weren't leaked by TRump and associates..we would have a different president now";;;;"889241275295072258";https://twitter.com/Mamaknits3/status/889241275295072258
CarissaKosta;2017-07-23 17:48;0;0;"@ SenKamalaHarris, another one killed by guns in Bakersfield today. What will you do about it? http://www.kerngoldenempire.com/news/local-news/2-shot-1-killed-in-northeast-bakersfield-shooting/772546353 … # shootatweet";;@;#;"889240824495714304";https://twitter.com/CarissaKosta/status/889240824495714304
blondieesq;2017-07-23 17:48;0;0;"@ SenKamalaHarris, another one killed by guns in Bakersfield today. What will you do about it? http://www.kerngoldenempire.com/news/local-news/2-shot-1-killed-in-northeast-bakersfield-shooting/772546353 … # shootatweet";;@;#;"889240816488787970";https://twitter.com/blondieesq/status/889240816488787970
VF_Photo;2017-07-23 17:48;0;0;"@ SenKamalaHarris, another one killed by guns in Bakersfield today. What will you do about it? http://www.kerngoldenempire.com/news/local-news/2-shot-1-killed-in-northeast-bakersfield-shooting/772546353 … # shootatweet";;@;#;"889240802983071745";https://twitter.com/VF_Photo/status/889240802983071745
lauraladida;2017-07-23 17:48;0;0;"@ SenKamalaHarris, another one killed by guns in Bakersfield today. What will you do about it? http://www.kerngoldenempire.com/news/local-news/2-shot-1-killed-in-northeast-bakersfield-shooting/772546353 … # shootatweet";;@;#;"889240802244907009";https://twitter.com/lauraladida/status/889240802244907009
slwslw790;2017-07-23 17:48;0;0;"@ SenKamalaHarris, another one killed by guns in Bakersfield today. What will you do about it? http://www.kerngoldenempire.com/news/local-news/2-shot-1-killed-in-northeast-bakersfield-shooting/772546353 … # shootatweet";;@;#;"889240780077924352";https://twitter.com/slwslw790/status/889240780077924352
time4this;2017-07-23 17:48;0;0;"@ SenKamalaHarris, another one killed by guns in Bakersfield today. What will you do about it? http://www.kerngoldenempire.com/news/local-news/2-shot-1-killed-in-northeast-bakersfield-shooting/772546353 … # shootatweet";;@;#;"889240761128161281";https://twitter.com/time4this/status/889240761128161281
jreidy;2017-07-23 17:48;0;0;"@ SenKamalaHarris, another one killed by guns in Bakersfield today. What will you do about it? http://www.kerngoldenempire.com/news/local-news/2-shot-1-killed-in-northeast-bakersfield-shooting/772546353 … # shootatweet";;@;#;"889240747840503815";https://twitter.com/jreidy/status/889240747840503815
manjulastokes;2017-07-23 17:48;0;0;"@ SenKamalaHarris, another one killed by guns in Bakersfield today. What will you do about it? http://www.kerngoldenempire.com/news/local-news/2-shot-1-killed-in-northeast-bakersfield-shooting/772546353 … # shootatweet";;@;#;"889240744288022529";https://twitter.com/manjulastokes/status/889240744288022529
forcamilo13;2017-07-23 17:48;0;0;"@ SenKamalaHarris, another one killed by guns in Bakersfield today. What will you do about it? http://www.kerngoldenempire.com/news/local-news/2-shot-1-killed-in-northeast-bakersfield-shooting/772546353 … # shootatweet";;@;#;"889240727519154178";https://twitter.com/forcamilo13/status/889240727519154178
Wendy4SD;2017-07-23 17:48;0;0;"@ SenKamalaHarris, another one killed by guns in Bakersfield today. What will you do about it? http://www.kerngoldenempire.com/news/local-news/2-shot-1-killed-in-northeast-bakersfield-shooting/772546353 … # shootatweet";;@;#;"889240712541122561";https://twitter.com/Wendy4SD/status/889240712541122561
DoriJSmith1;2017-07-23 17:48;0;0;"@ SenKamalaHarris, another one killed by guns in Bakersfield today. What will you do about it? http://www.kerngoldenempire.com/news/local-news/2-shot-1-killed-in-northeast-bakersfield-shooting/772546353 … # shootatweet";;@;#;"889240707432579072";https://twitter.com/DoriJSmith1/status/889240707432579072
peveteaux;2017-07-23 17:47;0;0;"@ SenKamalaHarris, another one killed by guns in Bakersfield today. What will you do about it? http://www.kerngoldenempire.com/news/local-news/2-shot-1-killed-in-northeast-bakersfield-shooting/772546353 … # shootatweet";;@;#;"889240696699441155";https://twitter.com/peveteaux/status/889240696699441155
TracySm14894832;2017-07-23 17:47;0;0;"@ SenKamalaHarris, another one killed by guns in Bakersfield today. What will you do about it? http://www.kerngoldenempire.com/news/local-news/2-shot-1-killed-in-northeast-bakersfield-shooting/772546353 … # shootatweet";;@;#;"889240684871503874";https://twitter.com/TracySm14894832/status/889240684871503874
PuneSaloon82;2017-07-23 17:47;0;0;"IF OUR BORDER ETC STAND UP FOR US AGAINST ELITE.MAYBE U SHOULD LISTEN. MEDIA HAS U PREJUDICED AGAINST RUSSIANS WHEN LAST ADMIN WERE FRIENDS";;;;"889240563765186560";https://twitter.com/PuneSaloon82/status/889240563765186560
Enigma462003;2017-07-23 17:46;0;0;"@ SenKamalaHarris this is a wonderful article....Run for president in 2020!!..we love you!! http://www.motherjones.com/politics/2017/07/kamala-harris-went-to-prison-so-others-wont-have-to/ …";;@;;"889240449357053953";https://twitter.com/Enigma462003/status/889240449357053953
neeseybug636;2017-07-23 17:46;7;2;"Jarred to not care about any sick child is disgusting. Hope it's not someone U love 1 day. If this bill's passed your premium will";;;;"889240413227409408";https://twitter.com/neeseybug636/status/889240413227409408
mhduff61;2017-07-23 17:46;0;0;"@ SenSchumer @ SenFeinstein @ SenFranken @ RepAdamSchiff @ SenKamalaHarris @ repjohnlewis Be ready to name him per Congress !!!https://twitter.com/brasilmagic/status/889235386303643648 …";;@ @ @ @ @ @;;"889240369963073538";https://twitter.com/mhduff61/status/889240369963073538
JW4Hillary;2017-07-23 17:46;0;0;"He couldn't beat the awfully flawed Hillary remember? Lol";;;;"889240340691132417";https://twitter.com/JW4Hillary/status/889240340691132417
JMTucker8;2017-07-23 17:46;0;0;"you seem to be the only one trying to DO something!";;;;"889240259774611456";https://twitter.com/JMTucker8/status/889240259774611456
BrixBella;2017-07-23 17:45;0;0;"Lol the ignorance";;;;"889240127775670273";https://twitter.com/BrixBella/status/889240127775670273
BrixBella;2017-07-23 17:45;0;0;"Get tf over it lol. Bye";;;;"889240025501716480";https://twitter.com/BrixBella/status/889240025501716480
Mamaknits3;2017-07-23 17:39;0;1;"I think Bernie would "wipe the floor" with -45's hairpiece in 2020 .. Bernie would have beat TRump hands down...";;;;"889238578517090304";https://twitter.com/Mamaknits3/status/889238578517090304
FletcherHoague1;2017-07-23 17:36;0;0;"Psst.. if you keep tweeting at me, I'm going to show you how offensive I can. Now leave me alone.";;;;"889237734321160193";https://twitter.com/FletcherHoague1/status/889237734321160193
riddlewinnie1;2017-07-23 17:35;0;0;"Good question! Anyone? @ AdamSchefter @ RepSwalwell @ RepSpeier @ alfranken @ SenBobCasey @ maddow @ SenFeinstein @ SenKamalaHarris @ SenSchumerhttps://twitter.com/cwnole92/status/888525513542606848 …";;@ @ @ @ @ @ @ @ @;;"889237598853640192";https://twitter.com/riddlewinnie1/status/889237598853640192
friend_feline;2017-07-23 17:33;0;1;"DISGUSTING CHOICE DISRESPECTFUL WOMAN ELITIST..DEMS NEVER LEARN";;;;"889236958655983616";https://twitter.com/friend_feline/status/889236958655983616
mexicanfoodfrea;2017-07-23 17:32;0;0;"McConnell stole Gorsuch appointment from Obama. Gorsuch replaced Scalia. Real damage comes if GOP gets 2 replace Kennedy &/or Ginsburg.";;;;"889236750832414724";https://twitter.com/mexicanfoodfrea/status/889236750832414724
PolitJunkieM;2017-07-23 17:31;1;3;"This is an example of what "junk" insurance is/does!pic.twitter.com/QL6xVWlKFu";;;;"889236651322552320";https://twitter.com/PolitJunkieM/status/889236651322552320
erikschoen1;2017-07-23 17:31;0;0;"@ RepAdamSchiff @ MaxineWalters @ jahimes @ RepSwalwell @ MarkWarner @ SenTomCotton @ SenKamalaHarris @ SenFeinstein @ TGowdySCpic.twitter.com/0jaBxWlVmo";;@ @ @ @ @ @ @ @ @;;"889236591557869570";https://twitter.com/erikschoen1/status/889236591557869570
cadeduelg;2017-07-23 17:31;0;1;"He should try not being selfish and support @ SenKamalaHarris in 2020";;@;;"889236510976860160";https://twitter.com/cadeduelg/status/889236510976860160
Bosch_virgogirl;2017-07-23 17:30;0;0;"So if you had cancer as a pre existing condition, would you still say this?";;;;"889236421583806466";https://twitter.com/Bosch_virgogirl/status/889236421583806466
Mischief_macher;2017-07-23 17:30;0;1;"Sure there is junk insurance. I had it in 1985 through previous employer -- and I couldn't afford an office visit @$60 "copay."";;@;;"889236400108961793";https://twitter.com/Mischief_macher/status/889236400108961793
WashTimes;2017-07-23 17:30;9;11;"# RapidReactions by @ ckchumley: @ SenKamalaHarris: @ EricHolder in a skirt http://ow.ly/dJy230dKNDu";;@ @ @;#;"889236205518422018";https://twitter.com/WashTimes/status/889236205518422018
WashTimesOpEd;2017-07-23 17:30;1;1;"# RapidReactions by @ ckchumley: @ SenKamalaHarris: @ EricHolder in a skirt http://ow.ly/dJy230dKNDu";;@ @ @;#;"889236199377948673";https://twitter.com/WashTimesOpEd/status/889236199377948673
pantheraMz;2017-07-23 17:29;0;0;"Why is Kushner not going to be under oath? @ AdamSchiffCA @ MarkWarner @ SenKamalaHarris @ tedlieu @ SenFeinstein @ ChrisMurphyCT @ SenatorDurbin";;@ @ @ @ @ @ @;;"889236001671000068";https://twitter.com/pantheraMz/status/889236001671000068
vgliatti;2017-07-23 17:27;0;0;"Envy you! We have @ marcorubio and @ RepGusBilirakis who do not have the backbone to stand up to their voter base or Trump!";;@ @;;"889235514519420928";https://twitter.com/vgliatti/status/889235514519420928
ChandlerJReece;2017-07-23 17:26;0;0;"I think that a defendant should only be forced to weekly report to a probation officer to ensure that the defendant is not on the run";;;;"889235244590780416";https://twitter.com/ChandlerJReece/status/889235244590780416
grandoftwo;2017-07-23 17:25;0;1;"The SCOTUS is fucked for the next thirty or more years!! People and their blinders! # SMDH";;;#;"889235141259923461";https://twitter.com/grandoftwo/status/889235141259923461
DianeinCA;2017-07-23 17:23;0;0;"@ SenKamalaHarris Does anyone care how much Trump is milking the US treasury to upgrade all his private properties for security?";;@;;"889234526391513088";https://twitter.com/DianeinCA/status/889234526391513088
SarevokShepard;2017-07-23 17:23;0;0;"And I don't like Kamala Harris cozying up to Rand Paul.";;;;"889234486189314048";https://twitter.com/SarevokShepard/status/889234486189314048
blade3952;2017-07-23 17:21;1;1;"@ SenSchumer @ RepAdamSchiff @ SenAlexander @ SenKamalaHarris @ SenWarrenhttps://twitter.com/billjryan/status/889233409742077958 …";;@ @ @ @ @;;"889233974899486725";https://twitter.com/blade3952/status/889233974899486725
aeiouxyz;2017-07-23 17:21;0;0;"As not and";;;;"889233927768072197";https://twitter.com/aeiouxyz/status/889233927768072197
aeiouxyz;2017-07-23 17:20;0;0;"If you decide to run (have you?) would you consider Watts and running mate?";;;;"889233808582684672";https://twitter.com/aeiouxyz/status/889233808582684672
santamonicamoe;2017-07-23 17:20;0;0;"@ SenKamalaHarris @ SenAngusKing @ MarkWarner @ SenFeinstein @ SenateGOP @ HouseGOP @ SenateDems @ HouseDemocrats @ RepAdamSchiff @ AGSchneidermanhttps://twitter.com/JamesFourM/status/862006205048344577 …";;@ @ @ @ @ @ @ @ @ @;;"889233806137241600";https://twitter.com/santamonicamoe/status/889233806137241600
owenbernard;2017-07-23 17:20;2;2;"# TrumPutinCorruption at its finest http://www.thedailybeast.com/team-trump-used-obamacare-money-to-run-ads-against-it … @ SenKamalaHarris @ SenSchumer @ SenWarren @ MaddowBlog # AMJoy";;@ @ @ @;# #;"889233739678715905";https://twitter.com/owenbernard/status/889233739678715905
helpbondme;2017-07-23 17:18;0;0;"I hope it includes the use of technology. @ helpbondme";;@;;"889233293866094592";https://twitter.com/helpbondme/status/889233293866094592
tibehtblanco;2017-07-23 17:17;0;0;"https://www.brennancenter.org/analysis/voting-laws-roundup-2017 … Can you EXPLAIN this to me @ SenKamalaHarris °° Who is AFRAID of losing @ HouseGOP";;@ @;;"889232943016808449";https://twitter.com/tibehtblanco/status/889232943016808449
SharonDFletcher;2017-07-23 17:17;0;0;"Nice to see both sides working together for rhe people! More please!";;;;"889232912163508224";https://twitter.com/SharonDFletcher/status/889232912163508224
santamonicamoe;2017-07-23 17:15;0;0;"@ SenateGOP @ HouseGOP @ SenateDems @ HouseDemocrats @ RepAdamSchiff @ AGSchneiderman @ tedlieu @ maddow @ SenKamalaHarris @ MarkWarner @ SenFeinsteinhttps://twitter.com/Khanoisseur/status/889229990360825857 …";;@ @ @ @ @ @ @ @ @ @ @;;"889232541927919616";https://twitter.com/santamonicamoe/status/889232541927919616
GayEqualGlobal;2017-07-23 17:12;1;1;"# RemoveTrumpNow @NancyPelosi @ MaxineWaters @ SenWarren @ SenGillibrand @ SenKamalaHarris @ clairecmc @ senFeinstein @ SenFranken https://twitter.com/JoyAnnReid/status/889078307827982337 …";;@NancyPelosi @ @ @ @ @ @ @;#;"889231760344657920";https://twitter.com/GayEqualGlobal/status/889231760344657920
MirthDAL;2017-07-23 17:12;0;0;"@ SenFeinstein @ SenSanders @ SenWarren @ SenKamalaHarris @ RepZoeLofgren @ RepAnnaEshoo Can you fix this?https://twitter.com/beauwillimon/status/888788899161681920 …";;@ @ @ @ @ @;;"889231653176053760";https://twitter.com/MirthDAL/status/889231653176053760
erikschoen1;2017-07-23 17:09;0;0;"@ RepAdamSchiff @ MaxineWalters @ jahimes @ RepSwalwell @ MarkWarner @ SenTomCotton @ SenKamalaHarris @ SenFeinstein @ TGowdySCpic.twitter.com/QGt7ln3EKN";;@ @ @ @ @ @ @ @ @;;"889231071346294784";https://twitter.com/erikschoen1/status/889231071346294784
Refinery29;2017-07-23 17:07;48;158;". @ SenKamalaHarris is our hero. She fights for what she believes in and inspires us all. pic.twitter.com/KYancAY6TY";;@;;"889230391478951936";https://twitter.com/Refinery29/status/889230391478951936
alanrpryor;2017-07-23 17:06;1;2;"And where do you stand on # SB562 here in Calif. @ SenKamalaHarris ?";;@;#;"889230349284253696";https://twitter.com/alanrpryor/status/889230349284253696
kathleenn;2017-07-23 17:06;21;104;"How about U call Senators & tell them to # FixACA for YOU. Or u could buy some cheap junk health insurance that 45 sells";;;#;"889230267679780864";https://twitter.com/kathleenn/status/889230267679780864
84stillcounting;2017-07-23 17:05;0;1;"Wow ! Many thanks to you and to @ RandPaul Many families will appreciate having this onus lifted from their already over loaded shoulders.";;@;;"889230016374034432";https://twitter.com/84stillcounting/status/889230016374034432
neeseybug636;2017-07-23 16:57;3;7;"Call your Senator and ask them to FIX it! They can fix it they just don't want to! Your premiums are going up because of their threats!";;;;"889228101099683842";https://twitter.com/neeseybug636/status/889228101099683842
shuster_lana;2017-07-23 16:57;0;0;"You are such a remarkable woman, Senator. You make America so proud to have such a strong intellectual woman in the Senate.Bless you always";;;;"889227959395119105";https://twitter.com/shuster_lana/status/889227959395119105
CoziTiger;2017-07-23 16:53;0;0;"No! @ SenKamalaHarris is a # WallSt We in CA know! @ TheDemocrats Could Kamala Harris revive fractured Dem party 2020? https://www.theguardian.com/us-news/2017/jul/22/kamala-harris-2020-election-democratic-party?CMP=share_btn_tw …";;@ @;#;"889227095292891136";https://twitter.com/CoziTiger/status/889227095292891136
Bidnezz;2017-07-23 16:51;0;0;"Thank you.";;;;"889226575320944641";https://twitter.com/Bidnezz/status/889226575320944641
mexicanfoodfrea;2017-07-23 16:51;1;0;"I think there is enough anger over Bernie's recent comments and concern about his age that this hypothetical is highly unlikely. (2";;;;"889226573395656704";https://twitter.com/mexicanfoodfrea/status/889226573395656704
mexicanfoodfrea;2017-07-23 16:49;0;4;"I completely understand your anger. But I don't want to burden next generation w more GOP SCOTUS appointments, voter suppression & greed. (1";;;;"889226030141116416";https://twitter.com/mexicanfoodfrea/status/889226030141116416
clairmail;2017-07-23 16:49;0;0;"I usually agree with you but...two children might still be alive if judge had not reduced bail... http://www.eastbaytimes.com/2017/07/21/suspect-in-concord-crash-that-killed-two-boys-enters-plea/ … via @ eastbaytimes";;@;;"889225980211994624";https://twitter.com/clairmail/status/889225980211994624
FletcherHoague1;2017-07-23 16:49;0;0;"EDUCATION. MORE AFFORDABLE.";;;;"889225864570974208";https://twitter.com/FletcherHoague1/status/889225864570974208
NastyOldWoman;2017-07-23 16:46;0;0;"cc: @ TomPerez @ SenSchumer @ donnabrazile @NancyPelosi @ SenKamalaHarris https://twitter.com/SarahLerner/status/889223854320570368 …";;@ @ @ @NancyPelosi @;;"889225267683540996";https://twitter.com/NastyOldWoman/status/889225267683540996
Misssoulac1;2017-07-23 16:44;0;0;"you are what is wrong this country. Stop inflaming the crazies.";;;;"889224842880446464";https://twitter.com/Misssoulac1/status/889224842880446464
sjslaxdaddy;2017-07-23 16:43;0;0;"http://www.thegatewaypundit.com/2017/07/wow-democrats-block-press-covering-maxine-waters-new-hampshire-event/ …";;;;"889224532476735492";https://twitter.com/sjslaxdaddy/status/889224532476735492
joqatana;2017-07-23 16:42;0;0;"Maybe have a chat with the good doctor about his conscience?";;;;"889224230667075584";https://twitter.com/joqatana/status/889224230667075584
existingtoday;2017-07-23 16:41;0;0;"Thank you!";;;;"889223901577981953";https://twitter.com/existingtoday/status/889223901577981953
TwilightLaPush;2017-07-23 16:40;0;2;"1ST6monthBLOTUSupdate @ SenKamalaHarris @ SenSanders @ TulsiGabbard @ WesleyStudi @ fakeconsultant @ ihikapalaumaewahttps://twitter.com/rbreich/status/889174478722220032 …";;@ @ @ @ @ @;;"889223803846275072";https://twitter.com/TwilightLaPush/status/889223803846275072
grandoftwo;2017-07-23 16:38;1;16;"I'm NEVER VOTING FOR BERNIE! We wouldn't have Gorsuch if not for Bernie.";;;;"889223335959199744";https://twitter.com/grandoftwo/status/889223335959199744
notjustaudra;2017-07-23 16:38;0;0;"@ SenKamalaHarris @ SenFeinstein @ SenMajLdr @ RepSwalwell @ SpeakerRyan every. kid. deserves. healthcare. @ jimmykimmel consider them remindedhttps://twitter.com/jimmykimmel/status/888499466138918912 …";;@ @ @ @ @ @;;"889223334793183235";https://twitter.com/notjustaudra/status/889223334793183235
SharonNplz;2017-07-23 16:38;0;0;"@ SenKamalaHarris Ummmmmm....just no. # MAGA";;@;#;"889223117150801921";https://twitter.com/SharonNplz/status/889223117150801921
GarletterLee;2017-07-23 16:36;0;0;"Mindfully being a prosecuting attorney even (District Attorney in S.F. : as well the U S. Atty Gen of Calif , know the bail system.";;;;"889222804117303298";https://twitter.com/GarletterLee/status/889222804117303298
